dropped privs to tcpdump
tcpdump: verbose output suppressed, use -v[v]... for full protocol decode
listening on eth0, link-type EN10MB (Ethernet), snapshot length 262144 bytes
14:21:02.380158 IP 46.31.27.36.63782 > 216.219.95.164.47291: UDP, length 81
14:21:02.380160 IP 46.31.27.36.63782 > 216.219.95.164.47291: UDP, length 129
14:21:02.380370 IP 46.31.27.36.63782 > 216.219.95.164.47291: UDP, length 129
14:21:02.380371 IP 46.31.27.36.63782 > 216.219.95.164.47291: UDP, length 129
14:21:02.380372 IP 46.31.27.36.63782 > 216.219.95.164.47291: UDP, length 113
14:21:02.380445 IP 46.31.27.36.63782 > 216.219.95.164.47291: UDP, length 129
14:21:02.380446 IP 46.31.27.36.63782 > 216.219.95.164.47291: UDP, length 129
14:21:02.380872 IP 46.31.27.36.63782 > 216.219.95.164.47291: UDP, length 129
14:21:02.380873 IP 46.31.27.36.63782 > 216.219.95.164.47291: UDP, length 97
14:21:02.380874 IP 46.31.27.36.63782 > 216.219.95.164.47291: UDP, length 81
14:21:02.380969 IP 46.31.27.36.63782 > 216.219.95.164.47291: UDP, length 113
14:21:02.380970 IP 46.31.27.36.63782 > 216.219.95.164.47291: UDP, length 129
14:21:02.380970 IP 46.31.27.36.63782 > 216.219.95.164.47291: UDP, length 129
14:21:02.380971 IP 46.31.27.36.63782 > 216.219.95.164.47291: UDP, length 129
14:21:02.380972 IP 46.31.27.36.63782 > 216.219.95.164.47291: UDP, length 81
14:21:02.380972 IP 46.31.27.36.63782 > 216.219.95.164.47291: UDP, length 81
14:21:02.381068 IP 46.31.27.36.63782 > 216.219.95.164.47291: UDP, length 129
14:21:02.381095 IP 46.31.27.36.63782 > 216.219.95.164.47291: UDP, length 129
14:21:02.381178 IP 46.31.27.36.63782 > 216.219.95.164.47291: UDP, length 129
14:21:02.381179 IP 46.31.27.36.63782 > 216.219.95.164.47291: UDP, length 113
14:21:02.381216 IP 46.31.27.36.63782 > 216.219.95.164.47291: UDP, length 97
14:21:02.381217 IP 46.31.27.36.63782 > 216.219.95.164.47291: UDP, length 81
14:21:02.381218 IP 46.31.27.36.63782 > 216.219.95.164.47291: UDP, length 97
14:21:02.381219 IP 46.31.27.36.63782 > 216.219.95.164.47291: UDP, length 81
14:21:02.381903 IP 46.31.27.36.63782 > 216.219.95.164.47291: UDP, length 81
14:21:02.381904 IP 46.31.27.36.63782 > 216.219.95.164.47291: UDP, length 113
14:21:02.381905 IP 46.31.27.36.63782 > 216.219.95.164.47291: UDP, length 97
14:21:02.382021 IP 46.31.27.36.63782 > 216.219.95.164.47291: UDP, length 97
14:21:02.382022 IP 46.31.27.36.63782 > 216.219.95.164.47291: UDP, length 81
14:21:02.382210 IP 46.31.27.36.63782 > 216.219.95.164.47291: UDP, length 97
14:21:02.382211 IP 46.31.27.36.63782 > 216.219.95.164.47291: UDP, length 81
14:21:02.382315 IP 46.31.27.36.63782 > 216.219.95.164.47291: UDP, length 113
14:21:02.477234 IP 216.219.95.164.47291 > 46.31.27.36.63782: UDP, length 97
14:21:02.490635 IP 216.219.95.164.47291 > 46.31.27.36.63782: UDP, length 209
14:21:02.498850 IP 216.219.95.164.47291 > 46.31.27.36.63782: UDP, length 305
14:21:02.506201 IP 216.219.95.164.47291 > 46.31.27.36.63782: UDP, length 97
14:21:02.513409 IP 216.219.95.164.47291 > 46.31.27.36.63782: UDP, length 209
14:21:02.524228 IP 216.219.95.164.47291 > 46.31.27.36.63782: UDP, length 129
14:21:02.530203 IP 216.219.95.164.47291 > 46.31.27.36.63782: UDP, length 97
14:21:02.548616 IP 216.219.95.164.47291 > 46.31.27.36.63782: UDP, length 209
14:21:02.554728 IP 216.219.95.164.47291 > 46.31.27.36.63782: UDP, length 161
14:21:02.560837 IP 216.219.95.164.47291 > 46.31.27.36.63782: UDP, length 129
14:21:02.567273 IP 216.219.95.164.47291 > 46.31.27.36.63782: UDP, length 161
14:21:02.573265 IP 216.219.95.164.47291 > 46.31.27.36.63782: UDP, length 129
14:21:02.579572 IP 216.219.95.164.47291 > 46.31.27.36.63782: UDP, length 97
14:21:02.586908 IP 216.219.95.164.47291 > 46.31.27.36.63782: UDP, length 209
14:21:02.593105 IP 216.219.95.164.47291 > 46.31.27.36.63782: UDP, length 305
14:21:02.599420 IP 216.219.95.164.47291 > 46.31.27.36.63782: UDP, length 161
14:21:02.604586 IP 216.219.95.164.47291 > 46.31.27.36.63782: UDP, length 129
14:21:02.609362 IP 216.219.95.164.47291 > 46.31.27.36.63782: UDP, length 161
14:21:02.615532 IP 216.219.95.164.47291 > 46.31.27.36.63782: UDP, length 97
14:21:02.621611 IP 216.219.95.164.47291 > 46.31.27.36.63782: UDP, length 209
14:21:02.644618 IP 46.31.27.36.63782 > 216.219.95.164.47291: UDP, length 97
14:21:02.649837 IP 216.219.95.164.47291 > 46.31.27.36.63782: UDP, length 241
14:21:02.664185 IP 46.31.27.36.63782 > 216.219.95.164.47291: UDP, length 81
14:21:02.695793 IP 46.31.27.36.63782 > 216.219.95.164.47291: UDP, length 81
14:21:02.700735 IP 216.219.95.164.47291 > 46.31.27.36.63782: UDP, length 81
14:21:02.711433 IP 216.219.95.164.47291 > 46.31.27.36.63782: UDP, length 81
14:21:02.726664 IP 46.31.27.36.63782 > 216.219.95.164.47291: UDP, length 81
14:21:02.727230 IP 46.31.27.36.63782 > 216.219.95.164.47291: UDP, length 81
14:21:02.739527 IP 216.219.95.164.47291 > 46.31.27.36.63782: UDP, length 81
14:21:02.740902 IP 216.219.95.164.47291 > 46.31.27.36.63782: UDP, length 81
14:21:02.822412 IP 46.31.27.36.63782 > 216.219.95.164.47291: UDP, length 81
14:21:02.826613 IP 216.219.95.164.47291 > 46.31.27.36.63782: UDP, length 81
14:21:02.872309 IP 46.31.27.36.63782 > 216.219.95.164.47291: UDP, length 65
14:21:02.872817 IP 46.31.27.36.63782 > 216.219.95.164.47291: UDP, length 289
14:21:02.882848 IP 46.31.27.36.63782 > 216.219.95.164.47291: UDP, length 65
14:21:02.883141 IP 46.31.27.36.63782 > 216.219.95.164.47291: UDP, length 1329
14:21:02.883143 IP 46.31.27.36.63782 > 216.219.95.164.47291: UDP, length 513
14:21:02.883808 IP 216.219.95.164.47291 > 46.31.27.36.63782: UDP, length 65
14:21:02.887680 IP 216.219.95.164.47291 > 46.31.27.36.63782: UDP, length 65
14:21:02.898722 IP 216.219.95.164.47291 > 46.31.27.36.63782: UDP, length 65
14:21:02.902967 IP 216.219.95.164.47291 > 46.31.27.36.63782: UDP, length 65
14:21:02.905758 IP 216.219.95.164.47291 > 46.31.27.36.63782: UDP, length 65
14:21:02.910359 IP 46.31.27.36.63782 > 216.219.95.164.47291: UDP, length 65
14:21:02.911279 IP 46.31.27.36.63782 > 216.219.95.164.47291: UDP, length 241
14:21:02.911907 IP 46.31.27.36.63782 > 216.219.95.164.47291: UDP, length 65
14:21:02.912219 IP 46.31.27.36.63782 > 216.219.95.164.47291: UDP, length 241
14:21:02.934634 IP 46.31.27.36.63782 > 216.219.95.164.47291: UDP, length 193
14:21:02.998081 IP 46.31.27.36.63782 > 216.219.95.164.47291: UDP, length 65
14:21:02.998663 IP 46.31.27.36.63782 > 216.219.95.164.47291: UDP, length 225
14:21:03.001846 IP 216.219.95.164.47291 > 46.31.27.36.63782: UDP, length 65
14:21:03.006425 IP 216.219.95.164.47291 > 46.31.27.36.63782: UDP, length 65
14:21:03.070572 IP 46.31.27.36.63782 > 216.219.95.164.47291: UDP, length 81
14:21:03.081201 IP 216.219.95.164.47291 > 46.31.27.36.63782: UDP, length 81
14:21:03.252180 IP 46.31.27.36.63782 > 216.219.95.164.47291: UDP, length 65
14:21:03.252550 IP 46.31.27.36.63782 > 216.219.95.164.47291: UDP, length 1329
14:21:03.252685 IP 46.31.27.36.63782 > 216.219.95.164.47291: UDP, length 545
14:21:03.286586 IP 216.219.95.164.47291 > 46.31.27.36.63782: UDP, length 65
14:21:03.287920 IP 216.219.95.164.47291 > 46.31.27.36.63782: UDP, length 65
14:21:03.288027 IP 216.219.95.164.47291 > 46.31.27.36.63782: UDP, length 65
14:21:03.393404 IP 46.31.27.36.63782 > 216.219.95.164.47291: UDP, length 241
14:21:03.404523 IP 46.31.27.36.63782 > 216.219.95.164.47291: UDP, length 241
14:21:03.996234 IP 46.31.27.36.63782 > 216.219.95.164.47291: UDP, length 241
14:21:04.027842 IP 46.31.27.36.63782 > 216.219.95.164.47291: UDP, length 241
14:21:05.105976 IP 46.31.27.36.63782 > 216.219.95.164.47291: UDP, length 241
14:21:05.151914 IP 46.31.27.36.63782 > 216.219.95.164.47291: UDP, length 241
14:21:05.948562 IP 46.31.27.36.63782 > 216.219.95.164.47291: UDP, length 193
14:21:06.066746 IP 46.31.27.36.63782 > 216.219.95.164.47291: UDP, length 81
14:21:06.073092 IP 216.219.95.164.47291 > 46.31.27.36.63782: UDP, length 81
14:21:06.245320 IP 46.31.27.36.63782 > 216.219.95.164.47291: UDP, length 65
14:21:06.246233 IP 46.31.27.36.63782 > 216.219.95.164.47291: UDP, length 289
14:21:06.254852 IP 216.219.95.164.47291 > 46.31.27.36.63782: UDP, length 65
14:21:06.261178 IP 216.219.95.164.47291 > 46.31.27.36.63782: UDP, length 65
14:21:07.314499 IP 46.31.27.36.63782 > 216.219.95.164.47291: UDP, length 241
14:21:07.347757 IP 46.31.27.36.63782 > 216.219.95.164.47291: UDP, length 81
14:21:07.355916 IP 216.219.95.164.47291 > 46.31.27.36.63782: UDP, length 193
14:21:07.377618 IP 46.31.27.36.63782 > 216.219.95.164.47291: UDP, length 241
14:21:07.528133 IP 46.31.27.36.63782 > 216.219.95.164.47291: UDP, length 81
14:21:07.537779 IP 216.219.95.164.47291 > 46.31.27.36.63782: UDP, length 81
14:21:07.709617 IP 46.31.27.36.63782 > 216.219.95.164.47291: UDP, length 65
14:21:07.711391 IP 46.31.27.36.63782 > 216.219.95.164.47291: UDP, length 161
14:21:07.718938 IP 216.219.95.164.47291 > 46.31.27.36.63782: UDP, length 65
14:21:07.719024 IP 216.219.95.164.47291 > 46.31.27.36.63782: UDP, length 65
14:21:08.961110 IP 46.31.27.36.63782 > 216.219.95.164.47291: UDP, length 193
14:21:09.448813 IP 46.31.27.36.63782 > 216.219.95.164.47291: UDP, length 81
14:21:09.459980 IP 216.219.95.164.47291 > 46.31.27.36.63782: UDP, length 81
14:21:09.532405 IP 46.31.27.36.63782 > 216.219.95.164.47291: UDP, length 241
14:21:09.611442 IP 46.31.27.36.63782 > 216.219.95.164.47291: UDP, length 241
14:21:09.630785 IP 46.31.27.36.63782 > 216.219.95.164.47291: UDP, length 65
14:21:09.631500 IP 46.31.27.36.63782 > 216.219.95.164.47291: UDP, length 289
14:21:09.639426 IP 216.219.95.164.47291 > 46.31.27.36.63782: UDP, length 65
14:21:09.641738 IP 216.219.95.164.47291 > 46.31.27.36.63782: UDP, length 65
14:21:09.660780 IP 46.31.27.36.63782 > 216.219.95.164.47291: UDP, length 113
14:21:09.660882 IP 46.31.27.36.63782 > 216.219.95.164.47291: UDP, length 81
14:21:09.660883 IP 46.31.27.36.63782 > 216.219.95.164.47291: UDP, length 113
14:21:09.668721 IP 216.219.95.164.47291 > 46.31.27.36.63782: UDP, length 385
14:21:09.672371 IP 216.219.95.164.47291 > 46.31.27.36.63782: UDP, length 401
14:21:09.740208 IP 216.219.95.164.47291 > 46.31.27.36.63782: UDP, length 81
14:21:09.911253 IP 46.31.27.36.63782 > 216.219.95.164.47291: UDP, length 65
14:21:09.911476 IP 46.31.27.36.63782 > 216.219.95.164.47291: UDP, length 289
14:21:09.985319 IP 216.219.95.164.47291 > 46.31.27.36.63782: UDP, length 65
14:21:09.991250 IP 216.219.95.164.47291 > 46.31.27.36.63782: UDP, length 65
14:21:10.704713 IP 46.31.27.36.63782 > 216.219.95.164.47291: UDP, length 81
14:21:10.705418 IP 46.31.27.36.63782 > 216.219.95.164.47291: UDP, length 97
14:21:10.705584 IP 46.31.27.36.63782 > 216.219.95.164.47291: UDP, length 97
14:21:10.718103 IP 216.219.95.164.47291 > 46.31.27.36.63782: UDP, length 273
14:21:10.718175 IP 216.219.95.164.47291 > 46.31.27.36.63782: UDP, length 225
14:21:10.869268 IP 216.219.95.164.47291 > 46.31.27.36.63782: UDP, length 81
14:21:11.039662 IP 46.31.27.36.63782 > 216.219.95.164.47291: UDP, length 65
14:21:11.040158 IP 46.31.27.36.63782 > 216.219.95.164.47291: UDP, length 289
14:21:11.209641 IP 216.219.95.164.47291 > 46.31.27.36.63782: UDP, length 65
14:21:11.573826 IP 46.31.27.36.63782 > 216.219.95.164.47291: UDP, length 81
14:21:11.577702 IP 216.219.95.164.47291 > 46.31.27.36.63782: UDP, length 97
14:21:11.739858 IP 46.31.27.36.63782 > 216.219.95.164.47291: UDP, length 241
14:21:11.749144 IP 46.31.27.36.63782 > 216.219.95.164.47291: UDP, length 81
14:21:11.754493 IP 216.219.95.164.47291 > 46.31.27.36.63782: UDP, length 81
14:21:11.833847 IP 46.31.27.36.63782 > 216.219.95.164.47291: UDP, length 241
14:21:11.927455 IP 46.31.27.36.63782 > 216.219.95.164.47291: UDP, length 65
14:21:11.927650 IP 46.31.27.36.63782 > 216.219.95.164.47291: UDP, length 1329
14:21:11.927676 IP 46.31.27.36.63782 > 216.219.95.164.47291: UDP, length 593
14:21:11.937698 IP 216.219.95.164.47291 > 46.31.27.36.63782: UDP, length 65
14:21:11.940189 IP 216.219.95.164.47291 > 46.31.27.36.63782: UDP, length 65
14:21:11.940319 IP 216.219.95.164.47291 > 46.31.27.36.63782: UDP, length 65
14:21:11.977629 IP 46.31.27.36.63782 > 216.219.95.164.47291: UDP, length 193
14:21:12.109167 IP 46.31.27.36.63782 > 216.219.95.164.47291: UDP, length 81
14:21:12.111681 IP 216.219.95.164.47291 > 46.31.27.36.63782: UDP, length 81
14:21:12.241843 IP 46.31.27.36.63782 > 216.219.95.164.47291: UDP, length 81
14:21:12.282336 IP 46.31.27.36.63782 > 216.219.95.164.47291: UDP, length 65
14:21:12.283239 IP 46.31.27.36.63782 > 216.219.95.164.47291: UDP, length 1329
14:21:12.283279 IP 46.31.27.36.63782 > 216.219.95.164.47291: UDP, length 625
14:21:12.291922 IP 216.219.95.164.47291 > 46.31.27.36.63782: UDP, length 65
14:21:12.292051 IP 216.219.95.164.47291 > 46.31.27.36.63782: UDP, length 65
14:21:12.292094 IP 216.219.95.164.47291 > 46.31.27.36.63782: UDP, length 65
14:21:12.312757 IP 216.219.95.164.47291 > 46.31.27.36.63782: UDP, length 81
14:21:12.377750 IP 46.31.27.36.63782 > 216.219.95.164.47291: UDP, length 33
14:21:12.484358 IP 46.31.27.36.63782 > 216.219.95.164.47291: UDP, length 65
14:21:12.485075 IP 46.31.27.36.63782 > 216.219.95.164.47291: UDP, length 257
14:21:12.556112 IP 216.219.95.164.47291 > 46.31.27.36.63782: UDP, length 65
14:21:12.556169 IP 216.219.95.164.47291 > 46.31.27.36.63782: UDP, length 65
14:21:12.825195 IP 46.31.27.36.63782 > 216.219.95.164.47291: UDP, length 81
14:21:12.832312 IP 216.219.95.164.47291 > 46.31.27.36.63782: UDP, length 81
14:21:12.903837 IP 46.31.27.36.63782 > 216.219.95.164.47291: UDP, length 81
14:21:12.904687 IP 46.31.27.36.63782 > 216.219.95.164.47291: UDP, length 113
14:21:12.915351 IP 216.219.95.164.47291 > 46.31.27.36.63782: UDP, length 113
14:21:12.915477 IP 216.219.95.164.47291 > 46.31.27.36.63782: UDP, length 289
14:21:13.005943 IP 46.31.27.36.63782 > 216.219.95.164.47291: UDP, length 65
14:21:13.006423 IP 46.31.27.36.63782 > 216.219.95.164.47291: UDP, length 289
14:21:13.010383 IP 216.219.95.164.47291 > 46.31.27.36.63782: UDP, length 65
14:21:13.010470 IP 216.219.95.164.47291 > 46.31.27.36.63782: UDP, length 65
14:21:13.087994 IP 46.31.27.36.63782 > 216.219.95.164.47291: UDP, length 1297
14:21:13.088746 IP 46.31.27.36.63782 > 216.219.95.164.47291: UDP, length 1297
14:21:13.089513 IP 46.31.27.36.63782 > 216.219.95.164.47291: UDP, length 1297
14:21:13.089533 IP 46.31.27.36.63782 > 216.219.95.164.47291: UDP, length 1297
14:21:13.089536 IP 46.31.27.36.63782 > 216.219.95.164.47291: UDP, length 129
14:21:13.108293 IP 216.219.95.164.47291 > 46.31.27.36.63782: UDP, length 1249
14:21:13.108420 IP 216.219.95.164.47291 > 46.31.27.36.63782: UDP, length 1249
14:21:13.108527 IP 216.219.95.164.47291 > 46.31.27.36.63782: UDP, length 97
14:21:13.108646 IP 216.219.95.164.47291 > 46.31.27.36.63782: UDP, length 1249
14:21:13.108747 IP 216.219.95.164.47291 > 46.31.27.36.63782: UDP, length 1249
14:21:13.108851 IP 216.219.95.164.47291 > 46.31.27.36.63782: UDP, length 1249
14:21:13.108980 IP 216.219.95.164.47291 > 46.31.27.36.63782: UDP, length 1073
14:21:13.109092 IP 216.219.95.164.47291 > 46.31.27.36.63782: UDP, length 1297
14:21:13.109194 IP 216.219.95.164.47291 > 46.31.27.36.63782: UDP, length 1297
14:21:13.110559 IP 216.219.95.164.47291 > 46.31.27.36.63782: UDP, length 1297
14:21:13.110674 IP 216.219.95.164.47291 > 46.31.27.36.63782: UDP, length 1297
14:21:13.110778 IP 216.219.95.164.47291 > 46.31.27.36.63782: UDP, length 161
14:21:13.134001 IP 46.31.27.36.63782 > 216.219.95.164.47291: UDP, length 81
14:21:13.134002 IP 46.31.27.36.63782 > 216.219.95.164.47291: UDP, length 81
14:21:13.192594 IP 46.31.27.36.63782 > 216.219.95.164.47291: UDP, length 97
14:21:13.281821 IP 46.31.27.36.63782 > 216.219.95.164.47291: UDP, length 1297
14:21:13.281824 IP 46.31.27.36.63782 > 216.219.95.164.47291: UDP, length 113
14:21:13.281953 IP 46.31.27.36.63782 > 216.219.95.164.47291: UDP, length 1297
14:21:13.282053 IP 46.31.27.36.63782 > 216.219.95.164.47291: UDP, length 209
14:21:13.282181 IP 46.31.27.36.63782 > 216.219.95.164.47291: UDP, length 801
14:21:13.282183 IP 46.31.27.36.63782 > 216.219.95.164.47291: UDP, length 145
14:21:13.282184 IP 46.31.27.36.63782 > 216.219.95.164.47291: UDP, length 129
14:21:13.282247 IP 46.31.27.36.63782 > 216.219.95.164.47291: UDP, length 817
14:21:13.342600 IP 216.219.95.164.47291 > 46.31.27.36.63782: UDP, length 97
14:21:13.342740 IP 216.219.95.164.47291 > 46.31.27.36.63782: UDP, length 145
14:21:13.342861 IP 216.219.95.164.47291 > 46.31.27.36.63782: UDP, length 193
14:21:13.354441 IP 216.219.95.164.47291 > 46.31.27.36.63782: UDP, length 1041
14:21:13.354552 IP 216.219.95.164.47291 > 46.31.27.36.63782: UDP, length 177
14:21:13.357094 IP 216.219.95.164.47291 > 46.31.27.36.63782: UDP, length 81
14:21:13.360727 IP 216.219.95.164.47291 > 46.31.27.36.63782: UDP, length 481
14:21:13.360794 IP 216.219.95.164.47291 > 46.31.27.36.63782: UDP, length 97
14:21:13.360845 IP 216.219.95.164.47291 > 46.31.27.36.63782: UDP, length 81
14:21:13.360918 IP 216.219.95.164.47291 > 46.31.27.36.63782: UDP, length 81
14:21:13.364937 IP 216.219.95.164.47291 > 46.31.27.36.63782: UDP, length 113
14:21:13.367473 IP 216.219.95.164.47291 > 46.31.27.36.63782: UDP, length 81
14:21:13.427064 IP 216.219.95.164.47291 > 46.31.27.36.63782: UDP, length 753
14:21:13.427126 IP 216.219.95.164.47291 > 46.31.27.36.63782: UDP, length 209
14:21:13.514670 IP 46.31.27.36.63782 > 216.219.95.164.47291: UDP, length 81
14:21:13.514794 IP 46.31.27.36.63782 > 216.219.95.164.47291: UDP, length 81
14:21:13.514813 IP 46.31.27.36.63782 > 216.219.95.164.47291: UDP, length 81
14:21:13.524236 IP 216.219.95.164.47291 > 46.31.27.36.63782: UDP, length 65
14:21:13.525616 IP 46.31.27.36.63782 > 216.219.95.164.47291: UDP, length 81
14:21:13.532220 IP 46.31.27.36.63782 > 216.219.95.164.47291: UDP, length 97
14:21:13.532361 IP 46.31.27.36.63782 > 216.219.95.164.47291: UDP, length 97
14:21:13.535313 IP 46.31.27.36.63782 > 216.219.95.164.47291: UDP, length 97
14:21:13.537751 IP 216.219.95.164.47291 > 46.31.27.36.63782: UDP, length 81
14:21:13.564057 IP 46.31.27.36.63782 > 216.219.95.164.47291: UDP, length 81
14:21:13.581752 IP 46.31.27.36.63782 > 216.219.95.164.47291: UDP, length 97
14:21:13.584570 IP 216.219.95.164.47291 > 46.31.27.36.63782: UDP, length 161
14:21:13.597641 IP 46.31.27.36.63782 > 216.219.95.164.47291: UDP, length 97
14:21:13.599218 IP 46.31.27.36.63782 > 216.219.95.164.47291: UDP, length 97
14:21:13.602063 IP 216.219.95.164.47291 > 46.31.27.36.63782: UDP, length 129
14:21:13.625300 IP 216.219.95.164.47291 > 46.31.27.36.63782: UDP, length 81
14:21:13.672565 IP 216.219.95.164.47291 > 46.31.27.36.63782: UDP, length 81
14:21:13.695077 IP 46.31.27.36.63782 > 216.219.95.164.47291: UDP, length 65
14:21:13.695624 IP 46.31.27.36.63782 > 216.219.95.164.47291: UDP, length 1265
14:21:13.696155 IP 46.31.27.36.63782 > 216.219.95.164.47291: UDP, length 961
14:21:13.706249 IP 216.219.95.164.47291 > 46.31.27.36.63782: UDP, length 65
14:21:13.707565 IP 216.219.95.164.47291 > 46.31.27.36.63782: UDP, length 65
14:21:13.725707 IP 216.219.95.164.47291 > 46.31.27.36.63782: UDP, length 81
14:21:13.734978 IP 46.31.27.36.63782 > 216.219.95.164.47291: UDP, length 97
14:21:13.741355 IP 216.219.95.164.47291 > 46.31.27.36.63782: UDP, length 1249
14:21:13.741475 IP 216.219.95.164.47291 > 46.31.27.36.63782: UDP, length 1249
14:21:13.741600 IP 216.219.95.164.47291 > 46.31.27.36.63782: UDP, length 1249
14:21:13.741678 IP 216.219.95.164.47291 > 46.31.27.36.63782: UDP, length 1249
14:21:13.741764 IP 216.219.95.164.47291 > 46.31.27.36.63782: UDP, length 1249
14:21:13.741827 IP 216.219.95.164.47291 > 46.31.27.36.63782: UDP, length 1249
14:21:13.741877 IP 216.219.95.164.47291 > 46.31.27.36.63782: UDP, length 673
14:21:13.756699 IP 46.31.27.36.63782 > 216.219.95.164.47291: UDP, length 81
14:21:13.767349 IP 46.31.27.36.63782 > 216.219.95.164.47291: UDP, length 81
14:21:13.774663 IP 46.31.27.36.63782 > 216.219.95.164.47291: UDP, length 1297
14:21:13.774665 IP 46.31.27.36.63782 > 216.219.95.164.47291: UDP, length 1297
14:21:13.776077 IP 46.31.27.36.63782 > 216.219.95.164.47291: UDP, length 129
14:21:13.778856 IP 216.219.95.164.47291 > 46.31.27.36.63782: UDP, length 97
14:21:13.778972 IP 216.219.95.164.47291 > 46.31.27.36.63782: UDP, length 1297
14:21:13.779052 IP 216.219.95.164.47291 > 46.31.27.36.63782: UDP, length 1297
14:21:13.785129 IP 216.219.95.164.47291 > 46.31.27.36.63782: UDP, length 1297
14:21:13.785244 IP 216.219.95.164.47291 > 46.31.27.36.63782: UDP, length 1297
14:21:13.785324 IP 216.219.95.164.47291 > 46.31.27.36.63782: UDP, length 833
14:21:13.824342 IP 216.219.95.164.47291 > 46.31.27.36.63782: UDP, length 81
14:21:13.843710 IP 46.31.27.36.63782 > 216.219.95.164.47291: UDP, length 65
14:21:13.844985 IP 46.31.27.36.63782 > 216.219.95.164.47291: UDP, length 289
14:21:13.896507 IP 46.31.27.36.63782 > 216.219.95.164.47291: UDP, length 65
14:21:13.897822 IP 46.31.27.36.63782 > 216.219.95.164.47291: UDP, length 1329
14:21:13.898073 IP 46.31.27.36.63782 > 216.219.95.164.47291: UDP, length 865
14:21:13.913096 IP 46.31.27.36.63782 > 216.219.95.164.47291: UDP, length 97
14:21:13.913191 IP 46.31.27.36.63782 > 216.219.95.164.47291: UDP, length 97
14:21:13.913516 IP 46.31.27.36.63782 > 216.219.95.164.47291: UDP, length 97
14:21:13.939422 IP 46.31.27.36.63782 > 216.219.95.164.47291: UDP, length 97
14:21:13.940914 IP 46.31.27.36.63782 > 216.219.95.164.47291: UDP, length 97
14:21:13.941443 IP 46.31.27.36.63782 > 216.219.95.164.47291: UDP, length 81
14:21:13.945184 IP 216.219.95.164.47291 > 46.31.27.36.63782: UDP, length 113
14:21:13.946465 IP 216.219.95.164.47291 > 46.31.27.36.63782: UDP, length 81
14:21:13.952671 IP 46.31.27.36.63782 > 216.219.95.164.47291: UDP, length 1297
14:21:13.955916 IP 46.31.27.36.63782 > 216.219.95.164.47291: UDP, length 97
14:21:13.956293 IP 46.31.27.36.63782 > 216.219.95.164.47291: UDP, length 97
14:21:13.956679 IP 46.31.27.36.63782 > 216.219.95.164.47291: UDP, length 225
14:21:13.956979 IP 46.31.27.36.63782 > 216.219.95.164.47291: UDP, length 977
14:21:13.968012 IP 216.219.95.164.47291 > 46.31.27.36.63782: UDP, length 113
14:21:13.969395 IP 216.219.95.164.47291 > 46.31.27.36.63782: UDP, length 1009
14:21:13.969540 IP 216.219.95.164.47291 > 46.31.27.36.63782: UDP, length 177
14:21:13.969630 IP 216.219.95.164.47291 > 46.31.27.36.63782: UDP, length 81
14:21:13.973055 IP 46.31.27.36.63782 > 216.219.95.164.47291: UDP, length 97
14:21:13.974040 IP 216.219.95.164.47291 > 46.31.27.36.63782: UDP, length 81
14:21:13.978149 IP 216.219.95.164.47291 > 46.31.27.36.63782: UDP, length 113
14:21:13.978678 IP 46.31.27.36.63782 > 216.219.95.164.47291: UDP, length 97
14:21:13.979104 IP 46.31.27.36.63782 > 216.219.95.164.47291: UDP, length 97
14:21:13.979423 IP 46.31.27.36.63782 > 216.219.95.164.47291: UDP, length 97
14:21:13.983187 IP 216.219.95.164.47291 > 46.31.27.36.63782: UDP, length 209
14:21:13.986960 IP 216.219.95.164.47291 > 46.31.27.36.63782: UDP, length 209
14:21:13.990531 IP 216.219.95.164.47291 > 46.31.27.36.63782: UDP, length 209
14:21:13.995732 IP 46.31.27.36.63782 > 216.219.95.164.47291: UDP, length 65
14:21:13.996167 IP 46.31.27.36.63782 > 216.219.95.164.47291: UDP, length 417
14:21:14.002032 IP 216.219.95.164.47291 > 46.31.27.36.63782: UDP, length 65
14:21:14.062764 IP 216.219.95.164.47291 > 46.31.27.36.63782: UDP, length 65
14:21:14.064142 IP 216.219.95.164.47291 > 46.31.27.36.63782: UDP, length 65
14:21:14.106507 IP 216.219.95.164.47291 > 46.31.27.36.63782: UDP, length 65
14:21:14.107764 IP 216.219.95.164.47291 > 46.31.27.36.63782: UDP, length 65
14:21:14.109011 IP 216.219.95.164.47291 > 46.31.27.36.63782: UDP, length 65
14:21:14.116612 IP 46.31.27.36.63782 > 216.219.95.164.47291: UDP, length 65
14:21:14.117158 IP 46.31.27.36.63782 > 216.219.95.164.47291: UDP, length 1297
14:21:14.117159 IP 46.31.27.36.63782 > 216.219.95.164.47291: UDP, length 1297
14:21:14.117315 IP 46.31.27.36.63782 > 216.219.95.164.47291: UDP, length 1297
14:21:14.117552 IP 46.31.27.36.63782 > 216.219.95.164.47291: UDP, length 1329
14:21:14.117735 IP 46.31.27.36.63782 > 216.219.95.164.47291: UDP, length 593
14:21:14.122524 IP 216.219.95.164.47291 > 46.31.27.36.63782: UDP, length 65
14:21:14.122604 IP 216.219.95.164.47291 > 46.31.27.36.63782: UDP, length 65
14:21:14.122645 IP 216.219.95.164.47291 > 46.31.27.36.63782: UDP, length 97
14:21:14.122684 IP 216.219.95.164.47291 > 46.31.27.36.63782: UDP, length 97
14:21:14.122755 IP 216.219.95.164.47291 > 46.31.27.36.63782: UDP, length 1297
14:21:14.122818 IP 216.219.95.164.47291 > 46.31.27.36.63782: UDP, length 1297
14:21:14.122881 IP 216.219.95.164.47291 > 46.31.27.36.63782: UDP, length 1297
14:21:14.122921 IP 216.219.95.164.47291 > 46.31.27.36.63782: UDP, length 65
14:21:14.123307 IP 46.31.27.36.63782 > 216.219.95.164.47291: UDP, length 129
14:21:14.128041 IP 216.219.95.164.47291 > 46.31.27.36.63782: UDP, length 1297
14:21:14.128235 IP 216.219.95.164.47291 > 46.31.27.36.63782: UDP, length 1297
14:21:14.128385 IP 216.219.95.164.47291 > 46.31.27.36.63782: UDP, length 161
14:21:14.139764 IP 46.31.27.36.63782 > 216.219.95.164.47291: UDP, length 1297
14:21:14.140220 IP 46.31.27.36.63782 > 216.219.95.164.47291: UDP, length 1297
14:21:14.140220 IP 46.31.27.36.63782 > 216.219.95.164.47291: UDP, length 81
14:21:14.140221 IP 46.31.27.36.63782 > 216.219.95.164.47291: UDP, length 81
14:21:14.140322 IP 46.31.27.36.63782 > 216.219.95.164.47291: UDP, length 129
14:21:14.140629 IP 46.31.27.36.63782 > 216.219.95.164.47291: UDP, length 513
14:21:14.144221 IP 46.31.27.36.63782 > 216.219.95.164.47291: UDP, length 65
14:21:14.144415 IP 46.31.27.36.63782 > 216.219.95.164.47291: UDP, length 1329
14:21:14.145060 IP 46.31.27.36.63782 > 216.219.95.164.47291: UDP, length 849
14:21:14.148188 IP 216.219.95.164.47291 > 46.31.27.36.63782: UDP, length 97
14:21:14.148251 IP 216.219.95.164.47291 > 46.31.27.36.63782: UDP, length 1297
14:21:14.148313 IP 216.219.95.164.47291 > 46.31.27.36.63782: UDP, length 1297
14:21:14.148351 IP 216.219.95.164.47291 > 46.31.27.36.63782: UDP, length 81
14:21:14.149452 IP 46.31.27.36.63782 > 216.219.95.164.47291: UDP, length 81
14:21:14.153082 IP 216.219.95.164.47291 > 46.31.27.36.63782: UDP, length 1297
14:21:14.153638 IP 216.219.95.164.47291 > 46.31.27.36.63782: UDP, length 1297
14:21:14.153706 IP 216.219.95.164.47291 > 46.31.27.36.63782: UDP, length 129
14:21:14.154713 IP 46.31.27.36.63782 > 216.219.95.164.47291: UDP, length 1297
14:21:14.155469 IP 46.31.27.36.63782 > 216.219.95.164.47291: UDP, length 1297
14:21:14.155839 IP 46.31.27.36.63782 > 216.219.95.164.47291: UDP, length 129
14:21:14.155843 IP 46.31.27.36.63782 > 216.219.95.164.47291: UDP, length 561
14:21:14.155844 IP 46.31.27.36.63782 > 216.219.95.164.47291: UDP, length 561
14:21:14.155879 IP 46.31.27.36.63782 > 216.219.95.164.47291: UDP, length 561
14:21:14.157998 IP 46.31.27.36.63782 > 216.219.95.164.47291: UDP, length 561
14:21:14.158139 IP 216.219.95.164.47291 > 46.31.27.36.63782: UDP, length 1329
14:21:14.158205 IP 216.219.95.164.47291 > 46.31.27.36.63782: UDP, length 1329
14:21:14.158258 IP 216.219.95.164.47291 > 46.31.27.36.63782: UDP, length 641
14:21:14.158359 IP 46.31.27.36.63782 > 216.219.95.164.47291: UDP, length 561
14:21:14.158523 IP 46.31.27.36.63782 > 216.219.95.164.47291: UDP, length 561
14:21:14.159460 IP 216.219.95.164.47291 > 46.31.27.36.63782: UDP, length 81
14:21:14.162353 IP 46.31.27.36.63782 > 216.219.95.164.47291: UDP, length 561
14:21:14.162354 IP 46.31.27.36.63782 > 216.219.95.164.47291: UDP, length 561
14:21:14.162355 IP 46.31.27.36.63782 > 216.219.95.164.47291: UDP, length 561
14:21:14.162978 IP 216.219.95.164.47291 > 46.31.27.36.63782: UDP, length 1329
14:21:14.163036 IP 216.219.95.164.47291 > 46.31.27.36.63782: UDP, length 1329
14:21:14.163092 IP 216.219.95.164.47291 > 46.31.27.36.63782: UDP, length 1329
14:21:14.163188 IP 216.219.95.164.47291 > 46.31.27.36.63782: UDP, length 1249
14:21:14.163246 IP 216.219.95.164.47291 > 46.31.27.36.63782: UDP, length 449
14:21:14.163313 IP 216.219.95.164.47291 > 46.31.27.36.63782: UDP, length 1329
14:21:14.163367 IP 216.219.95.164.47291 > 46.31.27.36.63782: UDP, length 1329
14:21:14.163423 IP 216.219.95.164.47291 > 46.31.27.36.63782: UDP, length 1329
14:21:14.163475 IP 216.219.95.164.47291 > 46.31.27.36.63782: UDP, length 1329
14:21:14.163539 IP 216.219.95.164.47291 > 46.31.27.36.63782: UDP, length 1329
14:21:14.163596 IP 216.219.95.164.47291 > 46.31.27.36.63782: UDP, length 1329
14:21:14.163634 IP 216.219.95.164.47291 > 46.31.27.36.63782: UDP, length 81
14:21:14.163664 IP 216.219.95.164.47291 > 46.31.27.36.63782: UDP, length 81
14:21:14.163728 IP 216.219.95.164.47291 > 46.31.27.36.63782: UDP, length 1329
14:21:14.163793 IP 216.219.95.164.47291 > 46.31.27.36.63782: UDP, length 1329
14:21:14.165033 IP 216.219.95.164.47291 > 46.31.27.36.63782: UDP, length 1329
14:21:14.165100 IP 216.219.95.164.47291 > 46.31.27.36.63782: UDP, length 1329
14:21:14.166295 IP 216.219.95.164.47291 > 46.31.27.36.63782: UDP, length 81
14:21:14.166388 IP 216.219.95.164.47291 > 46.31.27.36.63782: UDP, length 1329
14:21:14.166444 IP 216.219.95.164.47291 > 46.31.27.36.63782: UDP, length 1329
14:21:14.167643 IP 216.219.95.164.47291 > 46.31.27.36.63782: UDP, length 1329
14:21:14.167709 IP 216.219.95.164.47291 > 46.31.27.36.63782: UDP, length 1329
14:21:14.171298 IP 216.219.95.164.47291 > 46.31.27.36.63782: UDP, length 1329
14:21:14.171374 IP 216.219.95.164.47291 > 46.31.27.36.63782: UDP, length 1329
14:21:14.172531 IP 46.31.27.36.63782 > 216.219.95.164.47291: UDP, length 81
14:21:14.172596 IP 216.219.95.164.47291 > 46.31.27.36.63782: UDP, length 1329
14:21:14.172667 IP 216.219.95.164.47291 > 46.31.27.36.63782: UDP, length 1329
14:21:14.175006 IP 216.219.95.164.47291 > 46.31.27.36.63782: UDP, length 1329
14:21:14.175073 IP 216.219.95.164.47291 > 46.31.27.36.63782: UDP, length 1329
14:21:14.176521 IP 216.219.95.164.47291 > 46.31.27.36.63782: UDP, length 1329
14:21:14.205044 IP 216.219.95.164.47291 > 46.31.27.36.63782: UDP, length 257
14:21:14.205119 IP 216.219.95.164.47291 > 46.31.27.36.63782: UDP, length 81
14:21:14.223467 IP 216.219.95.164.47291 > 46.31.27.36.63782: UDP, length 81
14:21:14.278121 IP 46.31.27.36.63782 > 216.219.95.164.47291: UDP, length 81
14:21:14.293880 IP 46.31.27.36.63782 > 216.219.95.164.47291: UDP, length 81
14:21:14.297357 IP 46.31.27.36.63782 > 216.219.95.164.47291: UDP, length 1297
14:21:14.298783 IP 46.31.27.36.63782 > 216.219.95.164.47291: UDP, length 97
14:21:14.298908 IP 46.31.27.36.63782 > 216.219.95.164.47291: UDP, length 209
14:21:14.299228 IP 46.31.27.36.63782 > 216.219.95.164.47291: UDP, length 1057
14:21:14.302193 IP 216.219.95.164.47291 > 46.31.27.36.63782: UDP, length 81
14:21:14.302272 IP 216.219.95.164.47291 > 46.31.27.36.63782: UDP, length 1009
14:21:14.302325 IP 216.219.95.164.47291 > 46.31.27.36.63782: UDP, length 177
14:21:14.303539 IP 216.219.95.164.47291 > 46.31.27.36.63782: UDP, length 81
14:21:14.309383 IP 216.219.95.164.47291 > 46.31.27.36.63782: UDP, length 593
14:21:14.309436 IP 216.219.95.164.47291 > 46.31.27.36.63782: UDP, length 81
14:21:14.319533 IP 46.31.27.36.63782 > 216.219.95.164.47291: UDP, length 65
14:21:14.320003 IP 46.31.27.36.63782 > 216.219.95.164.47291: UDP, length 1329
14:21:14.320013 IP 46.31.27.36.63782 > 216.219.95.164.47291: UDP, length 609
14:21:14.324202 IP 46.31.27.36.63782 > 216.219.95.164.47291: UDP, length 1297
14:21:14.324730 IP 46.31.27.36.63782 > 216.219.95.164.47291: UDP, length 577
14:21:14.324972 IP 46.31.27.36.63782 > 216.219.95.164.47291: UDP, length 145
14:21:14.328090 IP 216.219.95.164.47291 > 46.31.27.36.63782: UDP, length 65
14:21:14.329415 IP 46.31.27.36.63782 > 216.219.95.164.47291: UDP, length 161
14:21:14.329496 IP 216.219.95.164.47291 > 46.31.27.36.63782: UDP, length 1009
14:21:14.329558 IP 216.219.95.164.47291 > 46.31.27.36.63782: UDP, length 65
14:21:14.329602 IP 216.219.95.164.47291 > 46.31.27.36.63782: UDP, length 177
14:21:14.330814 IP 216.219.95.164.47291 > 46.31.27.36.63782: UDP, length 65
14:21:14.332137 IP 216.219.95.164.47291 > 46.31.27.36.63782: UDP, length 1329
14:21:14.332307 IP 216.219.95.164.47291 > 46.31.27.36.63782: UDP, length 1329
14:21:14.332446 IP 216.219.95.164.47291 > 46.31.27.36.63782: UDP, length 1329
14:21:14.332532 IP 216.219.95.164.47291 > 46.31.27.36.63782: UDP, length 1329
14:21:14.332606 IP 216.219.95.164.47291 > 46.31.27.36.63782: UDP, length 1329
14:21:14.332667 IP 216.219.95.164.47291 > 46.31.27.36.63782: UDP, length 1329
14:21:14.332756 IP 216.219.95.164.47291 > 46.31.27.36.63782: UDP, length 1329
14:21:14.332854 IP 216.219.95.164.47291 > 46.31.27.36.63782: UDP, length 1329
14:21:14.332919 IP 216.219.95.164.47291 > 46.31.27.36.63782: UDP, length 1329
14:21:14.334110 IP 46.31.27.36.63782 > 216.219.95.164.47291: UDP, length 97
14:21:14.334919 IP 46.31.27.36.63782 > 216.219.95.164.47291: UDP, length 97
14:21:14.334920 IP 46.31.27.36.63782 > 216.219.95.164.47291: UDP, length 97
14:21:14.334921 IP 46.31.27.36.63782 > 216.219.95.164.47291: UDP, length 97
14:21:14.334963 IP 46.31.27.36.63782 > 216.219.95.164.47291: UDP, length 97
14:21:14.335016 IP 46.31.27.36.63782 > 216.219.95.164.47291: UDP, length 97
14:21:14.335220 IP 46.31.27.36.63782 > 216.219.95.164.47291: UDP, length 97
14:21:14.335756 IP 46.31.27.36.63782 > 216.219.95.164.47291: UDP, length 97
14:21:14.338712 IP 216.219.95.164.47291 > 46.31.27.36.63782: UDP, length 1329
14:21:14.338849 IP 216.219.95.164.47291 > 46.31.27.36.63782: UDP, length 1329
14:21:14.340112 IP 216.219.95.164.47291 > 46.31.27.36.63782: UDP, length 1329
14:21:14.340198 IP 216.219.95.164.47291 > 46.31.27.36.63782: UDP, length 1329
14:21:14.341935 IP 46.31.27.36.63782 > 216.219.95.164.47291: UDP, length 97
14:21:14.341937 IP 46.31.27.36.63782 > 216.219.95.164.47291: UDP, length 97
14:21:14.343633 IP 216.219.95.164.47291 > 46.31.27.36.63782: UDP, length 1329
14:21:14.343722 IP 216.219.95.164.47291 > 46.31.27.36.63782: UDP, length 1329
14:21:14.346066 IP 216.219.95.164.47291 > 46.31.27.36.63782: UDP, length 65
14:21:14.347317 IP 216.219.95.164.47291 > 46.31.27.36.63782: UDP, length 65
14:21:14.348536 IP 216.219.95.164.47291 > 46.31.27.36.63782: UDP, length 65
14:21:14.348626 IP 216.219.95.164.47291 > 46.31.27.36.63782: UDP, length 1329
14:21:14.348709 IP 216.219.95.164.47291 > 46.31.27.36.63782: UDP, length 1329
14:21:14.349195 IP 46.31.27.36.63782 > 216.219.95.164.47291: UDP, length 97
14:21:14.349278 IP 46.31.27.36.63782 > 216.219.95.164.47291: UDP, length 97
14:21:14.349300 IP 46.31.27.36.63782 > 216.219.95.164.47291: UDP, length 97
14:21:14.349961 IP 46.31.27.36.63782 > 216.219.95.164.47291: UDP, length 81
14:21:14.352196 IP 216.219.95.164.47291 > 46.31.27.36.63782: UDP, length 1329
14:21:14.352296 IP 216.219.95.164.47291 > 46.31.27.36.63782: UDP, length 1329
14:21:14.352367 IP 216.219.95.164.47291 > 46.31.27.36.63782: UDP, length 81
14:21:14.373331 IP 216.219.95.164.47291 > 46.31.27.36.63782: UDP, length 1329
14:21:14.373464 IP 216.219.95.164.47291 > 46.31.27.36.63782: UDP, length 1329
14:21:14.373587 IP 216.219.95.164.47291 > 46.31.27.36.63782: UDP, length 1329
14:21:14.373694 IP 216.219.95.164.47291 > 46.31.27.36.63782: UDP, length 1329
14:21:14.373799 IP 216.219.95.164.47291 > 46.31.27.36.63782: UDP, length 1297
14:21:14.373881 IP 216.219.95.164.47291 > 46.31.27.36.63782: UDP, length 1297
14:21:14.373957 IP 216.219.95.164.47291 > 46.31.27.36.63782: UDP, length 1297
14:21:14.374028 IP 216.219.95.164.47291 > 46.31.27.36.63782: UDP, length 1297
14:21:14.374098 IP 216.219.95.164.47291 > 46.31.27.36.63782: UDP, length 1329
14:21:14.374163 IP 216.219.95.164.47291 > 46.31.27.36.63782: UDP, length 1329
14:21:14.374232 IP 216.219.95.164.47291 > 46.31.27.36.63782: UDP, length 1329
14:21:14.374295 IP 216.219.95.164.47291 > 46.31.27.36.63782: UDP, length 1329
14:21:14.374353 IP 216.219.95.164.47291 > 46.31.27.36.63782: UDP, length 1297
14:21:14.374412 IP 216.219.95.164.47291 > 46.31.27.36.63782: UDP, length 1329
14:21:14.374473 IP 216.219.95.164.47291 > 46.31.27.36.63782: UDP, length 1329
14:21:14.374523 IP 216.219.95.164.47291 > 46.31.27.36.63782: UDP, length 1297
14:21:14.375127 IP 46.31.27.36.63782 > 216.219.95.164.47291: UDP, length 97
14:21:14.375811 IP 216.219.95.164.47291 > 46.31.27.36.63782: UDP, length 1329
14:21:14.375926 IP 216.219.95.164.47291 > 46.31.27.36.63782: UDP, length 1329
14:21:14.376494 IP 46.31.27.36.63782 > 216.219.95.164.47291: UDP, length 97
14:21:14.377258 IP 216.219.95.164.47291 > 46.31.27.36.63782: UDP, length 1297
14:21:14.378536 IP 216.219.95.164.47291 > 46.31.27.36.63782: UDP, length 1329
14:21:14.378665 IP 216.219.95.164.47291 > 46.31.27.36.63782: UDP, length 1329
14:21:14.382326 IP 216.219.95.164.47291 > 46.31.27.36.63782: UDP, length 1329
14:21:14.382449 IP 216.219.95.164.47291 > 46.31.27.36.63782: UDP, length 1329
14:21:14.382544 IP 216.219.95.164.47291 > 46.31.27.36.63782: UDP, length 1297
14:21:14.387532 IP 216.219.95.164.47291 > 46.31.27.36.63782: UDP, length 1297
14:21:14.387660 IP 216.219.95.164.47291 > 46.31.27.36.63782: UDP, length 1329
14:21:14.387776 IP 216.219.95.164.47291 > 46.31.27.36.63782: UDP, length 1329
14:21:14.390321 IP 216.219.95.164.47291 > 46.31.27.36.63782: UDP, length 1329
14:21:14.390448 IP 216.219.95.164.47291 > 46.31.27.36.63782: UDP, length 1329
14:21:14.391792 IP 216.219.95.164.47291 > 46.31.27.36.63782: UDP, length 1297
14:21:14.393059 IP 216.219.95.164.47291 > 46.31.27.36.63782: UDP, length 1329
14:21:14.393139 IP 216.219.95.164.47291 > 46.31.27.36.63782: UDP, length 1329
14:21:14.394343 IP 46.31.27.36.63782 > 216.219.95.164.47291: UDP, length 65
14:21:14.394732 IP 46.31.27.36.63782 > 216.219.95.164.47291: UDP, length 1329
14:21:14.395046 IP 46.31.27.36.63782 > 216.219.95.164.47291: UDP, length 609
14:21:14.398016 IP 216.219.95.164.47291 > 46.31.27.36.63782: UDP, length 1297
14:21:14.398070 IP 216.219.95.164.47291 > 46.31.27.36.63782: UDP, length 1329
14:21:14.398120 IP 216.219.95.164.47291 > 46.31.27.36.63782: UDP, length 1329
14:21:14.401605 IP 216.219.95.164.47291 > 46.31.27.36.63782: UDP, length 1329
14:21:14.401655 IP 216.219.95.164.47291 > 46.31.27.36.63782: UDP, length 1329
14:21:14.401710 IP 216.219.95.164.47291 > 46.31.27.36.63782: UDP, length 1297
14:21:14.405232 IP 216.219.95.164.47291 > 46.31.27.36.63782: UDP, length 1329
14:21:14.405279 IP 216.219.95.164.47291 > 46.31.27.36.63782: UDP, length 1329
14:21:14.407597 IP 216.219.95.164.47291 > 46.31.27.36.63782: UDP, length 1297
14:21:14.407632 IP 216.219.95.164.47291 > 46.31.27.36.63782: UDP, length 81
14:21:14.407668 IP 216.219.95.164.47291 > 46.31.27.36.63782: UDP, length 1329
14:21:14.407705 IP 216.219.95.164.47291 > 46.31.27.36.63782: UDP, length 1329
14:21:14.412468 IP 216.219.95.164.47291 > 46.31.27.36.63782: UDP, length 1297
14:21:14.412531 IP 216.219.95.164.47291 > 46.31.27.36.63782: UDP, length 1329
14:21:14.412604 IP 216.219.95.164.47291 > 46.31.27.36.63782: UDP, length 1329
14:21:14.416055 IP 216.219.95.164.47291 > 46.31.27.36.63782: UDP, length 1297
14:21:14.416106 IP 216.219.95.164.47291 > 46.31.27.36.63782: UDP, length 1329
14:21:14.416146 IP 216.219.95.164.47291 > 46.31.27.36.63782: UDP, length 1329
14:21:14.418538 IP 216.219.95.164.47291 > 46.31.27.36.63782: UDP, length 1329
14:21:14.418590 IP 216.219.95.164.47291 > 46.31.27.36.63782: UDP, length 1329
14:21:14.421028 IP 216.219.95.164.47291 > 46.31.27.36.63782: UDP, length 1297
14:21:14.424794 IP 216.219.95.164.47291 > 46.31.27.36.63782: UDP, length 1329
14:21:14.424850 IP 216.219.95.164.47291 > 46.31.27.36.63782: UDP, length 1329
14:21:14.426199 IP 216.219.95.164.47291 > 46.31.27.36.63782: UDP, length 1297
14:21:14.427652 IP 216.219.95.164.47291 > 46.31.27.36.63782: UDP, length 1329
14:21:14.427704 IP 216.219.95.164.47291 > 46.31.27.36.63782: UDP, length 1329
14:21:14.430282 IP 216.219.95.164.47291 > 46.31.27.36.63782: UDP, length 1329
14:21:14.430323 IP 216.219.95.164.47291 > 46.31.27.36.63782: UDP, length 1329
14:21:14.430456 IP 216.219.95.164.47291 > 46.31.27.36.63782: UDP, length 1297
14:21:14.434997 IP 216.219.95.164.47291 > 46.31.27.36.63782: UDP, length 1329
14:21:14.435194 IP 216.219.95.164.47291 > 46.31.27.36.63782: UDP, length 1329
