dropped privs to tcpdump
tcpdump: verbose output suppressed, use -v[v]... for full protocol decode
listening on eth0, link-type EN10MB (Ethernet), snapshot length 262144 bytes
12:44:24.739154 IP 46.31.27.36.19162 > 216.219.95.164.47291: UDP, length 129
12:44:24.739156 IP 46.31.27.36.19162 > 216.219.95.164.47291: UDP, length 129
12:44:24.739156 IP 46.31.27.36.19162 > 216.219.95.164.47291: UDP, length 129
12:44:24.739157 IP 46.31.27.36.19162 > 216.219.95.164.47291: UDP, length 81
12:44:24.739336 IP 46.31.27.36.19162 > 216.219.95.164.47291: UDP, length 113
12:44:24.739338 IP 46.31.27.36.19162 > 216.219.95.164.47291: UDP, length 129
12:44:24.739361 IP 46.31.27.36.19162 > 216.219.95.164.47291: UDP, length 129
12:44:24.740289 IP 46.31.27.36.19162 > 216.219.95.164.47291: UDP, length 129
12:44:24.740290 IP 46.31.27.36.19162 > 216.219.95.164.47291: UDP, length 81
12:44:24.740290 IP 46.31.27.36.19162 > 216.219.95.164.47291: UDP, length 113
12:44:24.740291 IP 46.31.27.36.19162 > 216.219.95.164.47291: UDP, length 129
12:44:24.740291 IP 46.31.27.36.19162 > 216.219.95.164.47291: UDP, length 129
12:44:24.740292 IP 46.31.27.36.19162 > 216.219.95.164.47291: UDP, length 129
12:44:24.740292 IP 46.31.27.36.19162 > 216.219.95.164.47291: UDP, length 81
12:44:24.740292 IP 46.31.27.36.19162 > 216.219.95.164.47291: UDP, length 81
12:44:24.740376 IP 46.31.27.36.19162 > 216.219.95.164.47291: UDP, length 81
12:44:24.740384 IP 46.31.27.36.19162 > 216.219.95.164.47291: UDP, length 113
12:44:24.740385 IP 46.31.27.36.19162 > 216.219.95.164.47291: UDP, length 129
12:44:24.740386 IP 46.31.27.36.19162 > 216.219.95.164.47291: UDP, length 129
12:44:24.740689 IP 46.31.27.36.19162 > 216.219.95.164.47291: UDP, length 129
12:44:24.740690 IP 46.31.27.36.19162 > 216.219.95.164.47291: UDP, length 81
12:44:24.740809 IP 46.31.27.36.19162 > 216.219.95.164.47291: UDP, length 81
12:44:24.740809 IP 46.31.27.36.19162 > 216.219.95.164.47291: UDP, length 81
12:44:24.740810 IP 46.31.27.36.19162 > 216.219.95.164.47291: UDP, length 97
12:44:24.740811 IP 46.31.27.36.19162 > 216.219.95.164.47291: UDP, length 81
12:44:24.740984 IP 46.31.27.36.19162 > 216.219.95.164.47291: UDP, length 81
12:44:24.740985 IP 46.31.27.36.19162 > 216.219.95.164.47291: UDP, length 113
12:44:24.741419 IP 46.31.27.36.19162 > 216.219.95.164.47291: UDP, length 97
12:44:24.741420 IP 46.31.27.36.19162 > 216.219.95.164.47291: UDP, length 81
12:44:24.741420 IP 46.31.27.36.19162 > 216.219.95.164.47291: UDP, length 97
12:44:24.742203 IP 46.31.27.36.19162 > 216.219.95.164.47291: UDP, length 81
12:44:24.742203 IP 46.31.27.36.19162 > 216.219.95.164.47291: UDP, length 97
12:44:24.742204 IP 46.31.27.36.19162 > 216.219.95.164.47291: UDP, length 81
12:44:24.742204 IP 46.31.27.36.19162 > 216.219.95.164.47291: UDP, length 97
12:44:24.742209 IP 46.31.27.36.19162 > 216.219.95.164.47291: UDP, length 97
12:44:24.742209 IP 46.31.27.36.19162 > 216.219.95.164.47291: UDP, length 81
12:44:24.742210 IP 46.31.27.36.19162 > 216.219.95.164.47291: UDP, length 97
12:44:24.742210 IP 46.31.27.36.19162 > 216.219.95.164.47291: UDP, length 97
12:44:24.742407 IP 46.31.27.36.19162 > 216.219.95.164.47291: UDP, length 81
12:44:24.742408 IP 46.31.27.36.19162 > 216.219.95.164.47291: UDP, length 97
12:44:24.742436 IP 46.31.27.36.19162 > 216.219.95.164.47291: UDP, length 81
12:44:24.832250 IP 46.31.27.36.19162 > 216.219.95.164.47291: UDP, length 113
12:44:24.846787 IP 46.31.27.36.19162 > 216.219.95.164.47291: UDP, length 97
12:44:24.849109 IP 216.219.95.164.47291 > 46.31.27.36.19162: UDP, length 97
12:44:24.858516 IP 216.219.95.164.47291 > 46.31.27.36.19162: UDP, length 209
12:44:24.861705 IP 216.219.95.164.47291 > 46.31.27.36.19162: UDP, length 97
12:44:24.866236 IP 216.219.95.164.47291 > 46.31.27.36.19162: UDP, length 209
12:44:24.871182 IP 216.219.95.164.47291 > 46.31.27.36.19162: UDP, length 353
12:44:24.875040 IP 216.219.95.164.47291 > 46.31.27.36.19162: UDP, length 129
12:44:24.878667 IP 216.219.95.164.47291 > 46.31.27.36.19162: UDP, length 97
12:44:24.882349 IP 216.219.95.164.47291 > 46.31.27.36.19162: UDP, length 209
12:44:24.889433 IP 216.219.95.164.47291 > 46.31.27.36.19162: UDP, length 353
12:44:24.893290 IP 216.219.95.164.47291 > 46.31.27.36.19162: UDP, length 129
12:44:24.896925 IP 216.219.95.164.47291 > 46.31.27.36.19162: UDP, length 369
12:44:24.901991 IP 216.219.95.164.47291 > 46.31.27.36.19162: UDP, length 305
12:44:24.905645 IP 216.219.95.164.47291 > 46.31.27.36.19162: UDP, length 129
12:44:24.910441 IP 216.219.95.164.47291 > 46.31.27.36.19162: UDP, length 97
12:44:24.914041 IP 216.219.95.164.47291 > 46.31.27.36.19162: UDP, length 209
12:44:24.917532 IP 216.219.95.164.47291 > 46.31.27.36.19162: UDP, length 161
12:44:24.919974 IP 216.219.95.164.47291 > 46.31.27.36.19162: UDP, length 369
12:44:24.923536 IP 216.219.95.164.47291 > 46.31.27.36.19162: UDP, length 465
12:44:24.927096 IP 216.219.95.164.47291 > 46.31.27.36.19162: UDP, length 129
12:44:24.930661 IP 216.219.95.164.47291 > 46.31.27.36.19162: UDP, length 161
12:44:24.933135 IP 216.219.95.164.47291 > 46.31.27.36.19162: UDP, length 129
12:44:24.936618 IP 216.219.95.164.47291 > 46.31.27.36.19162: UDP, length 161
12:44:24.940122 IP 216.219.95.164.47291 > 46.31.27.36.19162: UDP, length 465
12:44:24.944288 IP 216.219.95.164.47291 > 46.31.27.36.19162: UDP, length 129
12:44:24.947813 IP 216.219.95.164.47291 > 46.31.27.36.19162: UDP, length 161
12:44:24.951358 IP 216.219.95.164.47291 > 46.31.27.36.19162: UDP, length 161
12:44:24.953791 IP 216.219.95.164.47291 > 46.31.27.36.19162: UDP, length 129
12:44:24.958466 IP 216.219.95.164.47291 > 46.31.27.36.19162: UDP, length 465
12:44:24.962046 IP 216.219.95.164.47291 > 46.31.27.36.19162: UDP, length 97
12:44:24.964508 IP 216.219.95.164.47291 > 46.31.27.36.19162: UDP, length 209
12:44:24.968083 IP 216.219.95.164.47291 > 46.31.27.36.19162: UDP, length 161
12:44:24.999658 IP 46.31.27.36.19162 > 216.219.95.164.47291: UDP, length 97
12:44:25.005605 IP 216.219.95.164.47291 > 46.31.27.36.19162: UDP, length 241
12:44:25.035554 IP 46.31.27.36.19162 > 216.219.95.164.47291: UDP, length 81
12:44:25.042970 IP 46.31.27.36.19162 > 216.219.95.164.47291: UDP, length 81
12:44:25.046976 IP 46.31.27.36.19162 > 216.219.95.164.47291: UDP, length 81
12:44:25.079336 IP 216.219.95.164.47291 > 46.31.27.36.19162: UDP, length 81
12:44:25.090506 IP 46.31.27.36.19162 > 216.219.95.164.47291: UDP, length 81
12:44:25.091260 IP 216.219.95.164.47291 > 46.31.27.36.19162: UDP, length 81
12:44:25.096908 IP 46.31.27.36.19162 > 216.219.95.164.47291: UDP, length 81
12:44:25.098714 IP 46.31.27.36.19162 > 216.219.95.164.47291: UDP, length 81
12:44:25.109013 IP 46.31.27.36.19162 > 216.219.95.164.47291: UDP, length 81
12:44:25.134653 IP 216.219.95.164.47291 > 46.31.27.36.19162: UDP, length 81
12:44:25.146233 IP 216.219.95.164.47291 > 46.31.27.36.19162: UDP, length 81
12:44:25.148869 IP 216.219.95.164.47291 > 46.31.27.36.19162: UDP, length 81
12:44:25.161206 IP 46.31.27.36.19162 > 216.219.95.164.47291: UDP, length 81
12:44:25.177506 IP 216.219.95.164.47291 > 46.31.27.36.19162: UDP, length 81
12:44:25.179792 IP 46.31.27.36.19162 > 216.219.95.164.47291: UDP, length 81
12:44:25.250355 IP 46.31.27.36.19162 > 216.219.95.164.47291: UDP, length 65
12:44:25.252451 IP 216.219.95.164.47291 > 46.31.27.36.19162: UDP, length 81
12:44:25.252749 IP 46.31.27.36.19162 > 216.219.95.164.47291: UDP, length 289
12:44:25.255992 IP 216.219.95.164.47291 > 46.31.27.36.19162: UDP, length 65
12:44:25.257375 IP 216.219.95.164.47291 > 46.31.27.36.19162: UDP, length 65
12:44:25.259856 IP 216.219.95.164.47291 > 46.31.27.36.19162: UDP, length 81
12:44:25.261666 IP 46.31.27.36.19162 > 216.219.95.164.47291: UDP, length 65
12:44:25.262114 IP 46.31.27.36.19162 > 216.219.95.164.47291: UDP, length 1329
12:44:25.262563 IP 46.31.27.36.19162 > 216.219.95.164.47291: UDP, length 577
12:44:25.271929 IP 216.219.95.164.47291 > 46.31.27.36.19162: UDP, length 65
12:44:25.274683 IP 216.219.95.164.47291 > 46.31.27.36.19162: UDP, length 65
12:44:25.276284 IP 216.219.95.164.47291 > 46.31.27.36.19162: UDP, length 65
12:44:25.305965 IP 46.31.27.36.19162 > 216.219.95.164.47291: UDP, length 65
12:44:25.306990 IP 46.31.27.36.19162 > 216.219.95.164.47291: UDP, length 417
12:44:25.310698 IP 216.219.95.164.47291 > 46.31.27.36.19162: UDP, length 65
12:44:25.317452 IP 46.31.27.36.19162 > 216.219.95.164.47291: UDP, length 65
12:44:25.322145 IP 46.31.27.36.19162 > 216.219.95.164.47291: UDP, length 65
12:44:25.323491 IP 46.31.27.36.19162 > 216.219.95.164.47291: UDP, length 1329
12:44:25.323505 IP 46.31.27.36.19162 > 216.219.95.164.47291: UDP, length 625
12:44:25.324463 IP 46.31.27.36.19162 > 216.219.95.164.47291: UDP, length 529
12:44:25.333188 IP 216.219.95.164.47291 > 46.31.27.36.19162: UDP, length 1297
12:44:25.340565 IP 216.219.95.164.47291 > 46.31.27.36.19162: UDP, length 65
12:44:25.341888 IP 216.219.95.164.47291 > 46.31.27.36.19162: UDP, length 65
12:44:25.343248 IP 216.219.95.164.47291 > 46.31.27.36.19162: UDP, length 65
12:44:25.349499 IP 46.31.27.36.19162 > 216.219.95.164.47291: UDP, length 65
12:44:25.352868 IP 46.31.27.36.19162 > 216.219.95.164.47291: UDP, length 1329
12:44:25.352870 IP 46.31.27.36.19162 > 216.219.95.164.47291: UDP, length 593
12:44:25.423863 IP 46.31.27.36.19162 > 216.219.95.164.47291: UDP, length 65
12:44:25.425315 IP 46.31.27.36.19162 > 216.219.95.164.47291: UDP, length 241
12:44:25.426448 IP 216.219.95.164.47291 > 46.31.27.36.19162: UDP, length 65
12:44:25.430208 IP 216.219.95.164.47291 > 46.31.27.36.19162: UDP, length 65
12:44:25.430962 IP 46.31.27.36.19162 > 216.219.95.164.47291: UDP, length 65
12:44:25.431020 IP 46.31.27.36.19162 > 216.219.95.164.47291: UDP, length 225
12:44:25.432964 IP 216.219.95.164.47291 > 46.31.27.36.19162: UDP, length 65
12:44:25.444687 IP 46.31.27.36.19162 > 216.219.95.164.47291: UDP, length 81
12:44:25.456048 IP 216.219.95.164.47291 > 46.31.27.36.19162: UDP, length 81
12:44:25.503751 IP 216.219.95.164.47291 > 46.31.27.36.19162: UDP, length 65
12:44:25.503981 IP 216.219.95.164.47291 > 46.31.27.36.19162: UDP, length 65
12:44:25.505392 IP 46.31.27.36.19162 > 216.219.95.164.47291: UDP, length 1297
12:44:25.511627 IP 46.31.27.36.19162 > 216.219.95.164.47291: UDP, length 81
12:44:25.532126 IP 216.219.95.164.47291 > 46.31.27.36.19162: UDP, length 81
12:44:25.533944 IP 46.31.27.36.19162 > 216.219.95.164.47291: UDP, length 81
12:44:25.599327 IP 46.31.27.36.19162 > 216.219.95.164.47291: UDP, length 81
12:44:25.628077 IP 46.31.27.36.19162 > 216.219.95.164.47291: UDP, length 65
12:44:25.629487 IP 46.31.27.36.19162 > 216.219.95.164.47291: UDP, length 1329
12:44:25.630641 IP 46.31.27.36.19162 > 216.219.95.164.47291: UDP, length 577
12:44:25.637138 IP 216.219.95.164.47291 > 46.31.27.36.19162: UDP, length 65
12:44:25.638689 IP 216.219.95.164.47291 > 46.31.27.36.19162: UDP, length 65
12:44:25.639928 IP 216.219.95.164.47291 > 46.31.27.36.19162: UDP, length 65
12:44:25.673621 IP 216.219.95.164.47291 > 46.31.27.36.19162: UDP, length 81
12:44:25.676203 IP 216.219.95.164.47291 > 46.31.27.36.19162: UDP, length 145
12:44:25.703617 IP 46.31.27.36.19162 > 216.219.95.164.47291: UDP, length 65
12:44:25.704073 IP 46.31.27.36.19162 > 216.219.95.164.47291: UDP, length 1329
12:44:25.705475 IP 46.31.27.36.19162 > 216.219.95.164.47291: UDP, length 625
12:44:25.724008 IP 216.219.95.164.47291 > 46.31.27.36.19162: UDP, length 65
12:44:25.724109 IP 216.219.95.164.47291 > 46.31.27.36.19162: UDP, length 65
12:44:25.733316 IP 216.219.95.164.47291 > 46.31.27.36.19162: UDP, length 65
12:44:25.845436 IP 46.31.27.36.19162 > 216.219.95.164.47291: UDP, length 65
12:44:25.846312 IP 46.31.27.36.19162 > 216.219.95.164.47291: UDP, length 1329
12:44:25.846464 IP 46.31.27.36.19162 > 216.219.95.164.47291: UDP, length 625
12:44:25.877121 IP 46.31.27.36.19162 > 216.219.95.164.47291: UDP, length 81
12:44:25.902025 IP 46.31.27.36.19162 > 216.219.95.164.47291: UDP, length 97
12:44:25.906362 IP 216.219.95.164.47291 > 46.31.27.36.19162: UDP, length 273
12:44:25.920152 IP 216.219.95.164.47291 > 46.31.27.36.19162: UDP, length 65
12:44:25.921439 IP 216.219.95.164.47291 > 46.31.27.36.19162: UDP, length 65
12:44:25.926110 IP 216.219.95.164.47291 > 46.31.27.36.19162: UDP, length 65
12:44:25.938821 IP 46.31.27.36.19162 > 216.219.95.164.47291: UDP, length 529
12:44:26.079269 IP 46.31.27.36.19162 > 216.219.95.164.47291: UDP, length 81
12:44:26.083287 IP 216.219.95.164.47291 > 46.31.27.36.19162: UDP, length 81
12:44:26.139986 IP 46.31.27.36.19162 > 216.219.95.164.47291: UDP, length 241
12:44:26.140878 IP 46.31.27.36.19162 > 216.219.95.164.47291: UDP, length 193
12:44:26.241665 IP 46.31.27.36.19162 > 216.219.95.164.47291: UDP, length 81
12:44:26.255429 IP 46.31.27.36.19162 > 216.219.95.164.47291: UDP, length 65
12:44:26.255555 IP 46.31.27.36.19162 > 216.219.95.164.47291: UDP, length 1329
12:44:26.255557 IP 46.31.27.36.19162 > 216.219.95.164.47291: UDP, length 545
12:44:26.263098 IP 216.219.95.164.47291 > 46.31.27.36.19162: UDP, length 65
12:44:26.264103 IP 216.219.95.164.47291 > 46.31.27.36.19162: UDP, length 65
12:44:26.265462 IP 216.219.95.164.47291 > 46.31.27.36.19162: UDP, length 65
12:44:26.321170 IP 216.219.95.164.47291 > 46.31.27.36.19162: UDP, length 81
12:44:26.436454 IP 46.31.27.36.19162 > 216.219.95.164.47291: UDP, length 81
12:44:26.441570 IP 216.219.95.164.47291 > 46.31.27.36.19162: UDP, length 81
12:44:26.461749 IP 46.31.27.36.19162 > 216.219.95.164.47291: UDP, length 81
12:44:26.472928 IP 216.219.95.164.47291 > 46.31.27.36.19162: UDP, length 353
12:44:26.493132 IP 46.31.27.36.19162 > 216.219.95.164.47291: UDP, length 65
12:44:26.493590 IP 46.31.27.36.19162 > 216.219.95.164.47291: UDP, length 1329
12:44:26.493769 IP 46.31.27.36.19162 > 216.219.95.164.47291: UDP, length 625
12:44:26.511462 IP 46.31.27.36.19162 > 216.219.95.164.47291: UDP, length 81
12:44:26.517309 IP 216.219.95.164.47291 > 46.31.27.36.19162: UDP, length 129
12:44:26.573149 IP 216.219.95.164.47291 > 46.31.27.36.19162: UDP, length 65
12:44:26.575500 IP 216.219.95.164.47291 > 46.31.27.36.19162: UDP, length 65
12:44:26.586255 IP 216.219.95.164.47291 > 46.31.27.36.19162: UDP, length 65
12:44:26.613627 IP 46.31.27.36.19162 > 216.219.95.164.47291: UDP, length 65
12:44:26.614529 IP 46.31.27.36.19162 > 216.219.95.164.47291: UDP, length 1329
12:44:26.614530 IP 46.31.27.36.19162 > 216.219.95.164.47291: UDP, length 577
12:44:26.618724 IP 216.219.95.164.47291 > 46.31.27.36.19162: UDP, length 65
12:44:26.621215 IP 216.219.95.164.47291 > 46.31.27.36.19162: UDP, length 65
12:44:26.624941 IP 216.219.95.164.47291 > 46.31.27.36.19162: UDP, length 65
12:44:26.645576 IP 46.31.27.36.19162 > 216.219.95.164.47291: UDP, length 81
12:44:26.649380 IP 216.219.95.164.47291 > 46.31.27.36.19162: UDP, length 81
12:44:26.690750 IP 46.31.27.36.19162 > 216.219.95.164.47291: UDP, length 81
12:44:26.745540 IP 46.31.27.36.19162 > 216.219.95.164.47291: UDP, length 81
12:44:26.747245 IP 216.219.95.164.47291 > 46.31.27.36.19162: UDP, length 81
12:44:26.798572 IP 46.31.27.36.19162 > 216.219.95.164.47291: UDP, length 81
12:44:26.818885 IP 216.219.95.164.47291 > 46.31.27.36.19162: UDP, length 81
12:44:26.821908 IP 46.31.27.36.19162 > 216.219.95.164.47291: UDP, length 65
12:44:26.823260 IP 46.31.27.36.19162 > 216.219.95.164.47291: UDP, length 513
12:44:26.823420 IP 46.31.27.36.19162 > 216.219.95.164.47291: UDP, length 529
12:44:26.829433 IP 216.219.95.164.47291 > 46.31.27.36.19162: UDP, length 81
12:44:26.829659 IP 216.219.95.164.47291 > 46.31.27.36.19162: UDP, length 65
12:44:26.829823 IP 216.219.95.164.47291 > 46.31.27.36.19162: UDP, length 65
12:44:26.919926 IP 46.31.27.36.19162 > 216.219.95.164.47291: UDP, length 65
12:44:26.920474 IP 46.31.27.36.19162 > 216.219.95.164.47291: UDP, length 1329
12:44:26.920477 IP 46.31.27.36.19162 > 216.219.95.164.47291: UDP, length 625
12:44:26.974794 IP 216.219.95.164.47291 > 46.31.27.36.19162: UDP, length 65
12:44:26.974844 IP 216.219.95.164.47291 > 46.31.27.36.19162: UDP, length 65
12:44:26.976030 IP 216.219.95.164.47291 > 46.31.27.36.19162: UDP, length 65
12:44:26.991416 IP 46.31.27.36.19162 > 216.219.95.164.47291: UDP, length 65
12:44:26.991842 IP 46.31.27.36.19162 > 216.219.95.164.47291: UDP, length 1329
12:44:26.991861 IP 46.31.27.36.19162 > 216.219.95.164.47291: UDP, length 561
12:44:27.001161 IP 46.31.27.36.19162 > 216.219.95.164.47291: UDP, length 65
12:44:27.001764 IP 46.31.27.36.19162 > 216.219.95.164.47291: UDP, length 1329
12:44:27.001936 IP 46.31.27.36.19162 > 216.219.95.164.47291: UDP, length 593
12:44:27.001937 IP 46.31.27.36.19162 > 216.219.95.164.47291: UDP, length 81
12:44:27.005558 IP 216.219.95.164.47291 > 46.31.27.36.19162: UDP, length 81
12:44:27.009122 IP 216.219.95.164.47291 > 46.31.27.36.19162: UDP, length 65
12:44:27.009199 IP 216.219.95.164.47291 > 46.31.27.36.19162: UDP, length 65
12:44:27.010463 IP 216.219.95.164.47291 > 46.31.27.36.19162: UDP, length 65
12:44:27.078965 IP 216.219.95.164.47291 > 46.31.27.36.19162: UDP, length 65
12:44:27.079048 IP 216.219.95.164.47291 > 46.31.27.36.19162: UDP, length 65
12:44:27.080297 IP 216.219.95.164.47291 > 46.31.27.36.19162: UDP, length 65
12:44:27.167407 IP 46.31.27.36.19162 > 216.219.95.164.47291: UDP, length 81
12:44:27.177188 IP 46.31.27.36.19162 > 216.219.95.164.47291: UDP, length 65
12:44:27.177486 IP 46.31.27.36.19162 > 216.219.95.164.47291: UDP, length 241
12:44:27.180122 IP 216.219.95.164.47291 > 46.31.27.36.19162: UDP, length 65
12:44:27.180180 IP 216.219.95.164.47291 > 46.31.27.36.19162: UDP, length 65
12:44:27.181294 IP 46.31.27.36.19162 > 216.219.95.164.47291: UDP, length 81
12:44:27.199145 IP 46.31.27.36.19162 > 216.219.95.164.47291: UDP, length 241
12:44:27.200736 IP 216.219.95.164.47291 > 46.31.27.36.19162: UDP, length 81
12:44:27.222237 IP 216.219.95.164.47291 > 46.31.27.36.19162: UDP, length 81
12:44:27.232514 IP 46.31.27.36.19162 > 216.219.95.164.47291: UDP, length 81
12:44:27.373075 IP 46.31.27.36.19162 > 216.219.95.164.47291: UDP, length 65
12:44:27.373471 IP 46.31.27.36.19162 > 216.219.95.164.47291: UDP, length 1329
12:44:27.373781 IP 46.31.27.36.19162 > 216.219.95.164.47291: UDP, length 625
12:44:27.393244 IP 216.219.95.164.47291 > 46.31.27.36.19162: UDP, length 65
12:44:27.393505 IP 46.31.27.36.19162 > 216.219.95.164.47291: UDP, length 65
12:44:27.395204 IP 216.219.95.164.47291 > 46.31.27.36.19162: UDP, length 65
12:44:27.395304 IP 216.219.95.164.47291 > 46.31.27.36.19162: UDP, length 65
12:44:27.396115 IP 46.31.27.36.19162 > 216.219.95.164.47291: UDP, length 1329
12:44:27.396116 IP 46.31.27.36.19162 > 216.219.95.164.47291: UDP, length 689
12:44:27.453148 IP 216.219.95.164.47291 > 46.31.27.36.19162: UDP, length 65
12:44:27.453257 IP 216.219.95.164.47291 > 46.31.27.36.19162: UDP, length 65
12:44:27.453333 IP 216.219.95.164.47291 > 46.31.27.36.19162: UDP, length 65
12:44:27.568977 IP 46.31.27.36.19162 > 216.219.95.164.47291: UDP, length 81
12:44:27.573588 IP 216.219.95.164.47291 > 46.31.27.36.19162: UDP, length 81
12:44:27.745603 IP 46.31.27.36.19162 > 216.219.95.164.47291: UDP, length 65
12:44:27.746825 IP 46.31.27.36.19162 > 216.219.95.164.47291: UDP, length 1329
12:44:27.746827 IP 46.31.27.36.19162 > 216.219.95.164.47291: UDP, length 545
12:44:27.757425 IP 216.219.95.164.47291 > 46.31.27.36.19162: UDP, length 65
12:44:27.757536 IP 216.219.95.164.47291 > 46.31.27.36.19162: UDP, length 65
12:44:27.757652 IP 216.219.95.164.47291 > 46.31.27.36.19162: UDP, length 65
12:44:27.930558 IP 46.31.27.36.19162 > 216.219.95.164.47291: UDP, length 81
12:44:27.936116 IP 216.219.95.164.47291 > 46.31.27.36.19162: UDP, length 81
12:44:28.108905 IP 46.31.27.36.19162 > 216.219.95.164.47291: UDP, length 65
12:44:28.109076 IP 46.31.27.36.19162 > 216.219.95.164.47291: UDP, length 1329
12:44:28.109285 IP 46.31.27.36.19162 > 216.219.95.164.47291: UDP, length 545
12:44:28.113675 IP 216.219.95.164.47291 > 46.31.27.36.19162: UDP, length 65
12:44:28.113784 IP 216.219.95.164.47291 > 46.31.27.36.19162: UDP, length 65
12:44:28.115059 IP 216.219.95.164.47291 > 46.31.27.36.19162: UDP, length 65
12:44:28.325339 IP 46.31.27.36.19162 > 216.219.95.164.47291: UDP, length 785
12:44:28.326393 IP 46.31.27.36.19162 > 216.219.95.164.47291: UDP, length 97
12:44:28.441757 IP 46.31.27.36.19162 > 216.219.95.164.47291: UDP, length 81
12:44:28.444678 IP 216.219.95.164.47291 > 46.31.27.36.19162: UDP, length 81
12:44:28.478496 IP 46.31.27.36.19162 > 216.219.95.164.47291: UDP, length 529
12:44:28.589004 IP 46.31.27.36.19162 > 216.219.95.164.47291: UDP, length 97
12:44:28.616270 IP 46.31.27.36.19162 > 216.219.95.164.47291: UDP, length 65
12:44:28.617827 IP 46.31.27.36.19162 > 216.219.95.164.47291: UDP, length 289
12:44:28.619543 IP 216.219.95.164.47291 > 46.31.27.36.19162: UDP, length 65
12:44:28.621251 IP 216.219.95.164.47291 > 46.31.27.36.19162: UDP, length 65
12:44:28.853568 IP 46.31.27.36.19162 > 216.219.95.164.47291: UDP, length 97
12:44:29.107098 IP 46.31.27.36.19162 > 216.219.95.164.47291: UDP, length 833
12:44:29.109128 IP 46.31.27.36.19162 > 216.219.95.164.47291: UDP, length 785
12:44:29.153881 IP 46.31.27.36.19162 > 216.219.95.164.47291: UDP, length 193
12:44:29.215525 IP 46.31.27.36.19162 > 216.219.95.164.47291: UDP, length 241
12:44:29.451426 IP 46.31.27.36.19162 > 216.219.95.164.47291: UDP, length 81
12:44:29.497791 IP 46.31.27.36.19162 > 216.219.95.164.47291: UDP, length 81
12:44:29.526325 IP 216.219.95.164.47291 > 46.31.27.36.19162: UDP, length 81
12:44:29.552087 IP 216.219.95.164.47291 > 46.31.27.36.19162: UDP, length 81
12:44:29.698861 IP 46.31.27.36.19162 > 216.219.95.164.47291: UDP, length 65
12:44:29.699915 IP 46.31.27.36.19162 > 216.219.95.164.47291: UDP, length 1329
12:44:29.700271 IP 46.31.27.36.19162 > 216.219.95.164.47291: UDP, length 593
12:44:29.724336 IP 46.31.27.36.19162 > 216.219.95.164.47291: UDP, length 65
12:44:29.725720 IP 46.31.27.36.19162 > 216.219.95.164.47291: UDP, length 1329
12:44:29.725721 IP 46.31.27.36.19162 > 216.219.95.164.47291: UDP, length 513
12:44:29.774172 IP 216.219.95.164.47291 > 46.31.27.36.19162: UDP, length 65
12:44:29.774224 IP 216.219.95.164.47291 > 46.31.27.36.19162: UDP, length 65
12:44:29.774268 IP 216.219.95.164.47291 > 46.31.27.36.19162: UDP, length 65
12:44:29.779059 IP 216.219.95.164.47291 > 46.31.27.36.19162: UDP, length 65
12:44:29.779125 IP 216.219.95.164.47291 > 46.31.27.36.19162: UDP, length 65
12:44:29.780412 IP 216.219.95.164.47291 > 46.31.27.36.19162: UDP, length 65
12:44:29.947481 IP 46.31.27.36.19162 > 216.219.95.164.47291: UDP, length 81
12:44:29.976918 IP 46.31.27.36.19162 > 216.219.95.164.47291: UDP, length 81
12:44:30.026889 IP 216.219.95.164.47291 > 46.31.27.36.19162: UDP, length 81
12:44:30.030818 IP 216.219.95.164.47291 > 46.31.27.36.19162: UDP, length 81
12:44:30.198675 IP 46.31.27.36.19162 > 216.219.95.164.47291: UDP, length 65
12:44:30.199840 IP 46.31.27.36.19162 > 216.219.95.164.47291: UDP, length 1329
12:44:30.199842 IP 46.31.27.36.19162 > 216.219.95.164.47291: UDP, length 529
12:44:30.201704 IP 46.31.27.36.19162 > 216.219.95.164.47291: UDP, length 65
12:44:30.202700 IP 46.31.27.36.19162 > 216.219.95.164.47291: UDP, length 1329
12:44:30.202702 IP 46.31.27.36.19162 > 216.219.95.164.47291: UDP, length 577
12:44:30.260401 IP 216.219.95.164.47291 > 46.31.27.36.19162: UDP, length 65
12:44:30.261738 IP 216.219.95.164.47291 > 46.31.27.36.19162: UDP, length 65
12:44:30.263074 IP 216.219.95.164.47291 > 46.31.27.36.19162: UDP, length 65
12:44:30.275528 IP 216.219.95.164.47291 > 46.31.27.36.19162: UDP, length 65
12:44:30.276829 IP 216.219.95.164.47291 > 46.31.27.36.19162: UDP, length 65
12:44:30.279248 IP 216.219.95.164.47291 > 46.31.27.36.19162: UDP, length 65
12:44:31.771439 IP 46.31.27.36.19162 > 216.219.95.164.47291: UDP, length 529
12:44:31.812029 IP 46.31.27.36.19162 > 216.219.95.164.47291: UDP, length 81
12:44:31.814994 IP 216.219.95.164.47291 > 46.31.27.36.19162: UDP, length 81
12:44:31.977054 IP 46.31.27.36.19162 > 216.219.95.164.47291: UDP, length 81
12:44:31.988479 IP 46.31.27.36.19162 > 216.219.95.164.47291: UDP, length 65
12:44:31.989886 IP 46.31.27.36.19162 > 216.219.95.164.47291: UDP, length 289
12:44:31.992357 IP 216.219.95.164.47291 > 46.31.27.36.19162: UDP, length 65
12:44:31.994228 IP 216.219.95.164.47291 > 46.31.27.36.19162: UDP, length 65
12:44:32.173520 IP 46.31.27.36.19162 > 216.219.95.164.47291: UDP, length 193
12:44:32.351982 IP 46.31.27.36.19162 > 216.219.95.164.47291: UDP, length 81
12:44:32.351984 IP 46.31.27.36.19162 > 216.219.95.164.47291: UDP, length 113
12:44:32.352241 IP 46.31.27.36.19162 > 216.219.95.164.47291: UDP, length 113
12:44:32.357935 IP 216.219.95.164.47291 > 46.31.27.36.19162: UDP, length 401
12:44:32.361528 IP 216.219.95.164.47291 > 46.31.27.36.19162: UDP, length 385
12:44:32.420982 IP 216.219.95.164.47291 > 46.31.27.36.19162: UDP, length 81
12:44:32.593025 IP 46.31.27.36.19162 > 216.219.95.164.47291: UDP, length 65
12:44:32.593578 IP 46.31.27.36.19162 > 216.219.95.164.47291: UDP, length 257
12:44:32.660942 IP 216.219.95.164.47291 > 46.31.27.36.19162: UDP, length 65
12:44:32.662265 IP 216.219.95.164.47291 > 46.31.27.36.19162: UDP, length 65
12:44:32.832249 IP 46.31.27.36.19162 > 216.219.95.164.47291: UDP, length 65
12:44:33.086209 IP 46.31.27.36.19162 > 216.219.95.164.47291: UDP, length 81
12:44:33.096257 IP 216.219.95.164.47291 > 46.31.27.36.19162: UDP, length 81
12:44:33.224543 IP 46.31.27.36.19162 > 216.219.95.164.47291: UDP, length 241
12:44:33.268390 IP 46.31.27.36.19162 > 216.219.95.164.47291: UDP, length 65
12:44:33.269347 IP 46.31.27.36.19162 > 216.219.95.164.47291: UDP, length 1329
12:44:33.269612 IP 46.31.27.36.19162 > 216.219.95.164.47291: UDP, length 609
12:44:33.277521 IP 216.219.95.164.47291 > 46.31.27.36.19162: UDP, length 65
12:44:33.279019 IP 216.219.95.164.47291 > 46.31.27.36.19162: UDP, length 65
12:44:33.280576 IP 216.219.95.164.47291 > 46.31.27.36.19162: UDP, length 65
12:44:33.305504 IP 46.31.27.36.19162 > 216.219.95.164.47291: UDP, length 81
12:44:33.323785 IP 216.219.95.164.47291 > 46.31.27.36.19162: UDP, length 81
12:44:33.411687 IP 46.31.27.36.19162 > 216.219.95.164.47291: UDP, length 65
12:44:33.451193 IP 46.31.27.36.19162 > 216.219.95.164.47291: UDP, length 81
12:44:33.465266 IP 216.219.95.164.47291 > 46.31.27.36.19162: UDP, length 81
12:44:33.495802 IP 46.31.27.36.19162 > 216.219.95.164.47291: UDP, length 65
12:44:33.497059 IP 46.31.27.36.19162 > 216.219.95.164.47291: UDP, length 1329
12:44:33.497433 IP 46.31.27.36.19162 > 216.219.95.164.47291: UDP, length 625
12:44:33.507791 IP 46.31.27.36.19162 > 216.219.95.164.47291: UDP, length 81
12:44:33.517291 IP 216.219.95.164.47291 > 46.31.27.36.19162: UDP, length 65
12:44:33.517447 IP 216.219.95.164.47291 > 46.31.27.36.19162: UDP, length 65
12:44:33.517536 IP 216.219.95.164.47291 > 46.31.27.36.19162: UDP, length 65
12:44:33.567112 IP 216.219.95.164.47291 > 46.31.27.36.19162: UDP, length 81
12:44:33.637313 IP 46.31.27.36.19162 > 216.219.95.164.47291: UDP, length 65
12:44:33.638702 IP 46.31.27.36.19162 > 216.219.95.164.47291: UDP, length 1329
12:44:33.638779 IP 46.31.27.36.19162 > 216.219.95.164.47291: UDP, length 545
12:44:33.646890 IP 216.219.95.164.47291 > 46.31.27.36.19162: UDP, length 65
12:44:33.648287 IP 216.219.95.164.47291 > 46.31.27.36.19162: UDP, length 65
12:44:33.649679 IP 216.219.95.164.47291 > 46.31.27.36.19162: UDP, length 65
12:44:33.690328 IP 46.31.27.36.19162 > 216.219.95.164.47291: UDP, length 81
12:44:33.708120 IP 216.219.95.164.47291 > 46.31.27.36.19162: UDP, length 81
12:44:33.738673 IP 46.31.27.36.19162 > 216.219.95.164.47291: UDP, length 65
12:44:33.739508 IP 46.31.27.36.19162 > 216.219.95.164.47291: UDP, length 1329
12:44:33.739651 IP 46.31.27.36.19162 > 216.219.95.164.47291: UDP, length 545
12:44:33.794578 IP 216.219.95.164.47291 > 46.31.27.36.19162: UDP, length 65
12:44:33.794736 IP 216.219.95.164.47291 > 46.31.27.36.19162: UDP, length 65
12:44:33.796232 IP 216.219.95.164.47291 > 46.31.27.36.19162: UDP, length 65
12:44:33.879296 IP 46.31.27.36.19162 > 216.219.95.164.47291: UDP, length 65
12:44:33.880273 IP 46.31.27.36.19162 > 216.219.95.164.47291: UDP, length 1329
12:44:33.880346 IP 46.31.27.36.19162 > 216.219.95.164.47291: UDP, length 593
12:44:33.897654 IP 216.219.95.164.47291 > 46.31.27.36.19162: UDP, length 65
12:44:33.899084 IP 216.219.95.164.47291 > 46.31.27.36.19162: UDP, length 65
12:44:33.900612 IP 216.219.95.164.47291 > 46.31.27.36.19162: UDP, length 65
12:44:33.933304 IP 46.31.27.36.19162 > 216.219.95.164.47291: UDP, length 81
12:44:33.991297 IP 46.31.27.36.19162 > 216.219.95.164.47291: UDP, length 81
12:44:34.005766 IP 216.219.95.164.47291 > 46.31.27.36.19162: UDP, length 81
12:44:34.047366 IP 216.219.95.164.47291 > 46.31.27.36.19162: UDP, length 81
12:44:34.071601 IP 46.31.27.36.19162 > 216.219.95.164.47291: UDP, length 81
12:44:34.076768 IP 216.219.95.164.47291 > 46.31.27.36.19162: UDP, length 81
12:44:34.178197 IP 46.31.27.36.19162 > 216.219.95.164.47291: UDP, length 65
12:44:34.178568 IP 46.31.27.36.19162 > 216.219.95.164.47291: UDP, length 257
12:44:34.219499 IP 46.31.27.36.19162 > 216.219.95.164.47291: UDP, length 65
12:44:34.219853 IP 46.31.27.36.19162 > 216.219.95.164.47291: UDP, length 1329
12:44:34.220057 IP 46.31.27.36.19162 > 216.219.95.164.47291: UDP, length 577
12:44:34.248222 IP 46.31.27.36.19162 > 216.219.95.164.47291: UDP, length 65
12:44:34.248965 IP 46.31.27.36.19162 > 216.219.95.164.47291: UDP, length 1329
12:44:34.249003 IP 46.31.27.36.19162 > 216.219.95.164.47291: UDP, length 609
12:44:34.253185 IP 216.219.95.164.47291 > 46.31.27.36.19162: UDP, length 65
12:44:34.254480 IP 216.219.95.164.47291 > 46.31.27.36.19162: UDP, length 65
12:44:34.254728 IP 216.219.95.164.47291 > 46.31.27.36.19162: UDP, length 65
12:44:34.254866 IP 216.219.95.164.47291 > 46.31.27.36.19162: UDP, length 65
12:44:34.255016 IP 216.219.95.164.47291 > 46.31.27.36.19162: UDP, length 65
12:44:34.279861 IP 216.219.95.164.47291 > 46.31.27.36.19162: UDP, length 65
12:44:34.280052 IP 216.219.95.164.47291 > 46.31.27.36.19162: UDP, length 65
12:44:34.280143 IP 216.219.95.164.47291 > 46.31.27.36.19162: UDP, length 65
12:44:34.354892 IP 46.31.27.36.19162 > 216.219.95.164.47291: UDP, length 81
12:44:34.355265 IP 46.31.27.36.19162 > 216.219.95.164.47291: UDP, length 97
12:44:34.355312 IP 46.31.27.36.19162 > 216.219.95.164.47291: UDP, length 97
12:44:34.361083 IP 216.219.95.164.47291 > 46.31.27.36.19162: UDP, length 225
12:44:34.363729 IP 216.219.95.164.47291 > 46.31.27.36.19162: UDP, length 273
12:44:34.406371 IP 216.219.95.164.47291 > 46.31.27.36.19162: UDP, length 81
12:44:34.428806 IP 46.31.27.36.19162 > 216.219.95.164.47291: UDP, length 81
12:44:34.434041 IP 216.219.95.164.47291 > 46.31.27.36.19162: UDP, length 81
12:44:34.446706 IP 46.31.27.36.19162 > 216.219.95.164.47291: UDP, length 65
12:44:34.578297 IP 46.31.27.36.19162 > 216.219.95.164.47291: UDP, length 65
12:44:34.579321 IP 46.31.27.36.19162 > 216.219.95.164.47291: UDP, length 289
12:44:34.606057 IP 46.31.27.36.19162 > 216.219.95.164.47291: UDP, length 65
12:44:34.606740 IP 46.31.27.36.19162 > 216.219.95.164.47291: UDP, length 1329
12:44:34.606742 IP 46.31.27.36.19162 > 216.219.95.164.47291: UDP, length 545
12:44:34.611709 IP 216.219.95.164.47291 > 46.31.27.36.19162: UDP, length 65
12:44:34.611783 IP 216.219.95.164.47291 > 46.31.27.36.19162: UDP, length 65
12:44:34.614196 IP 216.219.95.164.47291 > 46.31.27.36.19162: UDP, length 65
12:44:34.628790 IP 216.219.95.164.47291 > 46.31.27.36.19162: UDP, length 65
12:44:34.635829 IP 46.31.27.36.19162 > 216.219.95.164.47291: UDP, length 81
12:44:34.641350 IP 216.219.95.164.47291 > 46.31.27.36.19162: UDP, length 81
12:44:34.739518 IP 46.31.27.36.19162 > 216.219.95.164.47291: UDP, length 33
12:44:34.814347 IP 46.31.27.36.19162 > 216.219.95.164.47291: UDP, length 65
12:44:34.817481 IP 46.31.27.36.19162 > 216.219.95.164.47291: UDP, length 529
12:44:34.820650 IP 216.219.95.164.47291 > 46.31.27.36.19162: UDP, length 65
12:44:35.029017 IP 46.31.27.36.19162 > 216.219.95.164.47291: UDP, length 81
12:44:35.052453 IP 46.31.27.36.19162 > 216.219.95.164.47291: UDP, length 529
12:44:35.111873 IP 216.219.95.164.47291 > 46.31.27.36.19162: UDP, length 81
12:44:35.178445 IP 46.31.27.36.19162 > 216.219.95.164.47291: UDP, length 193
12:44:35.193053 IP 46.31.27.36.19162 > 216.219.95.164.47291: UDP, length 81
12:44:35.197416 IP 216.219.95.164.47291 > 46.31.27.36.19162: UDP, length 81
12:44:35.284333 IP 46.31.27.36.19162 > 216.219.95.164.47291: UDP, length 65
12:44:35.284699 IP 46.31.27.36.19162 > 216.219.95.164.47291: UDP, length 81
12:44:35.285472 IP 46.31.27.36.19162 > 216.219.95.164.47291: UDP, length 1329
12:44:35.285649 IP 46.31.27.36.19162 > 216.219.95.164.47291: UDP, length 561
12:44:35.362325 IP 216.219.95.164.47291 > 46.31.27.36.19162: UDP, length 65
12:44:35.363651 IP 216.219.95.164.47291 > 46.31.27.36.19162: UDP, length 81
12:44:35.363692 IP 216.219.95.164.47291 > 46.31.27.36.19162: UDP, length 65
12:44:35.365158 IP 216.219.95.164.47291 > 46.31.27.36.19162: UDP, length 65
12:44:35.370392 IP 46.31.27.36.19162 > 216.219.95.164.47291: UDP, length 65
12:44:35.371321 IP 46.31.27.36.19162 > 216.219.95.164.47291: UDP, length 289
12:44:35.373656 IP 216.219.95.164.47291 > 46.31.27.36.19162: UDP, length 65
12:44:35.375000 IP 216.219.95.164.47291 > 46.31.27.36.19162: UDP, length 65
12:44:35.535890 IP 46.31.27.36.19162 > 216.219.95.164.47291: UDP, length 65
12:44:35.535891 IP 46.31.27.36.19162 > 216.219.95.164.47291: UDP, length 81
12:44:35.536979 IP 46.31.27.36.19162 > 216.219.95.164.47291: UDP, length 1329
12:44:35.536980 IP 46.31.27.36.19162 > 216.219.95.164.47291: UDP, length 593
12:44:35.553205 IP 46.31.27.36.19162 > 216.219.95.164.47291: UDP, length 97
12:44:35.556792 IP 216.219.95.164.47291 > 46.31.27.36.19162: UDP, length 193
12:44:35.612529 IP 216.219.95.164.47291 > 46.31.27.36.19162: UDP, length 65
12:44:35.613729 IP 216.219.95.164.47291 > 46.31.27.36.19162: UDP, length 65
12:44:35.613791 IP 216.219.95.164.47291 > 46.31.27.36.19162: UDP, length 65
12:44:35.615256 IP 216.219.95.164.47291 > 46.31.27.36.19162: UDP, length 81
12:44:35.649149 IP 46.31.27.36.19162 > 216.219.95.164.47291: UDP, length 81
12:44:35.653774 IP 216.219.95.164.47291 > 46.31.27.36.19162: UDP, length 193
12:44:35.731251 IP 46.31.27.36.19162 > 216.219.95.164.47291: UDP, length 81
12:44:35.775031 IP 46.31.27.36.19162 > 216.219.95.164.47291: UDP, length 97
12:44:35.782286 IP 216.219.95.164.47291 > 46.31.27.36.19162: UDP, length 257
12:44:35.784161 IP 46.31.27.36.19162 > 216.219.95.164.47291: UDP, length 81
12:44:35.786556 IP 46.31.27.36.19162 > 216.219.95.164.47291: UDP, length 65
12:44:35.787605 IP 46.31.27.36.19162 > 216.219.95.164.47291: UDP, length 1329
12:44:35.787606 IP 46.31.27.36.19162 > 216.219.95.164.47291: UDP, length 625
12:44:35.826511 IP 46.31.27.36.19162 > 216.219.95.164.47291: UDP, length 81
12:44:35.830143 IP 216.219.95.164.47291 > 46.31.27.36.19162: UDP, length 81
12:44:35.863685 IP 216.219.95.164.47291 > 46.31.27.36.19162: UDP, length 81
12:44:35.863757 IP 216.219.95.164.47291 > 46.31.27.36.19162: UDP, length 65
12:44:35.863832 IP 216.219.95.164.47291 > 46.31.27.36.19162: UDP, length 65
12:44:35.863895 IP 216.219.95.164.47291 > 46.31.27.36.19162: UDP, length 65
12:44:35.882237 IP 216.219.95.164.47291 > 46.31.27.36.19162: UDP, length 81
12:44:35.959458 IP 46.31.27.36.19162 > 216.219.95.164.47291: UDP, length 81
12:44:35.962296 IP 216.219.95.164.47291 > 46.31.27.36.19162: UDP, length 81
12:44:36.002768 IP 46.31.27.36.19162 > 216.219.95.164.47291: UDP, length 65
12:44:36.003457 IP 46.31.27.36.19162 > 216.219.95.164.47291: UDP, length 161
12:44:36.006927 IP 216.219.95.164.47291 > 46.31.27.36.19162: UDP, length 65
12:44:36.007102 IP 216.219.95.164.47291 > 46.31.27.36.19162: UDP, length 65
12:44:36.034980 IP 46.31.27.36.19162 > 216.219.95.164.47291: UDP, length 65
12:44:36.036337 IP 46.31.27.36.19162 > 216.219.95.164.47291: UDP, length 1329
12:44:36.037152 IP 46.31.27.36.19162 > 216.219.95.164.47291: UDP, length 561
12:44:36.053569 IP 46.31.27.36.19162 > 216.219.95.164.47291: UDP, length 65
12:44:36.054703 IP 46.31.27.36.19162 > 216.219.95.164.47291: UDP, length 289
12:44:36.113300 IP 216.219.95.164.47291 > 46.31.27.36.19162: UDP, length 65
12:44:36.114480 IP 216.219.95.164.47291 > 46.31.27.36.19162: UDP, length 65
12:44:36.114512 IP 216.219.95.164.47291 > 46.31.27.36.19162: UDP, length 65
12:44:36.134112 IP 46.31.27.36.19162 > 216.219.95.164.47291: UDP, length 65
12:44:36.135047 IP 46.31.27.36.19162 > 216.219.95.164.47291: UDP, length 353
12:44:36.137158 IP 216.219.95.164.47291 > 46.31.27.36.19162: UDP, length 65
12:44:36.138455 IP 216.219.95.164.47291 > 46.31.27.36.19162: UDP, length 65
12:44:36.204115 IP 216.219.95.164.47291 > 46.31.27.36.19162: UDP, length 65
12:44:36.322363 IP 46.31.27.36.19162 > 216.219.95.164.47291: UDP, length 81
12:44:36.326299 IP 216.219.95.164.47291 > 46.31.27.36.19162: UDP, length 193
12:44:36.390821 IP 46.31.27.36.19162 > 216.219.95.164.47291: UDP, length 81
12:44:36.462501 IP 216.219.95.164.47291 > 46.31.27.36.19162: UDP, length 81
12:44:36.487966 IP 46.31.27.36.19162 > 216.219.95.164.47291: UDP, length 65
12:44:36.498878 IP 46.31.27.36.19162 > 216.219.95.164.47291: UDP, length 81
12:44:36.501887 IP 216.219.95.164.47291 > 46.31.27.36.19162: UDP, length 81
12:44:36.635796 IP 46.31.27.36.19162 > 216.219.95.164.47291: UDP, length 65
12:44:36.636590 IP 46.31.27.36.19162 > 216.219.95.164.47291: UDP, length 257
12:44:36.674456 IP 46.31.27.36.19162 > 216.219.95.164.47291: UDP, length 65
12:44:36.674996 IP 46.31.27.36.19162 > 216.219.95.164.47291: UDP, length 289
12:44:36.678040 IP 216.219.95.164.47291 > 46.31.27.36.19162: UDP, length 65
12:44:36.679634 IP 216.219.95.164.47291 > 46.31.27.36.19162: UDP, length 65
12:44:36.706036 IP 216.219.95.164.47291 > 46.31.27.36.19162: UDP, length 65
12:44:36.708938 IP 216.219.95.164.47291 > 46.31.27.36.19162: UDP, length 65
12:44:36.867362 IP 46.31.27.36.19162 > 216.219.95.164.47291: UDP, length 81
12:44:36.871684 IP 216.219.95.164.47291 > 46.31.27.36.19162: UDP, length 129
12:44:36.973600 IP 46.31.27.36.19162 > 216.219.95.164.47291: UDP, length 81
12:44:37.044952 IP 46.31.27.36.19162 > 216.219.95.164.47291: UDP, length 81
12:44:37.047312 IP 216.219.95.164.47291 > 46.31.27.36.19162: UDP, length 81
12:44:37.219367 IP 46.31.27.36.19162 > 216.219.95.164.47291: UDP, length 65
12:44:37.219896 IP 46.31.27.36.19162 > 216.219.95.164.47291: UDP, length 273
12:44:37.224026 IP 216.219.95.164.47291 > 46.31.27.36.19162: UDP, length 65
12:44:37.224117 IP 216.219.95.164.47291 > 46.31.27.36.19162: UDP, length 65
12:44:37.239262 IP 46.31.27.36.19162 > 216.219.95.164.47291: UDP, length 241
12:44:38.192226 IP 46.31.27.36.19162 > 216.219.95.164.47291: UDP, length 193
12:44:38.347395 IP 46.31.27.36.19162 > 216.219.95.164.47291: UDP, length 529
12:44:39.502834 IP 46.31.27.36.19162 > 216.219.95.164.47291: UDP, length 81
12:44:39.559789 IP 216.219.95.164.47291 > 46.31.27.36.19162: UDP, length 81
12:44:39.731574 IP 46.31.27.36.19162 > 216.219.95.164.47291: UDP, length 65
12:44:39.731910 IP 46.31.27.36.19162 > 216.219.95.164.47291: UDP, length 81
12:44:39.732995 IP 46.31.27.36.19162 > 216.219.95.164.47291: UDP, length 1329
12:44:39.734071 IP 46.31.27.36.19162 > 216.219.95.164.47291: UDP, length 545
12:44:39.792002 IP 216.219.95.164.47291 > 46.31.27.36.19162: UDP, length 65
12:44:39.793473 IP 216.219.95.164.47291 > 46.31.27.36.19162: UDP, length 65
12:44:39.793578 IP 216.219.95.164.47291 > 46.31.27.36.19162: UDP, length 65
12:44:39.794936 IP 216.219.95.164.47291 > 46.31.27.36.19162: UDP, length 65
12:44:39.986273 IP 46.31.27.36.19162 > 216.219.95.164.47291: UDP, length 81
12:44:40.041120 IP 216.219.95.164.47291 > 46.31.27.36.19162: UDP, length 81
12:44:40.179666 IP 46.31.27.36.19162 > 216.219.95.164.47291: UDP, length 81
12:44:40.189471 IP 46.31.27.36.19162 > 216.219.95.164.47291: UDP, length 97
12:44:40.189473 IP 46.31.27.36.19162 > 216.219.95.164.47291: UDP, length 97
12:44:40.193169 IP 216.219.95.164.47291 > 46.31.27.36.19162: UDP, length 273
12:44:40.195766 IP 216.219.95.164.47291 > 46.31.27.36.19162: UDP, length 225
12:44:40.212502 IP 46.31.27.36.19162 > 216.219.95.164.47291: UDP, length 65
12:44:40.213526 IP 46.31.27.36.19162 > 216.219.95.164.47291: UDP, length 1329
12:44:40.213527 IP 46.31.27.36.19162 > 216.219.95.164.47291: UDP, length 545
12:44:40.250511 IP 216.219.95.164.47291 > 46.31.27.36.19162: UDP, length 81
12:44:40.268815 IP 216.219.95.164.47291 > 46.31.27.36.19162: UDP, length 65
12:44:40.268974 IP 216.219.95.164.47291 > 46.31.27.36.19162: UDP, length 65
12:44:40.272675 IP 216.219.95.164.47291 > 46.31.27.36.19162: UDP, length 65
12:44:40.424571 IP 46.31.27.36.19162 > 216.219.95.164.47291: UDP, length 65
12:44:40.424922 IP 46.31.27.36.19162 > 216.219.95.164.47291: UDP, length 257
12:44:40.495801 IP 216.219.95.164.47291 > 46.31.27.36.19162: UDP, length 65
12:44:40.562963 IP 46.31.27.36.19162 > 216.219.95.164.47291: UDP, length 65
12:44:40.963636 IP 46.31.27.36.19162 > 216.219.95.164.47291: UDP, length 81
12:44:40.963637 IP 46.31.27.36.19162 > 216.219.95.164.47291: UDP, length 97
12:44:40.963638 IP 46.31.27.36.19162 > 216.219.95.164.47291: UDP, length 97
12:44:40.976822 IP 216.219.95.164.47291 > 46.31.27.36.19162: UDP, length 465
12:44:40.976875 IP 216.219.95.164.47291 > 46.31.27.36.19162: UDP, length 481
12:44:41.042483 IP 216.219.95.164.47291 > 46.31.27.36.19162: UDP, length 81
12:44:41.216220 IP 46.31.27.36.19162 > 216.219.95.164.47291: UDP, length 65
12:44:41.216322 IP 46.31.27.36.19162 > 216.219.95.164.47291: UDP, length 241
12:44:41.252213 IP 46.31.27.36.19162 > 216.219.95.164.47291: UDP, length 241
12:44:41.294582 IP 216.219.95.164.47291 > 46.31.27.36.19162: UDP, length 65
12:44:41.294661 IP 216.219.95.164.47291 > 46.31.27.36.19162: UDP, length 65
12:44:41.970343 IP 46.31.27.36.19162 > 216.219.95.164.47291: UDP, length 81
12:44:44.001258 IP 46.31.27.36.19162 > 216.219.95.164.47291: UDP, length 113
12:44:44.006346 IP 216.219.95.164.47291 > 46.31.27.36.19162: UDP, length 417
12:44:44.181564 IP 46.31.27.36.19162 > 216.219.95.164.47291: UDP, length 81
12:44:44.363623 IP 216.219.95.164.47291 > 46.31.27.36.19162: UDP, length 81
12:44:44.434770 IP 46.31.27.36.19162 > 216.219.95.164.47291: UDP, length 81
12:44:44.534960 IP 46.31.27.36.19162 > 216.219.95.164.47291: UDP, length 65
12:44:44.536544 IP 46.31.27.36.19162 > 216.219.95.164.47291: UDP, length 1329
12:44:44.536544 IP 46.31.27.36.19162 > 216.219.95.164.47291: UDP, length 545
12:44:44.600270 IP 216.219.95.164.47291 > 46.31.27.36.19162: UDP, length 81
12:44:44.637758 IP 46.31.27.36.19162 > 216.219.95.164.47291: UDP, length 65
12:44:44.717404 IP 216.219.95.164.47291 > 46.31.27.36.19162: UDP, length 65
12:44:44.717501 IP 216.219.95.164.47291 > 46.31.27.36.19162: UDP, length 65
12:44:44.718685 IP 216.219.95.164.47291 > 46.31.27.36.19162: UDP, length 65
12:44:44.744179 IP 46.31.27.36.19162 > 216.219.95.164.47291: UDP, length 33
12:44:44.772845 IP 46.31.27.36.19162 > 216.219.95.164.47291: UDP, length 65
12:44:44.773218 IP 46.31.27.36.19162 > 216.219.95.164.47291: UDP, length 1329
12:44:44.773285 IP 46.31.27.36.19162 > 216.219.95.164.47291: UDP, length 577
12:44:44.795006 IP 46.31.27.36.19162 > 216.219.95.164.47291: UDP, length 81
12:44:44.812559 IP 216.219.95.164.47291 > 46.31.27.36.19162: UDP, length 81
12:44:44.889424 IP 46.31.27.36.19162 > 216.219.95.164.47291: UDP, length 81
12:44:44.916278 IP 46.31.27.36.19162 > 216.219.95.164.47291: UDP, length 529
12:44:44.938332 IP 216.219.95.164.47291 > 46.31.27.36.19162: UDP, length 65
12:44:44.938973 IP 216.219.95.164.47291 > 46.31.27.36.19162: UDP, length 65
12:44:44.939086 IP 216.219.95.164.47291 > 46.31.27.36.19162: UDP, length 65
12:44:44.984085 IP 46.31.27.36.19162 > 216.219.95.164.47291: UDP, length 65
12:44:44.984652 IP 46.31.27.36.19162 > 216.219.95.164.47291: UDP, length 1329
12:44:44.984653 IP 46.31.27.36.19162 > 216.219.95.164.47291: UDP, length 625
12:44:45.002478 IP 216.219.95.164.47291 > 46.31.27.36.19162: UDP, length 65
12:44:45.003713 IP 216.219.95.164.47291 > 46.31.27.36.19162: UDP, length 65
12:44:45.004973 IP 216.219.95.164.47291 > 46.31.27.36.19162: UDP, length 65
12:44:45.061263 IP 216.219.95.164.47291 > 46.31.27.36.19162: UDP, length 81
12:44:45.112976 IP 46.31.27.36.19162 > 216.219.95.164.47291: UDP, length 81
12:44:45.151667 IP 46.31.27.36.19162 > 216.219.95.164.47291: UDP, length 65
12:44:45.175079 IP 46.31.27.36.19162 > 216.219.95.164.47291: UDP, length 81
12:44:45.192725 IP 216.219.95.164.47291 > 46.31.27.36.19162: UDP, length 81
12:44:45.233503 IP 46.31.27.36.19162 > 216.219.95.164.47291: UDP, length 65
12:44:45.235227 IP 46.31.27.36.19162 > 216.219.95.164.47291: UDP, length 1329
12:44:45.236911 IP 46.31.27.36.19162 > 216.219.95.164.47291: UDP, length 545
12:44:45.281223 IP 216.219.95.164.47291 > 46.31.27.36.19162: UDP, length 81
12:44:45.364951 IP 46.31.27.36.19162 > 216.219.95.164.47291: UDP, length 65
12:44:45.367011 IP 46.31.27.36.19162 > 216.219.95.164.47291: UDP, length 1329
12:44:45.368401 IP 46.31.27.36.19162 > 216.219.95.164.47291: UDP, length 593
12:44:45.384356 IP 216.219.95.164.47291 > 46.31.27.36.19162: UDP, length 65
12:44:45.386362 IP 216.219.95.164.47291 > 46.31.27.36.19162: UDP, length 65
12:44:45.388780 IP 216.219.95.164.47291 > 46.31.27.36.19162: UDP, length 65
12:44:45.407316 IP 216.219.95.164.47291 > 46.31.27.36.19162: UDP, length 65
12:44:45.408757 IP 216.219.95.164.47291 > 46.31.27.36.19162: UDP, length 65
12:44:45.408972 IP 216.219.95.164.47291 > 46.31.27.36.19162: UDP, length 65
12:44:45.453595 IP 46.31.27.36.19162 > 216.219.95.164.47291: UDP, length 65
12:44:45.453918 IP 46.31.27.36.19162 > 216.219.95.164.47291: UDP, length 1329
12:44:45.453920 IP 46.31.27.36.19162 > 216.219.95.164.47291: UDP, length 641
12:44:45.560555 IP 46.31.27.36.19162 > 216.219.95.164.47291: UDP, length 81
12:44:45.565052 IP 216.219.95.164.47291 > 46.31.27.36.19162: UDP, length 81
12:44:45.620030 IP 216.219.95.164.47291 > 46.31.27.36.19162: UDP, length 65
12:44:45.621236 IP 216.219.95.164.47291 > 46.31.27.36.19162: UDP, length 65
12:44:45.622565 IP 216.219.95.164.47291 > 46.31.27.36.19162: UDP, length 65
12:44:45.737872 IP 46.31.27.36.19162 > 216.219.95.164.47291: UDP, length 65
12:44:45.738566 IP 46.31.27.36.19162 > 216.219.95.164.47291: UDP, length 1329
12:44:45.738808 IP 46.31.27.36.19162 > 216.219.95.164.47291: UDP, length 641
12:44:45.745197 IP 216.219.95.164.47291 > 46.31.27.36.19162: UDP, length 65
12:44:45.745279 IP 216.219.95.164.47291 > 46.31.27.36.19162: UDP, length 65
12:44:45.746620 IP 216.219.95.164.47291 > 46.31.27.36.19162: UDP, length 65
12:44:45.918313 IP 46.31.27.36.19162 > 216.219.95.164.47291: UDP, length 81
12:44:45.922908 IP 216.219.95.164.47291 > 46.31.27.36.19162: UDP, length 81
12:44:46.060607 IP 46.31.27.36.19162 > 216.219.95.164.47291: UDP, length 65
12:44:46.094268 IP 46.31.27.36.19162 > 216.219.95.164.47291: UDP, length 65
12:44:46.095087 IP 46.31.27.36.19162 > 216.219.95.164.47291: UDP, length 1329
12:44:46.095122 IP 46.31.27.36.19162 > 216.219.95.164.47291: UDP, length 641
12:44:46.097433 IP 216.219.95.164.47291 > 46.31.27.36.19162: UDP, length 65
12:44:46.098809 IP 216.219.95.164.47291 > 46.31.27.36.19162: UDP, length 65
12:44:46.098901 IP 216.219.95.164.47291 > 46.31.27.36.19162: UDP, length 65
12:44:47.394270 IP 46.31.27.36.19162 > 216.219.95.164.47291: UDP, length 97
12:44:47.399689 IP 216.219.95.164.47291 > 46.31.27.36.19162: UDP, length 161
12:44:47.572122 IP 46.31.27.36.19162 > 216.219.95.164.47291: UDP, length 81
12:44:47.576182 IP 216.219.95.164.47291 > 46.31.27.36.19162: UDP, length 81
12:44:47.749173 IP 46.31.27.36.19162 > 216.219.95.164.47291: UDP, length 65
12:44:47.750270 IP 46.31.27.36.19162 > 216.219.95.164.47291: UDP, length 529
12:44:47.753067 IP 216.219.95.164.47291 > 46.31.27.36.19162: UDP, length 65
12:44:47.879390 IP 46.31.27.36.19162 > 216.219.95.164.47291: UDP, length 65
12:44:48.406609 IP 46.31.27.36.19162 > 216.219.95.164.47291: UDP, length 81
12:44:48.411213 IP 216.219.95.164.47291 > 46.31.27.36.19162: UDP, length 97
12:44:48.584708 IP 46.31.27.36.19162 > 216.219.95.164.47291: UDP, length 81
12:44:48.718884 IP 46.31.27.36.19162 > 216.219.95.164.47291: UDP, length 65
12:44:48.781507 IP 216.219.95.164.47291 > 46.31.27.36.19162: UDP, length 81
12:44:49.281577 IP 46.31.27.36.19162 > 216.219.95.164.47291: UDP, length 241
12:44:49.503612 IP 46.31.27.36.19162 > 216.219.95.164.47291: UDP, length 81
12:44:49.505267 IP 46.31.27.36.19162 > 216.219.95.164.47291: UDP, length 81
12:44:49.559324 IP 216.219.95.164.47291 > 46.31.27.36.19162: UDP, length 81
12:44:49.569581 IP 46.31.27.36.19162 > 216.219.95.164.47291: UDP, length 97
12:44:49.569778 IP 46.31.27.36.19162 > 216.219.95.164.47291: UDP, length 97
12:44:49.569779 IP 46.31.27.36.19162 > 216.219.95.164.47291: UDP, length 81
12:44:49.573070 IP 216.219.95.164.47291 > 46.31.27.36.19162: UDP, length 225
12:44:49.576550 IP 216.219.95.164.47291 > 46.31.27.36.19162: UDP, length 273
12:44:49.583430 IP 216.219.95.164.47291 > 46.31.27.36.19162: UDP, length 81
12:44:49.731495 IP 46.31.27.36.19162 > 216.219.95.164.47291: UDP, length 65
12:44:49.732728 IP 46.31.27.36.19162 > 216.219.95.164.47291: UDP, length 1329
12:44:49.733159 IP 216.219.95.164.47291 > 46.31.27.36.19162: UDP, length 81
12:44:49.733650 IP 46.31.27.36.19162 > 216.219.95.164.47291: UDP, length 545
12:44:49.754714 IP 46.31.27.36.19162 > 216.219.95.164.47291: UDP, length 65
12:44:49.755659 IP 46.31.27.36.19162 > 216.219.95.164.47291: UDP, length 241
12:44:49.788494 IP 216.219.95.164.47291 > 46.31.27.36.19162: UDP, length 65
12:44:49.788591 IP 216.219.95.164.47291 > 46.31.27.36.19162: UDP, length 65
12:44:49.789901 IP 216.219.95.164.47291 > 46.31.27.36.19162: UDP, length 65
12:44:49.832140 IP 216.219.95.164.47291 > 46.31.27.36.19162: UDP, length 65
12:44:49.833303 IP 216.219.95.164.47291 > 46.31.27.36.19162: UDP, length 65
12:44:49.904756 IP 46.31.27.36.19162 > 216.219.95.164.47291: UDP, length 65
12:44:49.905091 IP 46.31.27.36.19162 > 216.219.95.164.47291: UDP, length 257
12:44:49.982401 IP 46.31.27.36.19162 > 216.219.95.164.47291: UDP, length 81
12:44:50.037902 IP 216.219.95.164.47291 > 46.31.27.36.19162: UDP, length 81
12:44:50.063667 IP 216.219.95.164.47291 > 46.31.27.36.19162: UDP, length 65
12:44:50.210019 IP 46.31.27.36.19162 > 216.219.95.164.47291: UDP, length 65
12:44:50.210825 IP 46.31.27.36.19162 > 216.219.95.164.47291: UDP, length 1329
12:44:50.210880 IP 46.31.27.36.19162 > 216.219.95.164.47291: UDP, length 513
12:44:50.265293 IP 216.219.95.164.47291 > 46.31.27.36.19162: UDP, length 65
12:44:50.266521 IP 216.219.95.164.47291 > 46.31.27.36.19162: UDP, length 65
12:44:50.266564 IP 216.219.95.164.47291 > 46.31.27.36.19162: UDP, length 65
12:44:51.197501 IP 46.31.27.36.19162 > 216.219.95.164.47291: UDP, length 81
12:44:51.201352 IP 216.219.95.164.47291 > 46.31.27.36.19162: UDP, length 97
12:44:51.374214 IP 46.31.27.36.19162 > 216.219.95.164.47291: UDP, length 81
12:44:51.378118 IP 216.219.95.164.47291 > 46.31.27.36.19162: UDP, length 193
12:44:51.521694 IP 46.31.27.36.19162 > 216.219.95.164.47291: UDP, length 65
12:44:51.549939 IP 46.31.27.36.19162 > 216.219.95.164.47291: UDP, length 81
12:44:51.554812 IP 216.219.95.164.47291 > 46.31.27.36.19162: UDP, length 81
12:44:51.726872 IP 46.31.27.36.19162 > 216.219.95.164.47291: UDP, length 65
12:44:51.727332 IP 46.31.27.36.19162 > 216.219.95.164.47291: UDP, length 161
12:44:51.730372 IP 216.219.95.164.47291 > 46.31.27.36.19162: UDP, length 65
12:44:51.731692 IP 216.219.95.164.47291 > 46.31.27.36.19162: UDP, length 65
12:44:52.117369 IP 46.31.27.36.19162 > 216.219.95.164.47291: UDP, length 81
12:44:52.185500 IP 216.219.95.164.47291 > 46.31.27.36.19162: UDP, length 81
12:44:52.227320 IP 46.31.27.36.19162 > 216.219.95.164.47291: UDP, length 81
12:44:52.227896 IP 46.31.27.36.19162 > 216.219.95.164.47291: UDP, length 113
12:44:52.233148 IP 216.219.95.164.47291 > 46.31.27.36.19162: UDP, length 113
12:44:52.235541 IP 216.219.95.164.47291 > 46.31.27.36.19162: UDP, length 289
12:44:52.356793 IP 46.31.27.36.19162 > 216.219.95.164.47291: UDP, length 65
12:44:52.358809 IP 46.31.27.36.19162 > 216.219.95.164.47291: UDP, length 529
12:44:52.405127 IP 46.31.27.36.19162 > 216.219.95.164.47291: UDP, length 81
12:44:52.405466 IP 46.31.27.36.19162 > 216.219.95.164.47291: UDP, length 81
12:44:52.407779 IP 46.31.27.36.19162 > 216.219.95.164.47291: UDP, length 81
12:44:52.409015 IP 216.219.95.164.47291 > 46.31.27.36.19162: UDP, length 81
12:44:52.409065 IP 216.219.95.164.47291 > 46.31.27.36.19162: UDP, length 81
12:44:52.410306 IP 216.219.95.164.47291 > 46.31.27.36.19162: UDP, length 81
12:44:52.424282 IP 216.219.95.164.47291 > 46.31.27.36.19162: UDP, length 65
12:44:52.425835 IP 216.219.95.164.47291 > 46.31.27.36.19162: UDP, length 65
12:44:52.580363 IP 46.31.27.36.19162 > 216.219.95.164.47291: UDP, length 65
12:44:52.581461 IP 46.31.27.36.19162 > 216.219.95.164.47291: UDP, length 1329
12:44:52.581462 IP 46.31.27.36.19162 > 216.219.95.164.47291: UDP, length 529
12:44:52.581463 IP 46.31.27.36.19162 > 216.219.95.164.47291: UDP, length 65
12:44:52.581463 IP 46.31.27.36.19162 > 216.219.95.164.47291: UDP, length 65
12:44:52.581472 IP 46.31.27.36.19162 > 216.219.95.164.47291: UDP, length 1329
12:44:52.582253 IP 46.31.27.36.19162 > 216.219.95.164.47291: UDP, length 529
12:44:52.582352 IP 46.31.27.36.19162 > 216.219.95.164.47291: UDP, length 1329
12:44:52.582353 IP 46.31.27.36.19162 > 216.219.95.164.47291: UDP, length 1057
12:44:52.588299 IP 216.219.95.164.47291 > 46.31.27.36.19162: UDP, length 65
12:44:52.588350 IP 216.219.95.164.47291 > 46.31.27.36.19162: UDP, length 65
12:44:52.588769 IP 216.219.95.164.47291 > 46.31.27.36.19162: UDP, length 65
12:44:52.588819 IP 216.219.95.164.47291 > 46.31.27.36.19162: UDP, length 65
12:44:52.589264 IP 216.219.95.164.47291 > 46.31.27.36.19162: UDP, length 65
12:44:52.589439 IP 216.219.95.164.47291 > 46.31.27.36.19162: UDP, length 65
12:44:52.589749 IP 216.219.95.164.47291 > 46.31.27.36.19162: UDP, length 65
12:44:52.591589 IP 216.219.95.164.47291 > 46.31.27.36.19162: UDP, length 65
12:44:52.592888 IP 216.219.95.164.47291 > 46.31.27.36.19162: UDP, length 65
12:44:52.760266 IP 46.31.27.36.19162 > 216.219.95.164.47291: UDP, length 81
12:44:52.760419 IP 46.31.27.36.19162 > 216.219.95.164.47291: UDP, length 81
12:44:52.760644 IP 46.31.27.36.19162 > 216.219.95.164.47291: UDP, length 81
12:44:52.763573 IP 216.219.95.164.47291 > 46.31.27.36.19162: UDP, length 81
12:44:52.764762 IP 216.219.95.164.47291 > 46.31.27.36.19162: UDP, length 81
12:44:52.764832 IP 216.219.95.164.47291 > 46.31.27.36.19162: UDP, length 81
12:44:52.934842 IP 46.31.27.36.19162 > 216.219.95.164.47291: UDP, length 65
12:44:52.935487 IP 46.31.27.36.19162 > 216.219.95.164.47291: UDP, length 1329
12:44:52.935488 IP 46.31.27.36.19162 > 216.219.95.164.47291: UDP, length 561
12:44:52.935489 IP 46.31.27.36.19162 > 216.219.95.164.47291: UDP, length 65
12:44:52.935490 IP 46.31.27.36.19162 > 216.219.95.164.47291: UDP, length 65
12:44:52.935737 IP 46.31.27.36.19162 > 216.219.95.164.47291: UDP, length 1329
12:44:52.935867 IP 46.31.27.36.19162 > 216.219.95.164.47291: UDP, length 1057
12:44:52.936036 IP 46.31.27.36.19162 > 216.219.95.164.47291: UDP, length 1329
12:44:52.936038 IP 46.31.27.36.19162 > 216.219.95.164.47291: UDP, length 625
12:44:52.953131 IP 216.219.95.164.47291 > 46.31.27.36.19162: UDP, length 65
12:44:52.953178 IP 216.219.95.164.47291 > 46.31.27.36.19162: UDP, length 65
12:44:52.955619 IP 216.219.95.164.47291 > 46.31.27.36.19162: UDP, length 65
12:44:52.958655 IP 216.219.95.164.47291 > 46.31.27.36.19162: UDP, length 65
12:44:52.958701 IP 216.219.95.164.47291 > 46.31.27.36.19162: UDP, length 65
12:44:52.964498 IP 216.219.95.164.47291 > 46.31.27.36.19162: UDP, length 65
12:44:52.964631 IP 216.219.95.164.47291 > 46.31.27.36.19162: UDP, length 65
12:44:52.967799 IP 216.219.95.164.47291 > 46.31.27.36.19162: UDP, length 65
12:44:52.967849 IP 216.219.95.164.47291 > 46.31.27.36.19162: UDP, length 65
12:44:53.152731 IP 46.31.27.36.19162 > 216.219.95.164.47291: UDP, length 81
12:44:53.172322 IP 46.31.27.36.19162 > 216.219.95.164.47291: UDP, length 97
12:44:53.175886 IP 216.219.95.164.47291 > 46.31.27.36.19162: UDP, length 113
12:44:53.228125 IP 46.31.27.36.19162 > 216.219.95.164.47291: UDP, length 97
12:44:53.231651 IP 216.219.95.164.47291 > 46.31.27.36.19162: UDP, length 129
12:44:53.347588 IP 46.31.27.36.19162 > 216.219.95.164.47291: UDP, length 81
12:44:53.348937 IP 216.219.95.164.47291 > 46.31.27.36.19162: UDP, length 81
12:44:53.350416 IP 216.219.95.164.47291 > 46.31.27.36.19162: UDP, length 81
12:44:53.404564 IP 46.31.27.36.19162 > 216.219.95.164.47291: UDP, length 1297
12:44:53.404725 IP 46.31.27.36.19162 > 216.219.95.164.47291: UDP, length 1297
12:44:53.404805 IP 46.31.27.36.19162 > 216.219.95.164.47291: UDP, length 129
12:44:53.409847 IP 216.219.95.164.47291 > 46.31.27.36.19162: UDP, length 97
12:44:53.410224 IP 216.219.95.164.47291 > 46.31.27.36.19162: UDP, length 1297
12:44:53.410545 IP 216.219.95.164.47291 > 46.31.27.36.19162: UDP, length 1297
12:44:53.416417 IP 216.219.95.164.47291 > 46.31.27.36.19162: UDP, length 1297
12:44:53.417883 IP 216.219.95.164.47291 > 46.31.27.36.19162: UDP, length 1297
12:44:53.418198 IP 216.219.95.164.47291 > 46.31.27.36.19162: UDP, length 833
12:44:53.463982 IP 216.219.95.164.47291 > 46.31.27.36.19162: UDP, length 1297
12:44:53.469412 IP 46.31.27.36.19162 > 216.219.95.164.47291: UDP, length 1297
12:44:53.469576 IP 46.31.27.36.19162 > 216.219.95.164.47291: UDP, length 1297
12:44:53.469586 IP 46.31.27.36.19162 > 216.219.95.164.47291: UDP, length 1297
12:44:53.469588 IP 46.31.27.36.19162 > 216.219.95.164.47291: UDP, length 1297
12:44:53.474151 IP 216.219.95.164.47291 > 46.31.27.36.19162: UDP, length 1297
12:44:53.474253 IP 216.219.95.164.47291 > 46.31.27.36.19162: UDP, length 1297
12:44:53.474339 IP 216.219.95.164.47291 > 46.31.27.36.19162: UDP, length 1297
12:44:53.475704 IP 216.219.95.164.47291 > 46.31.27.36.19162: UDP, length 1297
12:44:53.521579 IP 46.31.27.36.19162 > 216.219.95.164.47291: UDP, length 65
12:44:53.522003 IP 46.31.27.36.19162 > 216.219.95.164.47291: UDP, length 1329
12:44:53.522084 IP 46.31.27.36.19162 > 216.219.95.164.47291: UDP, length 1009
12:44:53.527437 IP 216.219.95.164.47291 > 46.31.27.36.19162: UDP, length 1297
12:44:53.527522 IP 216.219.95.164.47291 > 46.31.27.36.19162: UDP, length 65
12:44:53.530095 IP 216.219.95.164.47291 > 46.31.27.36.19162: UDP, length 65
12:44:53.531428 IP 216.219.95.164.47291 > 46.31.27.36.19162: UDP, length 65
12:44:53.580374 IP 46.31.27.36.19162 > 216.219.95.164.47291: UDP, length 1297
12:44:53.583630 IP 216.219.95.164.47291 > 46.31.27.36.19162: UDP, length 1297
12:44:53.588393 IP 46.31.27.36.19162 > 216.219.95.164.47291: UDP, length 1297
12:44:53.590130 IP 46.31.27.36.19162 > 216.219.95.164.47291: UDP, length 97
12:44:53.590449 IP 46.31.27.36.19162 > 216.219.95.164.47291: UDP, length 225
12:44:53.590493 IP 46.31.27.36.19162 > 216.219.95.164.47291: UDP, length 673
12:44:53.594363 IP 216.219.95.164.47291 > 46.31.27.36.19162: UDP, length 1009
12:44:53.596848 IP 216.219.95.164.47291 > 46.31.27.36.19162: UDP, length 81
12:44:53.599436 IP 216.219.95.164.47291 > 46.31.27.36.19162: UDP, length 177
12:44:53.688200 IP 216.219.95.164.47291 > 46.31.27.36.19162: UDP, length 593
12:44:53.689510 IP 216.219.95.164.47291 > 46.31.27.36.19162: UDP, length 81
12:44:53.699489 IP 46.31.27.36.19162 > 216.219.95.164.47291: UDP, length 225
12:44:53.700735 IP 46.31.27.36.19162 > 216.219.95.164.47291: UDP, length 81
12:44:53.702659 IP 216.219.95.164.47291 > 46.31.27.36.19162: UDP, length 81
12:44:53.703917 IP 216.219.95.164.47291 > 46.31.27.36.19162: UDP, length 81
12:44:53.766810 IP 46.31.27.36.19162 > 216.219.95.164.47291: UDP, length 81
12:44:53.771003 IP 46.31.27.36.19162 > 216.219.95.164.47291: UDP, length 81
12:44:53.860449 IP 46.31.27.36.19162 > 216.219.95.164.47291: UDP, length 97
12:44:53.865017 IP 216.219.95.164.47291 > 46.31.27.36.19162: UDP, length 81
12:44:53.874442 IP 46.31.27.36.19162 > 216.219.95.164.47291: UDP, length 65
12:44:53.875217 IP 46.31.27.36.19162 > 216.219.95.164.47291: UDP, length 1329
12:44:53.875617 IP 46.31.27.36.19162 > 216.219.95.164.47291: UDP, length 1105
12:44:53.878611 IP 216.219.95.164.47291 > 46.31.27.36.19162: UDP, length 65
12:44:53.878698 IP 216.219.95.164.47291 > 46.31.27.36.19162: UDP, length 65
12:44:53.880116 IP 216.219.95.164.47291 > 46.31.27.36.19162: UDP, length 65
12:44:53.894438 IP 46.31.27.36.19162 > 216.219.95.164.47291: UDP, length 81
12:44:54.171183 IP 46.31.27.36.19162 > 216.219.95.164.47291: UDP, length 81
12:44:54.171186 IP 46.31.27.36.19162 > 216.219.95.164.47291: UDP, length 81
12:44:54.174716 IP 216.219.95.164.47291 > 46.31.27.36.19162: UDP, length 81
12:44:54.176062 IP 216.219.95.164.47291 > 46.31.27.36.19162: UDP, length 81
12:44:54.345910 IP 46.31.27.36.19162 > 216.219.95.164.47291: UDP, length 65
12:44:54.346208 IP 46.31.27.36.19162 > 216.219.95.164.47291: UDP, length 1329
12:44:54.347070 IP 46.31.27.36.19162 > 216.219.95.164.47291: UDP, length 593
12:44:54.347071 IP 46.31.27.36.19162 > 216.219.95.164.47291: UDP, length 65
12:44:54.347083 IP 46.31.27.36.19162 > 216.219.95.164.47291: UDP, length 1329
12:44:54.347170 IP 46.31.27.36.19162 > 216.219.95.164.47291: UDP, length 593
12:44:54.353877 IP 216.219.95.164.47291 > 46.31.27.36.19162: UDP, length 65
12:44:54.354042 IP 216.219.95.164.47291 > 46.31.27.36.19162: UDP, length 65
12:44:54.354121 IP 216.219.95.164.47291 > 46.31.27.36.19162: UDP, length 65
12:44:54.354451 IP 216.219.95.164.47291 > 46.31.27.36.19162: UDP, length 65
12:44:54.354529 IP 216.219.95.164.47291 > 46.31.27.36.19162: UDP, length 65
12:44:54.356167 IP 216.219.95.164.47291 > 46.31.27.36.19162: UDP, length 65
12:44:54.526161 IP 46.31.27.36.19162 > 216.219.95.164.47291: UDP, length 81
12:44:54.526409 IP 46.31.27.36.19162 > 216.219.95.164.47291: UDP, length 81
12:44:54.530140 IP 216.219.95.164.47291 > 46.31.27.36.19162: UDP, length 81
12:44:54.531566 IP 216.219.95.164.47291 > 46.31.27.36.19162: UDP, length 81
12:44:54.701554 IP 46.31.27.36.19162 > 216.219.95.164.47291: UDP, length 65
12:44:54.701807 IP 46.31.27.36.19162 > 216.219.95.164.47291: UDP, length 1329
12:44:54.702041 IP 46.31.27.36.19162 > 216.219.95.164.47291: UDP, length 593
12:44:54.702294 IP 46.31.27.36.19162 > 216.219.95.164.47291: UDP, length 65
12:44:54.702977 IP 46.31.27.36.19162 > 216.219.95.164.47291: UDP, length 1329
12:44:54.703237 IP 46.31.27.36.19162 > 216.219.95.164.47291: UDP, length 561
12:44:54.709714 IP 216.219.95.164.47291 > 46.31.27.36.19162: UDP, length 65
12:44:54.710164 IP 216.219.95.164.47291 > 46.31.27.36.19162: UDP, length 65
12:44:54.710438 IP 216.219.95.164.47291 > 46.31.27.36.19162: UDP, length 65
12:44:54.710909 IP 216.219.95.164.47291 > 46.31.27.36.19162: UDP, length 65
12:44:54.713356 IP 216.219.95.164.47291 > 46.31.27.36.19162: UDP, length 65
12:44:54.714659 IP 216.219.95.164.47291 > 46.31.27.36.19162: UDP, length 65
12:44:54.748045 IP 46.31.27.36.19162 > 216.219.95.164.47291: UDP, length 33
12:44:54.828900 IP 46.31.27.36.19162 > 216.219.95.164.47291: UDP, length 81
12:44:54.831720 IP 216.219.95.164.47291 > 46.31.27.36.19162: UDP, length 81
12:44:54.885988 IP 46.31.27.36.19162 > 216.219.95.164.47291: UDP, length 81
12:44:55.002635 IP 46.31.27.36.19162 > 216.219.95.164.47291: UDP, length 65
12:44:55.002932 IP 46.31.27.36.19162 > 216.219.95.164.47291: UDP, length 1329
12:44:55.002973 IP 46.31.27.36.19162 > 216.219.95.164.47291: UDP, length 545
12:44:55.006002 IP 216.219.95.164.47291 > 46.31.27.36.19162: UDP, length 65
12:44:55.006062 IP 216.219.95.164.47291 > 46.31.27.36.19162: UDP, length 65
12:44:55.007286 IP 216.219.95.164.47291 > 46.31.27.36.19162: UDP, length 65
12:44:55.082283 IP 216.219.95.164.47291 > 46.31.27.36.19162: UDP, length 81
12:44:55.177582 IP 46.31.27.36.19162 > 216.219.95.164.47291: UDP, length 81
12:44:55.180903 IP 216.219.95.164.47291 > 46.31.27.36.19162: UDP, length 81
12:44:55.356006 IP 46.31.27.36.19162 > 216.219.95.164.47291: UDP, length 65
12:44:55.356007 IP 46.31.27.36.19162 > 216.219.95.164.47291: UDP, length 81
12:44:55.356266 IP 46.31.27.36.19162 > 216.219.95.164.47291: UDP, length 1329
12:44:55.356981 IP 46.31.27.36.19162 > 216.219.95.164.47291: UDP, length 609
12:44:55.359148 IP 216.219.95.164.47291 > 46.31.27.36.19162: UDP, length 65
12:44:55.359207 IP 216.219.95.164.47291 > 46.31.27.36.19162: UDP, length 65
12:44:55.360541 IP 216.219.95.164.47291 > 46.31.27.36.19162: UDP, length 65
12:44:55.361745 IP 216.219.95.164.47291 > 46.31.27.36.19162: UDP, length 65
12:44:57.709881 IP 46.31.27.36.19162 > 216.219.95.164.47291: UDP, length 81
12:44:57.714928 IP 216.219.95.164.47291 > 46.31.27.36.19162: UDP, length 81
12:44:57.862108 IP 46.31.27.36.19162 > 216.219.95.164.47291: UDP, length 65
12:44:57.886145 IP 46.31.27.36.19162 > 216.219.95.164.47291: UDP, length 65
12:44:57.886688 IP 46.31.27.36.19162 > 216.219.95.164.47291: UDP, length 1329
12:44:57.886815 IP 46.31.27.36.19162 > 216.219.95.164.47291: UDP, length 641
12:44:57.891047 IP 216.219.95.164.47291 > 46.31.27.36.19162: UDP, length 65
12:44:57.891407 IP 216.219.95.164.47291 > 46.31.27.36.19162: UDP, length 65
12:44:57.891701 IP 216.219.95.164.47291 > 46.31.27.36.19162: UDP, length 65
12:44:58.063871 IP 46.31.27.36.19162 > 216.219.95.164.47291: UDP, length 81
12:44:58.068129 IP 216.219.95.164.47291 > 46.31.27.36.19162: UDP, length 81
12:44:58.239493 IP 46.31.27.36.19162 > 216.219.95.164.47291: UDP, length 65
12:44:58.240061 IP 46.31.27.36.19162 > 216.219.95.164.47291: UDP, length 1329
12:44:58.240262 IP 46.31.27.36.19162 > 216.219.95.164.47291: UDP, length 609
12:44:58.243222 IP 216.219.95.164.47291 > 46.31.27.36.19162: UDP, length 65
12:44:58.243401 IP 216.219.95.164.47291 > 46.31.27.36.19162: UDP, length 65
12:44:58.243535 IP 216.219.95.164.47291 > 46.31.27.36.19162: UDP, length 65
12:44:58.790384 IP 46.31.27.36.19162 > 216.219.95.164.47291: UDP, length 65
12:44:58.956815 IP 46.31.27.36.19162 > 216.219.95.164.47291: UDP, length 81
12:44:58.958552 IP 46.31.27.36.19162 > 216.219.95.164.47291: UDP, length 81
12:44:58.960090 IP 216.219.95.164.47291 > 46.31.27.36.19162: UDP, length 81
12:44:58.962404 IP 216.219.95.164.47291 > 46.31.27.36.19162: UDP, length 81
12:44:59.132171 IP 46.31.27.36.19162 > 216.219.95.164.47291: UDP, length 65
12:44:59.132356 IP 46.31.27.36.19162 > 216.219.95.164.47291: UDP, length 1329
12:44:59.132357 IP 46.31.27.36.19162 > 216.219.95.164.47291: UDP, length 625
12:44:59.132851 IP 46.31.27.36.19162 > 216.219.95.164.47291: UDP, length 65
12:44:59.133492 IP 46.31.27.36.19162 > 216.219.95.164.47291: UDP, length 1329
12:44:59.133493 IP 46.31.27.36.19162 > 216.219.95.164.47291: UDP, length 561
12:44:59.143456 IP 216.219.95.164.47291 > 46.31.27.36.19162: UDP, length 65
12:44:59.143536 IP 216.219.95.164.47291 > 46.31.27.36.19162: UDP, length 65
12:44:59.143571 IP 216.219.95.164.47291 > 46.31.27.36.19162: UDP, length 65
12:44:59.143599 IP 216.219.95.164.47291 > 46.31.27.36.19162: UDP, length 65
12:44:59.143630 IP 216.219.95.164.47291 > 46.31.27.36.19162: UDP, length 65
12:44:59.143689 IP 216.219.95.164.47291 > 46.31.27.36.19162: UDP, length 65
12:44:59.315802 IP 46.31.27.36.19162 > 216.219.95.164.47291: UDP, length 81
12:44:59.315917 IP 46.31.27.36.19162 > 216.219.95.164.47291: UDP, length 81
12:44:59.320264 IP 216.219.95.164.47291 > 46.31.27.36.19162: UDP, length 81
12:44:59.320309 IP 216.219.95.164.47291 > 46.31.27.36.19162: UDP, length 81
12:44:59.491915 IP 46.31.27.36.19162 > 216.219.95.164.47291: UDP, length 65
12:44:59.491916 IP 46.31.27.36.19162 > 216.219.95.164.47291: UDP, length 65
12:44:59.492365 IP 46.31.27.36.19162 > 216.219.95.164.47291: UDP, length 1329
12:44:59.492386 IP 46.31.27.36.19162 > 216.219.95.164.47291: UDP, length 593
12:44:59.492925 IP 46.31.27.36.19162 > 216.219.95.164.47291: UDP, length 1329
12:44:59.493085 IP 46.31.27.36.19162 > 216.219.95.164.47291: UDP, length 561
12:44:59.496301 IP 216.219.95.164.47291 > 46.31.27.36.19162: UDP, length 65
12:44:59.496646 IP 216.219.95.164.47291 > 46.31.27.36.19162: UDP, length 65
12:44:59.499593 IP 216.219.95.164.47291 > 46.31.27.36.19162: UDP, length 65
12:44:59.499635 IP 216.219.95.164.47291 > 46.31.27.36.19162: UDP, length 65
12:44:59.499675 IP 216.219.95.164.47291 > 46.31.27.36.19162: UDP, length 65
12:44:59.501141 IP 216.219.95.164.47291 > 46.31.27.36.19162: UDP, length 65
12:44:59.694230 IP 46.31.27.36.19162 > 216.219.95.164.47291: UDP, length 81
12:44:59.890812 IP 216.219.95.164.47291 > 46.31.27.36.19162: UDP, length 81
12:44:59.967906 IP 46.31.27.36.19162 > 216.219.95.164.47291: UDP, length 81
12:45:00.042663 IP 216.219.95.164.47291 > 46.31.27.36.19162: UDP, length 81
12:45:00.214844 IP 46.31.27.36.19162 > 216.219.95.164.47291: UDP, length 65
12:45:00.219381 IP 46.31.27.36.19162 > 216.219.95.164.47291: UDP, length 529
12:45:00.796295 IP 46.31.27.36.19162 > 216.219.95.164.47291: UDP, length 529
12:45:01.156248 IP 46.31.27.36.19162 > 216.219.95.164.47291: UDP, length 81
12:45:01.162271 IP 216.219.95.164.47291 > 46.31.27.36.19162: UDP, length 97
12:45:01.604764 IP 46.31.27.36.19162 > 216.219.95.164.47291: UDP, length 529
12:45:01.792264 IP 46.31.27.36.19162 > 216.219.95.164.47291: UDP, length 81
12:45:01.794013 IP 46.31.27.36.19162 > 216.219.95.164.47291: UDP, length 81
12:45:01.796711 IP 216.219.95.164.47291 > 46.31.27.36.19162: UDP, length 81
12:45:01.796776 IP 216.219.95.164.47291 > 46.31.27.36.19162: UDP, length 81
12:45:01.848433 IP 46.31.27.36.19162 > 216.219.95.164.47291: UDP, length 97
12:45:01.849248 IP 46.31.27.36.19162 > 216.219.95.164.47291: UDP, length 97
12:45:01.853052 IP 216.219.95.164.47291 > 46.31.27.36.19162: UDP, length 241
12:45:01.855393 IP 216.219.95.164.47291 > 46.31.27.36.19162: UDP, length 241
12:45:01.967737 IP 46.31.27.36.19162 > 216.219.95.164.47291: UDP, length 65
12:45:01.967838 IP 46.31.27.36.19162 > 216.219.95.164.47291: UDP, length 65
12:45:01.968447 IP 46.31.27.36.19162 > 216.219.95.164.47291: UDP, length 1329
12:45:01.968571 IP 46.31.27.36.19162 > 216.219.95.164.47291: UDP, length 529
12:45:01.968743 IP 46.31.27.36.19162 > 216.219.95.164.47291: UDP, length 1329
12:45:01.969550 IP 46.31.27.36.19162 > 216.219.95.164.47291: UDP, length 593
12:45:01.978701 IP 216.219.95.164.47291 > 46.31.27.36.19162: UDP, length 65
12:45:01.978877 IP 216.219.95.164.47291 > 46.31.27.36.19162: UDP, length 65
12:45:01.980078 IP 216.219.95.164.47291 > 46.31.27.36.19162: UDP, length 65
12:45:01.981318 IP 216.219.95.164.47291 > 46.31.27.36.19162: UDP, length 65
12:45:01.981360 IP 216.219.95.164.47291 > 46.31.27.36.19162: UDP, length 65
12:45:01.982649 IP 216.219.95.164.47291 > 46.31.27.36.19162: UDP, length 65
12:45:02.025621 IP 46.31.27.36.19162 > 216.219.95.164.47291: UDP, length 81
12:45:02.027338 IP 46.31.27.36.19162 > 216.219.95.164.47291: UDP, length 81
12:45:02.030348 IP 216.219.95.164.47291 > 46.31.27.36.19162: UDP, length 81
12:45:02.031670 IP 216.219.95.164.47291 > 46.31.27.36.19162: UDP, length 81
12:45:02.152522 IP 46.31.27.36.19162 > 216.219.95.164.47291: UDP, length 81
12:45:02.152678 IP 46.31.27.36.19162 > 216.219.95.164.47291: UDP, length 81
12:45:02.156518 IP 216.219.95.164.47291 > 46.31.27.36.19162: UDP, length 81
12:45:02.156702 IP 216.219.95.164.47291 > 46.31.27.36.19162: UDP, length 81
12:45:02.201945 IP 46.31.27.36.19162 > 216.219.95.164.47291: UDP, length 65
12:45:02.202313 IP 46.31.27.36.19162 > 216.219.95.164.47291: UDP, length 225
12:45:02.203260 IP 46.31.27.36.19162 > 216.219.95.164.47291: UDP, length 65
12:45:02.204298 IP 46.31.27.36.19162 > 216.219.95.164.47291: UDP, length 225
12:45:02.206850 IP 216.219.95.164.47291 > 46.31.27.36.19162: UDP, length 65
12:45:02.206972 IP 216.219.95.164.47291 > 46.31.27.36.19162: UDP, length 65
12:45:02.207077 IP 216.219.95.164.47291 > 46.31.27.36.19162: UDP, length 65
12:45:02.208367 IP 216.219.95.164.47291 > 46.31.27.36.19162: UDP, length 65
12:45:02.329101 IP 46.31.27.36.19162 > 216.219.95.164.47291: UDP, length 65
12:45:02.329794 IP 46.31.27.36.19162 > 216.219.95.164.47291: UDP, length 65
12:45:02.330104 IP 46.31.27.36.19162 > 216.219.95.164.47291: UDP, length 1329
12:45:02.330105 IP 46.31.27.36.19162 > 216.219.95.164.47291: UDP, length 529
12:45:02.330105 IP 46.31.27.36.19162 > 216.219.95.164.47291: UDP, length 1329
12:45:02.330112 IP 46.31.27.36.19162 > 216.219.95.164.47291: UDP, length 529
12:45:02.335978 IP 216.219.95.164.47291 > 46.31.27.36.19162: UDP, length 65
12:45:02.336067 IP 46.31.27.36.19162 > 216.219.95.164.47291: UDP, length 81
12:45:02.337272 IP 216.219.95.164.47291 > 46.31.27.36.19162: UDP, length 65
12:45:02.337367 IP 216.219.95.164.47291 > 46.31.27.36.19162: UDP, length 65
12:45:02.337428 IP 216.219.95.164.47291 > 46.31.27.36.19162: UDP, length 65
12:45:02.337499 IP 216.219.95.164.47291 > 46.31.27.36.19162: UDP, length 65
12:45:02.337558 IP 216.219.95.164.47291 > 46.31.27.36.19162: UDP, length 65
12:45:02.338785 IP 216.219.95.164.47291 > 46.31.27.36.19162: UDP, length 81
12:45:02.510175 IP 46.31.27.36.19162 > 216.219.95.164.47291: UDP, length 65
12:45:02.512000 IP 46.31.27.36.19162 > 216.219.95.164.47291: UDP, length 529
12:45:02.517309 IP 216.219.95.164.47291 > 46.31.27.36.19162: UDP, length 65
12:45:02.523498 IP 46.31.27.36.19162 > 216.219.95.164.47291: UDP, length 81
12:45:02.720302 IP 216.219.95.164.47291 > 46.31.27.36.19162: UDP, length 81
12:45:03.097442 IP 46.31.27.36.19162 > 216.219.95.164.47291: UDP, length 529
12:45:03.191537 IP 46.31.27.36.19162 > 216.219.95.164.47291: UDP, length 81
12:45:03.194399 IP 216.219.95.164.47291 > 46.31.27.36.19162: UDP, length 81
12:45:03.366389 IP 46.31.27.36.19162 > 216.219.95.164.47291: UDP, length 65
12:45:03.367241 IP 46.31.27.36.19162 > 216.219.95.164.47291: UDP, length 1329
12:45:03.367628 IP 46.31.27.36.19162 > 216.219.95.164.47291: UDP, length 609
12:45:03.371110 IP 216.219.95.164.47291 > 46.31.27.36.19162: UDP, length 65
12:45:03.371344 IP 216.219.95.164.47291 > 46.31.27.36.19162: UDP, length 65
12:45:03.371464 IP 216.219.95.164.47291 > 46.31.27.36.19162: UDP, length 65
12:45:03.544294 IP 46.31.27.36.19162 > 216.219.95.164.47291: UDP, length 81
12:45:03.547453 IP 216.219.95.164.47291 > 46.31.27.36.19162: UDP, length 81
12:45:03.718841 IP 46.31.27.36.19162 > 216.219.95.164.47291: UDP, length 65
12:45:03.719637 IP 46.31.27.36.19162 > 216.219.95.164.47291: UDP, length 1329
12:45:03.719638 IP 46.31.27.36.19162 > 216.219.95.164.47291: UDP, length 609
12:45:03.721581 IP 216.219.95.164.47291 > 46.31.27.36.19162: UDP, length 65
12:45:03.722756 IP 216.219.95.164.47291 > 46.31.27.36.19162: UDP, length 65
12:45:03.722801 IP 216.219.95.164.47291 > 46.31.27.36.19162: UDP, length 65
12:45:03.985816 IP 46.31.27.36.19162 > 216.219.95.164.47291: UDP, length 81
12:45:04.062826 IP 216.219.95.164.47291 > 46.31.27.36.19162: UDP, length 81
12:45:04.235788 IP 46.31.27.36.19162 > 216.219.95.164.47291: UDP, length 65
12:45:04.237448 IP 46.31.27.36.19162 > 216.219.95.164.47291: UDP, length 1329
12:45:04.237646 IP 46.31.27.36.19162 > 216.219.95.164.47291: UDP, length 561
12:45:04.310784 IP 216.219.95.164.47291 > 46.31.27.36.19162: UDP, length 65
12:45:04.310893 IP 216.219.95.164.47291 > 46.31.27.36.19162: UDP, length 65
12:45:04.310960 IP 216.219.95.164.47291 > 46.31.27.36.19162: UDP, length 65
12:45:04.483979 IP 46.31.27.36.19162 > 216.219.95.164.47291: UDP, length 81
12:45:04.559640 IP 216.219.95.164.47291 > 46.31.27.36.19162: UDP, length 81
12:45:04.732173 IP 46.31.27.36.19162 > 216.219.95.164.47291: UDP, length 65
12:45:04.732875 IP 46.31.27.36.19162 > 216.219.95.164.47291: UDP, length 1329
12:45:04.733212 IP 46.31.27.36.19162 > 216.219.95.164.47291: UDP, length 625
12:45:04.759338 IP 46.31.27.36.19162 > 216.219.95.164.47291: UDP, length 33
12:45:04.805393 IP 216.219.95.164.47291 > 46.31.27.36.19162: UDP, length 65
12:45:04.806663 IP 216.219.95.164.47291 > 46.31.27.36.19162: UDP, length 65
12:45:04.809150 IP 216.219.95.164.47291 > 46.31.27.36.19162: UDP, length 65
12:45:05.011101 IP 46.31.27.36.19162 > 216.219.95.164.47291: UDP, length 65
12:45:05.153475 IP 46.31.27.36.19162 > 216.219.95.164.47291: UDP, length 97
12:45:05.159072 IP 216.219.95.164.47291 > 46.31.27.36.19162: UDP, length 113
12:45:05.322753 IP 46.31.27.36.19162 > 216.219.95.164.47291: UDP, length 241
12:45:05.331917 IP 46.31.27.36.19162 > 216.219.95.164.47291: UDP, length 81
12:45:05.336428 IP 216.219.95.164.47291 > 46.31.27.36.19162: UDP, length 81
12:45:05.508983 IP 46.31.27.36.19162 > 216.219.95.164.47291: UDP, length 65
12:45:05.511241 IP 46.31.27.36.19162 > 216.219.95.164.47291: UDP, length 1329
12:45:05.511244 IP 46.31.27.36.19162 > 216.219.95.164.47291: UDP, length 865
12:45:05.515165 IP 216.219.95.164.47291 > 46.31.27.36.19162: UDP, length 65
12:45:05.515592 IP 216.219.95.164.47291 > 46.31.27.36.19162: UDP, length 65
12:45:05.517381 IP 216.219.95.164.47291 > 46.31.27.36.19162: UDP, length 65
12:45:05.687383 IP 46.31.27.36.19162 > 216.219.95.164.47291: UDP, length 81
12:45:05.691557 IP 216.219.95.164.47291 > 46.31.27.36.19162: UDP, length 81
12:45:05.862857 IP 46.31.27.36.19162 > 216.219.95.164.47291: UDP, length 65
12:45:05.864517 IP 46.31.27.36.19162 > 216.219.95.164.47291: UDP, length 1329
12:45:05.864518 IP 46.31.27.36.19162 > 216.219.95.164.47291: UDP, length 929
12:45:05.868047 IP 216.219.95.164.47291 > 46.31.27.36.19162: UDP, length 65
12:45:05.868121 IP 216.219.95.164.47291 > 46.31.27.36.19162: UDP, length 65
12:45:05.869416 IP 216.219.95.164.47291 > 46.31.27.36.19162: UDP, length 65
12:45:06.058418 IP 46.31.27.36.19162 > 216.219.95.164.47291: UDP, length 529
12:45:06.500912 IP 46.31.27.36.19162 > 216.219.95.164.47291: UDP, length 81
12:45:06.500914 IP 46.31.27.36.19162 > 216.219.95.164.47291: UDP, length 97
12:45:06.507084 IP 216.219.95.164.47291 > 46.31.27.36.19162: UDP, length 465
12:45:06.577166 IP 216.219.95.164.47291 > 46.31.27.36.19162: UDP, length 81
12:45:06.749688 IP 46.31.27.36.19162 > 216.219.95.164.47291: UDP, length 65
12:45:06.749983 IP 46.31.27.36.19162 > 216.219.95.164.47291: UDP, length 241
12:45:06.825606 IP 216.219.95.164.47291 > 46.31.27.36.19162: UDP, length 65
12:45:06.825965 IP 216.219.95.164.47291 > 46.31.27.36.19162: UDP, length 65
12:45:06.915396 IP 46.31.27.36.19162 > 216.219.95.164.47291: UDP, length 81
12:45:06.919402 IP 216.219.95.164.47291 > 46.31.27.36.19162: UDP, length 97
12:45:07.093231 IP 46.31.27.36.19162 > 216.219.95.164.47291: UDP, length 81
12:45:07.096590 IP 216.219.95.164.47291 > 46.31.27.36.19162: UDP, length 209
12:45:07.096635 IP 216.219.95.164.47291 > 46.31.27.36.19162: UDP, length 209
12:45:07.269053 IP 46.31.27.36.19162 > 216.219.95.164.47291: UDP, length 81
12:45:07.272806 IP 216.219.95.164.47291 > 46.31.27.36.19162: UDP, length 81
12:45:07.357783 IP 46.31.27.36.19162 > 216.219.95.164.47291: UDP, length 81
12:45:07.444145 IP 46.31.27.36.19162 > 216.219.95.164.47291: UDP, length 65
12:45:07.444146 IP 46.31.27.36.19162 > 216.219.95.164.47291: UDP, length 161
12:45:07.447077 IP 216.219.95.164.47291 > 46.31.27.36.19162: UDP, length 65
12:45:07.447184 IP 216.219.95.164.47291 > 46.31.27.36.19162: UDP, length 65
12:45:07.540261 IP 46.31.27.36.19162 > 216.219.95.164.47291: UDP, length 81
12:45:07.543279 IP 46.31.27.36.19162 > 216.219.95.164.47291: UDP, length 81
12:45:07.543336 IP 46.31.27.36.19162 > 216.219.95.164.47291: UDP, length 81
12:45:07.546119 IP 216.219.95.164.47291 > 46.31.27.36.19162: UDP, length 81
12:45:07.547465 IP 216.219.95.164.47291 > 46.31.27.36.19162: UDP, length 81
12:45:07.553913 IP 216.219.95.164.47291 > 46.31.27.36.19162: UDP, length 81
12:45:07.596478 IP 216.219.95.164.47291 > 46.31.27.36.19162: UDP, length 81
12:45:07.718024 IP 46.31.27.36.19162 > 216.219.95.164.47291: UDP, length 65
12:45:07.719265 IP 46.31.27.36.19162 > 216.219.95.164.47291: UDP, length 1329
12:45:07.719267 IP 46.31.27.36.19162 > 216.219.95.164.47291: UDP, length 593
12:45:07.720646 IP 46.31.27.36.19162 > 216.219.95.164.47291: UDP, length 65
12:45:07.721453 IP 46.31.27.36.19162 > 216.219.95.164.47291: UDP, length 1329
12:45:07.721648 IP 46.31.27.36.19162 > 216.219.95.164.47291: UDP, length 561
12:45:07.726429 IP 216.219.95.164.47291 > 46.31.27.36.19162: UDP, length 65
12:45:07.726486 IP 216.219.95.164.47291 > 46.31.27.36.19162: UDP, length 65
12:45:07.726977 IP 216.219.95.164.47291 > 46.31.27.36.19162: UDP, length 65
12:45:07.727381 IP 216.219.95.164.47291 > 46.31.27.36.19162: UDP, length 65
12:45:07.729534 IP 216.219.95.164.47291 > 46.31.27.36.19162: UDP, length 65
12:45:07.730937 IP 216.219.95.164.47291 > 46.31.27.36.19162: UDP, length 65
12:45:07.767945 IP 46.31.27.36.19162 > 216.219.95.164.47291: UDP, length 65
12:45:07.768068 IP 46.31.27.36.19162 > 216.219.95.164.47291: UDP, length 1329
12:45:07.768232 IP 46.31.27.36.19162 > 216.219.95.164.47291: UDP, length 545
12:45:07.823497 IP 216.219.95.164.47291 > 46.31.27.36.19162: UDP, length 65
12:45:07.823586 IP 216.219.95.164.47291 > 46.31.27.36.19162: UDP, length 65
12:45:07.826436 IP 216.219.95.164.47291 > 46.31.27.36.19162: UDP, length 65
12:45:07.898567 IP 46.31.27.36.19162 > 216.219.95.164.47291: UDP, length 81
12:45:07.898742 IP 46.31.27.36.19162 > 216.219.95.164.47291: UDP, length 81
12:45:07.903268 IP 216.219.95.164.47291 > 46.31.27.36.19162: UDP, length 81
12:45:07.903584 IP 216.219.95.164.47291 > 46.31.27.36.19162: UDP, length 81
12:45:08.005742 IP 46.31.27.36.19162 > 216.219.95.164.47291: UDP, length 81
12:45:08.061450 IP 216.219.95.164.47291 > 46.31.27.36.19162: UDP, length 81
12:45:08.074602 IP 46.31.27.36.19162 > 216.219.95.164.47291: UDP, length 65
12:45:08.074791 IP 46.31.27.36.19162 > 216.219.95.164.47291: UDP, length 65
12:45:08.075764 IP 46.31.27.36.19162 > 216.219.95.164.47291: UDP, length 1329
12:45:08.075867 IP 46.31.27.36.19162 > 216.219.95.164.47291: UDP, length 625
12:45:08.076259 IP 46.31.27.36.19162 > 216.219.95.164.47291: UDP, length 1329
12:45:08.076477 IP 46.31.27.36.19162 > 216.219.95.164.47291: UDP, length 593
12:45:08.082863 IP 216.219.95.164.47291 > 46.31.27.36.19162: UDP, length 65
12:45:08.083219 IP 216.219.95.164.47291 > 46.31.27.36.19162: UDP, length 65
12:45:08.083394 IP 216.219.95.164.47291 > 46.31.27.36.19162: UDP, length 65
12:45:08.083868 IP 216.219.95.164.47291 > 46.31.27.36.19162: UDP, length 65
12:45:08.086593 IP 216.219.95.164.47291 > 46.31.27.36.19162: UDP, length 65
12:45:08.089090 IP 216.219.95.164.47291 > 46.31.27.36.19162: UDP, length 65
12:45:08.163466 IP 46.31.27.36.19162 > 216.219.95.164.47291: UDP, length 97
12:45:08.168623 IP 216.219.95.164.47291 > 46.31.27.36.19162: UDP, length 129
12:45:08.233536 IP 46.31.27.36.19162 > 216.219.95.164.47291: UDP, length 65
12:45:08.234133 IP 46.31.27.36.19162 > 216.219.95.164.47291: UDP, length 1329
12:45:08.234134 IP 46.31.27.36.19162 > 216.219.95.164.47291: UDP, length 577
12:45:08.263866 IP 46.31.27.36.19162 > 216.219.95.164.47291: UDP, length 81
12:45:08.290353 IP 216.219.95.164.47291 > 46.31.27.36.19162: UDP, length 65
12:45:08.291386 IP 216.219.95.164.47291 > 46.31.27.36.19162: UDP, length 65
12:45:08.292800 IP 216.219.95.164.47291 > 46.31.27.36.19162: UDP, length 65
12:45:08.341813 IP 46.31.27.36.19162 > 216.219.95.164.47291: UDP, length 81
12:45:08.345082 IP 216.219.95.164.47291 > 46.31.27.36.19162: UDP, length 81
12:45:08.460352 IP 216.219.95.164.47291 > 46.31.27.36.19162: UDP, length 81
12:45:08.516805 IP 46.31.27.36.19162 > 216.219.95.164.47291: UDP, length 65
12:45:08.518258 IP 46.31.27.36.19162 > 216.219.95.164.47291: UDP, length 1329
12:45:08.518259 IP 46.31.27.36.19162 > 216.219.95.164.47291: UDP, length 1057
12:45:08.521783 IP 216.219.95.164.47291 > 46.31.27.36.19162: UDP, length 65
12:45:08.521852 IP 216.219.95.164.47291 > 46.31.27.36.19162: UDP, length 65
12:45:08.523256 IP 216.219.95.164.47291 > 46.31.27.36.19162: UDP, length 65

1092 packets captured
1092 packets received by filter
0 packets dropped by kernel
