dropped privs to tcpdump
tcpdump: verbose output suppressed, use -v[v]... for full protocol decode
listening on eth0, link-type EN10MB (Ethernet), snapshot length 262144 bytes
17:57:00.010202 IP 46.31.27.36.58950 > 216.219.95.164.47291: UDP, length 97
17:57:00.010204 IP 46.31.27.36.58950 > 216.219.95.164.47291: UDP, length 81
17:57:00.010377 IP 46.31.27.36.58950 > 216.219.95.164.47291: UDP, length 129
17:57:00.010378 IP 46.31.27.36.58950 > 216.219.95.164.47291: UDP, length 129
17:57:00.010379 IP 46.31.27.36.58950 > 216.219.95.164.47291: UDP, length 129
17:57:00.010379 IP 46.31.27.36.58950 > 216.219.95.164.47291: UDP, length 113
17:57:00.010774 IP 46.31.27.36.58950 > 216.219.95.164.47291: UDP, length 97
17:57:00.010775 IP 46.31.27.36.58950 > 216.219.95.164.47291: UDP, length 129
17:57:00.010775 IP 46.31.27.36.58950 > 216.219.95.164.47291: UDP, length 129
17:57:00.010776 IP 46.31.27.36.58950 > 216.219.95.164.47291: UDP, length 129
17:57:00.010776 IP 46.31.27.36.58950 > 216.219.95.164.47291: UDP, length 81
17:57:00.010777 IP 46.31.27.36.58950 > 216.219.95.164.47291: UDP, length 113
17:57:00.010777 IP 46.31.27.36.58950 > 216.219.95.164.47291: UDP, length 129
17:57:00.010778 IP 46.31.27.36.58950 > 216.219.95.164.47291: UDP, length 129
17:57:00.010842 IP 46.31.27.36.58950 > 216.219.95.164.47291: UDP, length 129
17:57:00.010842 IP 46.31.27.36.58950 > 216.219.95.164.47291: UDP, length 97
17:57:00.010849 IP 46.31.27.36.58950 > 216.219.95.164.47291: UDP, length 81
17:57:00.010849 IP 46.31.27.36.58950 > 216.219.95.164.47291: UDP, length 81
17:57:00.010850 IP 46.31.27.36.58950 > 216.219.95.164.47291: UDP, length 113
17:57:00.010851 IP 46.31.27.36.58950 > 216.219.95.164.47291: UDP, length 113
17:57:00.010851 IP 46.31.27.36.58950 > 216.219.95.164.47291: UDP, length 81
17:57:00.010851 IP 46.31.27.36.58950 > 216.219.95.164.47291: UDP, length 113
17:57:00.010915 IP 46.31.27.36.58950 > 216.219.95.164.47291: UDP, length 129
17:57:00.010916 IP 46.31.27.36.58950 > 216.219.95.164.47291: UDP, length 129
17:57:00.010916 IP 46.31.27.36.58950 > 216.219.95.164.47291: UDP, length 129
17:57:00.010917 IP 46.31.27.36.58950 > 216.219.95.164.47291: UDP, length 97
17:57:00.010917 IP 46.31.27.36.58950 > 216.219.95.164.47291: UDP, length 81
17:57:00.010917 IP 46.31.27.36.58950 > 216.219.95.164.47291: UDP, length 81
17:57:00.010918 IP 46.31.27.36.58950 > 216.219.95.164.47291: UDP, length 113
17:57:00.010918 IP 46.31.27.36.58950 > 216.219.95.164.47291: UDP, length 113
17:57:00.010987 IP 46.31.27.36.58950 > 216.219.95.164.47291: UDP, length 97
17:57:00.010987 IP 46.31.27.36.58950 > 216.219.95.164.47291: UDP, length 97
17:57:00.010988 IP 46.31.27.36.58950 > 216.219.95.164.47291: UDP, length 113
17:57:00.011171 IP 46.31.27.36.58950 > 216.219.95.164.47291: UDP, length 81
17:57:00.011172 IP 46.31.27.36.58950 > 216.219.95.164.47291: UDP, length 81
17:57:00.011173 IP 46.31.27.36.58950 > 216.219.95.164.47291: UDP, length 97
17:57:00.011392 IP 46.31.27.36.58950 > 216.219.95.164.47291: UDP, length 97
17:57:00.011393 IP 46.31.27.36.58950 > 216.219.95.164.47291: UDP, length 113
17:57:00.011394 IP 46.31.27.36.58950 > 216.219.95.164.47291: UDP, length 113
17:57:00.011395 IP 46.31.27.36.58950 > 216.219.95.164.47291: UDP, length 81
17:57:00.011497 IP 46.31.27.36.58950 > 216.219.95.164.47291: UDP, length 97
17:57:00.011498 IP 46.31.27.36.58950 > 216.219.95.164.47291: UDP, length 113
17:57:00.011498 IP 46.31.27.36.58950 > 216.219.95.164.47291: UDP, length 97
17:57:00.011499 IP 46.31.27.36.58950 > 216.219.95.164.47291: UDP, length 97
17:57:00.011499 IP 46.31.27.36.58950 > 216.219.95.164.47291: UDP, length 113
17:57:00.011606 IP 46.31.27.36.58950 > 216.219.95.164.47291: UDP, length 97
17:57:00.011607 IP 46.31.27.36.58950 > 216.219.95.164.47291: UDP, length 97
17:57:00.011864 IP 46.31.27.36.58950 > 216.219.95.164.47291: UDP, length 97
17:57:00.011865 IP 46.31.27.36.58950 > 216.219.95.164.47291: UDP, length 97
17:57:00.011865 IP 46.31.27.36.58950 > 216.219.95.164.47291: UDP, length 113
17:57:00.011870 IP 46.31.27.36.58950 > 216.219.95.164.47291: UDP, length 81
17:57:00.011870 IP 46.31.27.36.58950 > 216.219.95.164.47291: UDP, length 81
17:57:00.011871 IP 46.31.27.36.58950 > 216.219.95.164.47291: UDP, length 97
17:57:00.012009 IP 46.31.27.36.58950 > 216.219.95.164.47291: UDP, length 97
17:57:00.012010 IP 46.31.27.36.58950 > 216.219.95.164.47291: UDP, length 113
17:57:00.012011 IP 46.31.27.36.58950 > 216.219.95.164.47291: UDP, length 113
17:57:00.012087 IP 46.31.27.36.58950 > 216.219.95.164.47291: UDP, length 97
17:57:00.012088 IP 46.31.27.36.58950 > 216.219.95.164.47291: UDP, length 81
17:57:00.012207 IP 46.31.27.36.58950 > 216.219.95.164.47291: UDP, length 97
17:57:00.012208 IP 46.31.27.36.58950 > 216.219.95.164.47291: UDP, length 113
17:57:00.012209 IP 46.31.27.36.58950 > 216.219.95.164.47291: UDP, length 81
17:57:00.012361 IP 46.31.27.36.58950 > 216.219.95.164.47291: UDP, length 97
17:57:00.012361 IP 46.31.27.36.58950 > 216.219.95.164.47291: UDP, length 97
17:57:00.012362 IP 46.31.27.36.58950 > 216.219.95.164.47291: UDP, length 81
17:57:00.012363 IP 46.31.27.36.58950 > 216.219.95.164.47291: UDP, length 113
17:57:00.066502 IP 216.219.95.164.47291 > 46.31.27.36.58950: UDP, length 305
17:57:00.078749 IP 216.219.95.164.47291 > 46.31.27.36.58950: UDP, length 97
17:57:00.085821 IP 216.219.95.164.47291 > 46.31.27.36.58950: UDP, length 209
17:57:00.090469 IP 216.219.95.164.47291 > 46.31.27.36.58950: UDP, length 177
17:57:00.098425 IP 216.219.95.164.47291 > 46.31.27.36.58950: UDP, length 97
17:57:00.101881 IP 216.219.95.164.47291 > 46.31.27.36.58950: UDP, length 209
17:57:00.109969 IP 216.219.95.164.47291 > 46.31.27.36.58950: UDP, length 177
17:57:00.113536 IP 216.219.95.164.47291 > 46.31.27.36.58950: UDP, length 129
17:57:00.117162 IP 216.219.95.164.47291 > 46.31.27.36.58950: UDP, length 129
17:57:00.121806 IP 216.219.95.164.47291 > 46.31.27.36.58950: UDP, length 385
17:57:00.125391 IP 216.219.95.164.47291 > 46.31.27.36.58950: UDP, length 401
17:57:00.129002 IP 216.219.95.164.47291 > 46.31.27.36.58950: UDP, length 97
17:57:00.133707 IP 216.219.95.164.47291 > 46.31.27.36.58950: UDP, length 209
17:57:00.140733 IP 216.219.95.164.47291 > 46.31.27.36.58950: UDP, length 177
17:57:00.146225 IP 216.219.95.164.47291 > 46.31.27.36.58950: UDP, length 129
17:57:00.151010 IP 216.219.95.164.47291 > 46.31.27.36.58950: UDP, length 129
17:57:00.185462 IP 216.219.95.164.47291 > 46.31.27.36.58950: UDP, length 385
17:57:00.189098 IP 216.219.95.164.47291 > 46.31.27.36.58950: UDP, length 401
17:57:00.194853 IP 216.219.95.164.47291 > 46.31.27.36.58950: UDP, length 161
17:57:00.199613 IP 216.219.95.164.47291 > 46.31.27.36.58950: UDP, length 305
17:57:00.218002 IP 46.31.27.36.58950 > 216.219.95.164.47291: UDP, length 97
17:57:00.235353 IP 216.219.95.164.47291 > 46.31.27.36.58950: UDP, length 417
17:57:00.240134 IP 216.219.95.164.47291 > 46.31.27.36.58950: UDP, length 129
17:57:00.243292 IP 216.219.95.164.47291 > 46.31.27.36.58950: UDP, length 129
17:57:00.248099 IP 216.219.95.164.47291 > 46.31.27.36.58950: UDP, length 273
17:57:00.251714 IP 216.219.95.164.47291 > 46.31.27.36.58950: UDP, length 225
17:57:00.284177 IP 46.31.27.36.58950 > 216.219.95.164.47291: UDP, length 97
17:57:00.285551 IP 216.219.95.164.47291 > 46.31.27.36.58950: UDP, length 401
17:57:00.288762 IP 46.31.27.36.58950 > 216.219.95.164.47291: UDP, length 81
17:57:00.289469 IP 46.31.27.36.58950 > 216.219.95.164.47291: UDP, length 81
17:57:00.289470 IP 46.31.27.36.58950 > 216.219.95.164.47291: UDP, length 81
17:57:00.289606 IP 46.31.27.36.58950 > 216.219.95.164.47291: UDP, length 81
17:57:00.318624 IP 216.219.95.164.47291 > 46.31.27.36.58950: UDP, length 385
17:57:00.321436 IP 216.219.95.164.47291 > 46.31.27.36.58950: UDP, length 97
17:57:00.324942 IP 216.219.95.164.47291 > 46.31.27.36.58950: UDP, length 161
17:57:00.329100 IP 216.219.95.164.47291 > 46.31.27.36.58950: UDP, length 209
17:57:00.331546 IP 216.219.95.164.47291 > 46.31.27.36.58950: UDP, length 161
17:57:00.334158 IP 216.219.95.164.47291 > 46.31.27.36.58950: UDP, length 177
17:57:00.366048 IP 216.219.95.164.47291 > 46.31.27.36.58950: UDP, length 417
17:57:00.367621 IP 46.31.27.36.58950 > 216.219.95.164.47291: UDP, length 81
17:57:00.370798 IP 216.219.95.164.47291 > 46.31.27.36.58950: UDP, length 273
17:57:00.373531 IP 216.219.95.164.47291 > 46.31.27.36.58950: UDP, length 225
17:57:00.376127 IP 216.219.95.164.47291 > 46.31.27.36.58950: UDP, length 161
17:57:00.378750 IP 216.219.95.164.47291 > 46.31.27.36.58950: UDP, length 161
17:57:00.412329 IP 216.219.95.164.47291 > 46.31.27.36.58950: UDP, length 417
17:57:00.415338 IP 216.219.95.164.47291 > 46.31.27.36.58950: UDP, length 129
17:57:00.418685 IP 216.219.95.164.47291 > 46.31.27.36.58950: UDP, length 129
17:57:00.422288 IP 216.219.95.164.47291 > 46.31.27.36.58950: UDP, length 273
17:57:00.424959 IP 46.31.27.36.58950 > 216.219.95.164.47291: UDP, length 81
17:57:00.427170 IP 216.219.95.164.47291 > 46.31.27.36.58950: UDP, length 225
17:57:00.430863 IP 216.219.95.164.47291 > 46.31.27.36.58950: UDP, length 385
17:57:00.434105 IP 216.219.95.164.47291 > 46.31.27.36.58950: UDP, length 401
17:57:00.436782 IP 216.219.95.164.47291 > 46.31.27.36.58950: UDP, length 161
17:57:00.439646 IP 216.219.95.164.47291 > 46.31.27.36.58950: UDP, length 97
17:57:00.442516 IP 216.219.95.164.47291 > 46.31.27.36.58950: UDP, length 161
17:57:00.445513 IP 216.219.95.164.47291 > 46.31.27.36.58950: UDP, length 417
17:57:00.448589 IP 216.219.95.164.47291 > 46.31.27.36.58950: UDP, length 97
17:57:00.451474 IP 216.219.95.164.47291 > 46.31.27.36.58950: UDP, length 225
17:57:00.454005 IP 216.219.95.164.47291 > 46.31.27.36.58950: UDP, length 273
17:57:00.457381 IP 216.219.95.164.47291 > 46.31.27.36.58950: UDP, length 97
17:57:00.460402 IP 216.219.95.164.47291 > 46.31.27.36.58950: UDP, length 209
17:57:00.465500 IP 216.219.95.164.47291 > 46.31.27.36.58950: UDP, length 161
17:57:00.470280 IP 216.219.95.164.47291 > 46.31.27.36.58950: UDP, length 273
17:57:00.504100 IP 46.31.27.36.58950 > 216.219.95.164.47291: UDP, length 81
17:57:00.504169 IP 46.31.27.36.58950 > 216.219.95.164.47291: UDP, length 81
17:57:00.524768 IP 216.219.95.164.47291 > 46.31.27.36.58950: UDP, length 81
17:57:00.530346 IP 216.219.95.164.47291 > 46.31.27.36.58950: UDP, length 81
17:57:00.537209 IP 216.219.95.164.47291 > 46.31.27.36.58950: UDP, length 81
17:57:00.543425 IP 216.219.95.164.47291 > 46.31.27.36.58950: UDP, length 81
17:57:00.554010 IP 216.219.95.164.47291 > 46.31.27.36.58950: UDP, length 81
17:57:00.571526 IP 216.219.95.164.47291 > 46.31.27.36.58950: UDP, length 81
17:57:00.591094 IP 216.219.95.164.47291 > 46.31.27.36.58950: UDP, length 81
17:57:00.631631 IP 46.31.27.36.58950 > 216.219.95.164.47291: UDP, length 81
17:57:00.636939 IP 216.219.95.164.47291 > 46.31.27.36.58950: UDP, length 81
17:57:00.641582 IP 46.31.27.36.58950 > 216.219.95.164.47291: UDP, length 81
17:57:00.683916 IP 216.219.95.164.47291 > 46.31.27.36.58950: UDP, length 81
17:57:00.696070 IP 216.219.95.164.47291 > 46.31.27.36.58950: UDP, length 81
17:57:00.696891 IP 46.31.27.36.58950 > 216.219.95.164.47291: UDP, length 65
17:57:00.699401 IP 46.31.27.36.58950 > 216.219.95.164.47291: UDP, length 289
17:57:00.700985 IP 46.31.27.36.58950 > 216.219.95.164.47291: UDP, length 65
17:57:00.701665 IP 46.31.27.36.58950 > 216.219.95.164.47291: UDP, length 1329
17:57:00.701667 IP 46.31.27.36.58950 > 216.219.95.164.47291: UDP, length 513
17:57:00.705602 IP 216.219.95.164.47291 > 46.31.27.36.58950: UDP, length 65
17:57:00.707337 IP 46.31.27.36.58950 > 216.219.95.164.47291: UDP, length 65
17:57:00.707626 IP 216.219.95.164.47291 > 46.31.27.36.58950: UDP, length 65
17:57:00.708315 IP 46.31.27.36.58950 > 216.219.95.164.47291: UDP, length 241
17:57:00.713689 IP 46.31.27.36.58950 > 216.219.95.164.47291: UDP, length 65
17:57:00.715130 IP 46.31.27.36.58950 > 216.219.95.164.47291: UDP, length 241
17:57:00.735193 IP 216.219.95.164.47291 > 46.31.27.36.58950: UDP, length 65
17:57:00.735306 IP 216.219.95.164.47291 > 46.31.27.36.58950: UDP, length 65
17:57:00.737884 IP 216.219.95.164.47291 > 46.31.27.36.58950: UDP, length 65
17:57:00.766321 IP 46.31.27.36.58950 > 216.219.95.164.47291: UDP, length 65
17:57:00.766669 IP 46.31.27.36.58950 > 216.219.95.164.47291: UDP, length 65
17:57:00.766982 IP 46.31.27.36.58950 > 216.219.95.164.47291: UDP, length 65
17:57:00.767351 IP 46.31.27.36.58950 > 216.219.95.164.47291: UDP, length 417
17:57:00.767821 IP 46.31.27.36.58950 > 216.219.95.164.47291: UDP, length 1329
17:57:00.768116 IP 46.31.27.36.58950 > 216.219.95.164.47291: UDP, length 689
17:57:00.771746 IP 46.31.27.36.58950 > 216.219.95.164.47291: UDP, length 513
17:57:00.806305 IP 216.219.95.164.47291 > 46.31.27.36.58950: UDP, length 65
17:57:00.812584 IP 216.219.95.164.47291 > 46.31.27.36.58950: UDP, length 65
17:57:00.823707 IP 216.219.95.164.47291 > 46.31.27.36.58950: UDP, length 65
17:57:00.827112 IP 216.219.95.164.47291 > 46.31.27.36.58950: UDP, length 65
17:57:00.828795 IP 216.219.95.164.47291 > 46.31.27.36.58950: UDP, length 65
17:57:00.834720 IP 46.31.27.36.58950 > 216.219.95.164.47291: UDP, length 65
17:57:00.835450 IP 46.31.27.36.58950 > 216.219.95.164.47291: UDP, length 1329
17:57:00.835532 IP 46.31.27.36.58950 > 216.219.95.164.47291: UDP, length 593
17:57:00.844301 IP 216.219.95.164.47291 > 46.31.27.36.58950: UDP, length 65
17:57:00.844520 IP 216.219.95.164.47291 > 46.31.27.36.58950: UDP, length 65
17:57:00.846696 IP 216.219.95.164.47291 > 46.31.27.36.58950: UDP, length 65
17:57:00.846914 IP 216.219.95.164.47291 > 46.31.27.36.58950: UDP, length 65
17:57:00.848478 IP 216.219.95.164.47291 > 46.31.27.36.58950: UDP, length 65
17:57:00.856305 IP 46.31.27.36.58950 > 216.219.95.164.47291: UDP, length 65
17:57:00.856504 IP 46.31.27.36.58950 > 216.219.95.164.47291: UDP, length 225
17:57:00.899004 IP 216.219.95.164.47291 > 46.31.27.36.58950: UDP, length 65
17:57:00.900407 IP 216.219.95.164.47291 > 46.31.27.36.58950: UDP, length 65
17:57:00.903316 IP 46.31.27.36.58950 > 216.219.95.164.47291: UDP, length 65
17:57:00.904879 IP 46.31.27.36.58950 > 216.219.95.164.47291: UDP, length 1329
17:57:00.905107 IP 46.31.27.36.58950 > 216.219.95.164.47291: UDP, length 577
17:57:00.907448 IP 46.31.27.36.58950 > 216.219.95.164.47291: UDP, length 81
17:57:00.916614 IP 216.219.95.164.47291 > 46.31.27.36.58950: UDP, length 81
17:57:01.039857 IP 46.31.27.36.58950 > 216.219.95.164.47291: UDP, length 81
17:57:01.041414 IP 46.31.27.36.58950 > 216.219.95.164.47291: UDP, length 81
17:57:01.043488 IP 216.219.95.164.47291 > 46.31.27.36.58950: UDP, length 81
17:57:01.074044 IP 216.219.95.164.47291 > 46.31.27.36.58950: UDP, length 65
17:57:01.075514 IP 216.219.95.164.47291 > 46.31.27.36.58950: UDP, length 65
17:57:01.075595 IP 216.219.95.164.47291 > 46.31.27.36.58950: UDP, length 65
17:57:01.094901 IP 216.219.95.164.47291 > 46.31.27.36.58950: UDP, length 81
17:57:01.108706 IP 46.31.27.36.58950 > 216.219.95.164.47291: UDP, length 65
17:57:01.109756 IP 46.31.27.36.58950 > 216.219.95.164.47291: UDP, length 1329
17:57:01.110011 IP 46.31.27.36.58950 > 216.219.95.164.47291: UDP, length 577
17:57:01.119619 IP 216.219.95.164.47291 > 46.31.27.36.58950: UDP, length 65
17:57:01.119705 IP 216.219.95.164.47291 > 46.31.27.36.58950: UDP, length 65
17:57:01.119841 IP 216.219.95.164.47291 > 46.31.27.36.58950: UDP, length 65
17:57:01.243978 IP 46.31.27.36.58950 > 216.219.95.164.47291: UDP, length 241
17:57:01.244990 IP 46.31.27.36.58950 > 216.219.95.164.47291: UDP, length 241
17:57:01.245524 IP 46.31.27.36.58950 > 216.219.95.164.47291: UDP, length 65
17:57:01.246535 IP 46.31.27.36.58950 > 216.219.95.164.47291: UDP, length 1329
17:57:01.246729 IP 46.31.27.36.58950 > 216.219.95.164.47291: UDP, length 561
17:57:01.246955 IP 46.31.27.36.58950 > 216.219.95.164.47291: UDP, length 81
17:57:01.248754 IP 216.219.95.164.47291 > 46.31.27.36.58950: UDP, length 65
17:57:01.248835 IP 216.219.95.164.47291 > 46.31.27.36.58950: UDP, length 65
17:57:01.250069 IP 216.219.95.164.47291 > 46.31.27.36.58950: UDP, length 65
17:57:01.266198 IP 46.31.27.36.58950 > 216.219.95.164.47291: UDP, length 65
17:57:01.266786 IP 46.31.27.36.58950 > 216.219.95.164.47291: UDP, length 1329
17:57:01.267139 IP 46.31.27.36.58950 > 216.219.95.164.47291: UDP, length 689
17:57:01.312688 IP 46.31.27.36.58950 > 216.219.95.164.47291: UDP, length 81
17:57:01.323461 IP 216.219.95.164.47291 > 46.31.27.36.58950: UDP, length 65
17:57:01.323597 IP 216.219.95.164.47291 > 46.31.27.36.58950: UDP, length 65
17:57:01.323705 IP 216.219.95.164.47291 > 46.31.27.36.58950: UDP, length 65
17:57:01.381401 IP 216.219.95.164.47291 > 46.31.27.36.58950: UDP, length 81
17:57:01.432528 IP 216.219.95.164.47291 > 46.31.27.36.58950: UDP, length 81
17:57:01.449888 IP 46.31.27.36.58950 > 216.219.95.164.47291: UDP, length 193
17:57:01.542731 IP 46.31.27.36.58950 > 216.219.95.164.47291: UDP, length 81
17:57:01.587848 IP 46.31.27.36.58950 > 216.219.95.164.47291: UDP, length 65
17:57:01.588311 IP 46.31.27.36.58950 > 216.219.95.164.47291: UDP, length 289
17:57:01.598161 IP 216.219.95.164.47291 > 46.31.27.36.58950: UDP, length 81
17:57:01.602744 IP 46.31.27.36.58950 > 216.219.95.164.47291: UDP, length 65
17:57:01.603458 IP 46.31.27.36.58950 > 216.219.95.164.47291: UDP, length 1329
17:57:01.603676 IP 46.31.27.36.58950 > 216.219.95.164.47291: UDP, length 577
17:57:01.663979 IP 216.219.95.164.47291 > 46.31.27.36.58950: UDP, length 65
17:57:01.664090 IP 216.219.95.164.47291 > 46.31.27.36.58950: UDP, length 65
17:57:01.785638 IP 216.219.95.164.47291 > 46.31.27.36.58950: UDP, length 65
17:57:01.786067 IP 216.219.95.164.47291 > 46.31.27.36.58950: UDP, length 65
17:57:01.787343 IP 216.219.95.164.47291 > 46.31.27.36.58950: UDP, length 65
17:57:01.795613 IP 46.31.27.36.58950 > 216.219.95.164.47291: UDP, length 65
17:57:01.796781 IP 46.31.27.36.58950 > 216.219.95.164.47291: UDP, length 1329
17:57:01.796781 IP 46.31.27.36.58950 > 216.219.95.164.47291: UDP, length 513
17:57:01.850344 IP 216.219.95.164.47291 > 46.31.27.36.58950: UDP, length 65
17:57:01.851624 IP 216.219.95.164.47291 > 46.31.27.36.58950: UDP, length 65
17:57:01.853974 IP 216.219.95.164.47291 > 46.31.27.36.58950: UDP, length 65
17:57:01.923293 IP 46.31.27.36.58950 > 216.219.95.164.47291: UDP, length 241
17:57:01.947981 IP 46.31.27.36.58950 > 216.219.95.164.47291: UDP, length 241
17:57:02.015867 IP 46.31.27.36.58950 > 216.219.95.164.47291: UDP, length 81
17:57:02.015869 IP 46.31.27.36.58950 > 216.219.95.164.47291: UDP, length 97
17:57:02.019705 IP 216.219.95.164.47291 > 46.31.27.36.58950: UDP, length 129
17:57:02.023317 IP 216.219.95.164.47291 > 46.31.27.36.58950: UDP, length 481
17:57:02.129436 IP 46.31.27.36.58950 > 216.219.95.164.47291: UDP, length 81
17:57:02.184394 IP 216.219.95.164.47291 > 46.31.27.36.58950: UDP, length 81
17:57:02.200358 IP 46.31.27.36.58950 > 216.219.95.164.47291: UDP, length 81
17:57:02.200563 IP 46.31.27.36.58950 > 216.219.95.164.47291: UDP, length 81
17:57:02.221805 IP 216.219.95.164.47291 > 46.31.27.36.58950: UDP, length 81
17:57:02.356407 IP 46.31.27.36.58950 > 216.219.95.164.47291: UDP, length 65
17:57:02.357400 IP 46.31.27.36.58950 > 216.219.95.164.47291: UDP, length 1329
17:57:02.357516 IP 46.31.27.36.58950 > 216.219.95.164.47291: UDP, length 545
17:57:02.360127 IP 216.219.95.164.47291 > 46.31.27.36.58950: UDP, length 81
17:57:02.404446 IP 46.31.27.36.58950 > 216.219.95.164.47291: UDP, length 65
17:57:02.405453 IP 46.31.27.36.58950 > 216.219.95.164.47291: UDP, length 1329
17:57:02.405454 IP 46.31.27.36.58950 > 216.219.95.164.47291: UDP, length 625
17:57:02.411425 IP 216.219.95.164.47291 > 46.31.27.36.58950: UDP, length 65
17:57:02.412634 IP 216.219.95.164.47291 > 46.31.27.36.58950: UDP, length 65
17:57:02.415002 IP 216.219.95.164.47291 > 46.31.27.36.58950: UDP, length 65
17:57:02.426097 IP 216.219.95.164.47291 > 46.31.27.36.58950: UDP, length 65
17:57:02.426158 IP 216.219.95.164.47291 > 46.31.27.36.58950: UDP, length 65
17:57:02.427340 IP 216.219.95.164.47291 > 46.31.27.36.58950: UDP, length 65
17:57:02.471595 IP 46.31.27.36.58950 > 216.219.95.164.47291: UDP, length 81
17:57:02.542142 IP 46.31.27.36.58950 > 216.219.95.164.47291: UDP, length 65
17:57:02.543149 IP 46.31.27.36.58950 > 216.219.95.164.47291: UDP, length 1329
17:57:02.543505 IP 46.31.27.36.58950 > 216.219.95.164.47291: UDP, length 625
17:57:02.609283 IP 46.31.27.36.58950 > 216.219.95.164.47291: UDP, length 81
17:57:02.612564 IP 46.31.27.36.58950 > 216.219.95.164.47291: UDP, length 81
17:57:02.626120 IP 216.219.95.164.47291 > 46.31.27.36.58950: UDP, length 81
17:57:02.632148 IP 216.219.95.164.47291 > 46.31.27.36.58950: UDP, length 81
17:57:02.676719 IP 216.219.95.164.47291 > 46.31.27.36.58950: UDP, length 81
17:57:02.698588 IP 216.219.95.164.47291 > 46.31.27.36.58950: UDP, length 65
17:57:02.700828 IP 216.219.95.164.47291 > 46.31.27.36.58950: UDP, length 65
17:57:02.700868 IP 216.219.95.164.47291 > 46.31.27.36.58950: UDP, length 65
17:57:02.816333 IP 46.31.27.36.58950 > 216.219.95.164.47291: UDP, length 65
17:57:02.816476 IP 46.31.27.36.58950 > 216.219.95.164.47291: UDP, length 65
17:57:02.817375 IP 46.31.27.36.58950 > 216.219.95.164.47291: UDP, length 1329
17:57:02.817429 IP 46.31.27.36.58950 > 216.219.95.164.47291: UDP, length 529
17:57:02.817877 IP 46.31.27.36.58950 > 216.219.95.164.47291: UDP, length 1329
17:57:02.818105 IP 46.31.27.36.58950 > 216.219.95.164.47291: UDP, length 593
17:57:02.840083 IP 216.219.95.164.47291 > 46.31.27.36.58950: UDP, length 65
17:57:02.848586 IP 216.219.95.164.47291 > 46.31.27.36.58950: UDP, length 65
17:57:02.855620 IP 216.219.95.164.47291 > 46.31.27.36.58950: UDP, length 65
17:57:02.887157 IP 46.31.27.36.58950 > 216.219.95.164.47291: UDP, length 65
17:57:02.888014 IP 46.31.27.36.58950 > 216.219.95.164.47291: UDP, length 81
17:57:02.890655 IP 46.31.27.36.58950 > 216.219.95.164.47291: UDP, length 529
17:57:02.953266 IP 216.219.95.164.47291 > 46.31.27.36.58950: UDP, length 65
17:57:02.958041 IP 216.219.95.164.47291 > 46.31.27.36.58950: UDP, length 65
17:57:02.973151 IP 216.219.95.164.47291 > 46.31.27.36.58950: UDP, length 65
17:57:02.979299 IP 216.219.95.164.47291 > 46.31.27.36.58950: UDP, length 65
17:57:02.980545 IP 216.219.95.164.47291 > 46.31.27.36.58950: UDP, length 65
17:57:03.029240 IP 46.31.27.36.58950 > 216.219.95.164.47291: UDP, length 97
17:57:03.034098 IP 216.219.95.164.47291 > 46.31.27.36.58950: UDP, length 257
17:57:03.041716 IP 216.219.95.164.47291 > 46.31.27.36.58950: UDP, length 81
17:57:03.153202 IP 46.31.27.36.58950 > 216.219.95.164.47291: UDP, length 241
17:57:03.155855 IP 46.31.27.36.58950 > 216.219.95.164.47291: UDP, length 81
17:57:03.206444 IP 46.31.27.36.58950 > 216.219.95.164.47291: UDP, length 81
17:57:03.209567 IP 216.219.95.164.47291 > 46.31.27.36.58950: UDP, length 81
17:57:03.213052 IP 46.31.27.36.58950 > 216.219.95.164.47291: UDP, length 65
17:57:03.213862 IP 46.31.27.36.58950 > 216.219.95.164.47291: UDP, length 1329
17:57:03.213862 IP 46.31.27.36.58950 > 216.219.95.164.47291: UDP, length 529
17:57:03.214026 IP 46.31.27.36.58950 > 216.219.95.164.47291: UDP, length 241
17:57:03.322921 IP 216.219.95.164.47291 > 46.31.27.36.58950: UDP, length 81
17:57:03.366773 IP 216.219.95.164.47291 > 46.31.27.36.58950: UDP, length 65
17:57:03.372157 IP 216.219.95.164.47291 > 46.31.27.36.58950: UDP, length 65
17:57:03.372290 IP 216.219.95.164.47291 > 46.31.27.36.58950: UDP, length 65
17:57:03.381227 IP 46.31.27.36.58950 > 216.219.95.164.47291: UDP, length 65
17:57:03.382202 IP 46.31.27.36.58950 > 216.219.95.164.47291: UDP, length 1329
17:57:03.382318 IP 46.31.27.36.58950 > 216.219.95.164.47291: UDP, length 577
17:57:03.388930 IP 216.219.95.164.47291 > 46.31.27.36.58950: UDP, length 65
17:57:03.392501 IP 216.219.95.164.47291 > 46.31.27.36.58950: UDP, length 65
17:57:03.396015 IP 216.219.95.164.47291 > 46.31.27.36.58950: UDP, length 65
17:57:03.494274 IP 46.31.27.36.58950 > 216.219.95.164.47291: UDP, length 65
17:57:03.495143 IP 46.31.27.36.58950 > 216.219.95.164.47291: UDP, length 1329
17:57:03.495411 IP 46.31.27.36.58950 > 216.219.95.164.47291: UDP, length 593
17:57:03.561028 IP 46.31.27.36.58950 > 216.219.95.164.47291: UDP, length 81
17:57:03.564683 IP 216.219.95.164.47291 > 46.31.27.36.58950: UDP, length 81
17:57:03.654820 IP 216.219.95.164.47291 > 46.31.27.36.58950: UDP, length 65
17:57:03.656119 IP 216.219.95.164.47291 > 46.31.27.36.58950: UDP, length 65
17:57:03.656198 IP 216.219.95.164.47291 > 46.31.27.36.58950: UDP, length 65
17:57:03.736212 IP 46.31.27.36.58950 > 216.219.95.164.47291: UDP, length 65
17:57:03.736833 IP 46.31.27.36.58950 > 216.219.95.164.47291: UDP, length 1329
17:57:03.737074 IP 46.31.27.36.58950 > 216.219.95.164.47291: UDP, length 577
17:57:03.743990 IP 216.219.95.164.47291 > 46.31.27.36.58950: UDP, length 65
17:57:03.751104 IP 216.219.95.164.47291 > 46.31.27.36.58950: UDP, length 65
17:57:03.752627 IP 216.219.95.164.47291 > 46.31.27.36.58950: UDP, length 65
17:57:03.872565 IP 46.31.27.36.58950 > 216.219.95.164.47291: UDP, length 81
17:57:03.887047 IP 216.219.95.164.47291 > 46.31.27.36.58950: UDP, length 81
17:57:03.887894 IP 46.31.27.36.58950 > 216.219.95.164.47291: UDP, length 81
17:57:03.922166 IP 46.31.27.36.58950 > 216.219.95.164.47291: UDP, length 81
17:57:03.922712 IP 46.31.27.36.58950 > 216.219.95.164.47291: UDP, length 81
17:57:03.927884 IP 216.219.95.164.47291 > 46.31.27.36.58950: UDP, length 81
17:57:03.941204 IP 216.219.95.164.47291 > 46.31.27.36.58950: UDP, length 81
17:57:03.956568 IP 216.219.95.164.47291 > 46.31.27.36.58950: UDP, length 81
17:57:04.058247 IP 46.31.27.36.58950 > 216.219.95.164.47291: UDP, length 65
17:57:04.058378 IP 46.31.27.36.58950 > 216.219.95.164.47291: UDP, length 289
17:57:04.073141 IP 216.219.95.164.47291 > 46.31.27.36.58950: UDP, length 65
17:57:04.099809 IP 46.31.27.36.58950 > 216.219.95.164.47291: UDP, length 65
17:57:04.100791 IP 46.31.27.36.58950 > 216.219.95.164.47291: UDP, length 289
17:57:04.112134 IP 46.31.27.36.58950 > 216.219.95.164.47291: UDP, length 65
17:57:04.112812 IP 46.31.27.36.58950 > 216.219.95.164.47291: UDP, length 1329
17:57:04.112893 IP 46.31.27.36.58950 > 216.219.95.164.47291: UDP, length 529
17:57:04.116420 IP 216.219.95.164.47291 > 46.31.27.36.58950: UDP, length 65
17:57:04.120612 IP 216.219.95.164.47291 > 46.31.27.36.58950: UDP, length 65
17:57:04.127402 IP 46.31.27.36.58950 > 216.219.95.164.47291: UDP, length 65
17:57:04.128189 IP 46.31.27.36.58950 > 216.219.95.164.47291: UDP, length 257
17:57:04.130935 IP 216.219.95.164.47291 > 46.31.27.36.58950: UDP, length 65
17:57:04.131095 IP 216.219.95.164.47291 > 46.31.27.36.58950: UDP, length 65
17:57:04.132896 IP 216.219.95.164.47291 > 46.31.27.36.58950: UDP, length 65
17:57:04.195669 IP 216.219.95.164.47291 > 46.31.27.36.58950: UDP, length 65
17:57:04.198066 IP 216.219.95.164.47291 > 46.31.27.36.58950: UDP, length 65
17:57:04.303617 IP 46.31.27.36.58950 > 216.219.95.164.47291: UDP, length 81
17:57:04.325420 IP 216.219.95.164.47291 > 46.31.27.36.58950: UDP, length 81
17:57:04.429079 IP 46.31.27.36.58950 > 216.219.95.164.47291: UDP, length 193
17:57:04.496457 IP 46.31.27.36.58950 > 216.219.95.164.47291: UDP, length 65
17:57:04.497080 IP 46.31.27.36.58950 > 216.219.95.164.47291: UDP, length 1329
17:57:04.497082 IP 46.31.27.36.58950 > 216.219.95.164.47291: UDP, length 561
17:57:04.517608 IP 216.219.95.164.47291 > 46.31.27.36.58950: UDP, length 65
17:57:04.519014 IP 216.219.95.164.47291 > 46.31.27.36.58950: UDP, length 65
17:57:04.520341 IP 216.219.95.164.47291 > 46.31.27.36.58950: UDP, length 65
17:57:04.609259 IP 46.31.27.36.58950 > 216.219.95.164.47291: UDP, length 81
17:57:04.692034 IP 46.31.27.36.58950 > 216.219.95.164.47291: UDP, length 81
17:57:04.697198 IP 216.219.95.164.47291 > 46.31.27.36.58950: UDP, length 81
17:57:04.766868 IP 216.219.95.164.47291 > 46.31.27.36.58950: UDP, length 81
17:57:04.862983 IP 46.31.27.36.58950 > 216.219.95.164.47291: UDP, length 81
17:57:04.868861 IP 46.31.27.36.58950 > 216.219.95.164.47291: UDP, length 65
17:57:04.869686 IP 46.31.27.36.58950 > 216.219.95.164.47291: UDP, length 1329
17:57:04.869723 IP 46.31.27.36.58950 > 216.219.95.164.47291: UDP, length 609
17:57:04.873487 IP 216.219.95.164.47291 > 46.31.27.36.58950: UDP, length 65
17:57:04.873599 IP 216.219.95.164.47291 > 46.31.27.36.58950: UDP, length 65
17:57:04.874895 IP 216.219.95.164.47291 > 46.31.27.36.58950: UDP, length 65
17:57:04.937504 IP 46.31.27.36.58950 > 216.219.95.164.47291: UDP, length 65
17:57:04.938345 IP 46.31.27.36.58950 > 216.219.95.164.47291: UDP, length 1329
17:57:04.938529 IP 46.31.27.36.58950 > 216.219.95.164.47291: UDP, length 561
17:57:04.990255 IP 46.31.27.36.58950 > 216.219.95.164.47291: UDP, length 81
17:57:05.017910 IP 216.219.95.164.47291 > 46.31.27.36.58950: UDP, length 81
17:57:05.025056 IP 216.219.95.164.47291 > 46.31.27.36.58950: UDP, length 81
17:57:05.045428 IP 46.31.27.36.58950 > 216.219.95.164.47291: UDP, length 81
17:57:05.055173 IP 216.219.95.164.47291 > 46.31.27.36.58950: UDP, length 81
17:57:05.095149 IP 216.219.95.164.47291 > 46.31.27.36.58950: UDP, length 65
17:57:05.097249 IP 216.219.95.164.47291 > 46.31.27.36.58950: UDP, length 65
17:57:05.097402 IP 216.219.95.164.47291 > 46.31.27.36.58950: UDP, length 65
17:57:05.189138 IP 46.31.27.36.58950 > 216.219.95.164.47291: UDP, length 65
17:57:05.189544 IP 46.31.27.36.58950 > 216.219.95.164.47291: UDP, length 1329
17:57:05.189883 IP 46.31.27.36.58950 > 216.219.95.164.47291: UDP, length 593
17:57:05.195603 IP 46.31.27.36.58950 > 216.219.95.164.47291: UDP, length 65
17:57:05.201342 IP 46.31.27.36.58950 > 216.219.95.164.47291: UDP, length 513
17:57:05.226390 IP 46.31.27.36.58950 > 216.219.95.164.47291: UDP, length 65
17:57:05.226823 IP 46.31.27.36.58950 > 216.219.95.164.47291: UDP, length 1329
17:57:05.226823 IP 46.31.27.36.58950 > 216.219.95.164.47291: UDP, length 577
17:57:05.231586 IP 216.219.95.164.47291 > 46.31.27.36.58950: UDP, length 65
17:57:05.231699 IP 216.219.95.164.47291 > 46.31.27.36.58950: UDP, length 65
17:57:05.231785 IP 216.219.95.164.47291 > 46.31.27.36.58950: UDP, length 65
17:57:05.233027 IP 216.219.95.164.47291 > 46.31.27.36.58950: UDP, length 65
17:57:05.235397 IP 216.219.95.164.47291 > 46.31.27.36.58950: UDP, length 65
17:57:05.266957 IP 46.31.27.36.58950 > 216.219.95.164.47291: UDP, length 81
17:57:05.344604 IP 216.219.95.164.47291 > 46.31.27.36.58950: UDP, length 65
17:57:05.344655 IP 216.219.95.164.47291 > 46.31.27.36.58950: UDP, length 65
17:57:05.346414 IP 216.219.95.164.47291 > 46.31.27.36.58950: UDP, length 65
17:57:05.424851 IP 216.219.95.164.47291 > 46.31.27.36.58950: UDP, length 81
17:57:05.516283 IP 46.31.27.36.58950 > 216.219.95.164.47291: UDP, length 81
17:57:05.592649 IP 46.31.27.36.58950 > 216.219.95.164.47291: UDP, length 241
17:57:05.595747 IP 46.31.27.36.58950 > 216.219.95.164.47291: UDP, length 65
17:57:05.596308 IP 46.31.27.36.58950 > 216.219.95.164.47291: UDP, length 1329
17:57:05.596432 IP 46.31.27.36.58950 > 216.219.95.164.47291: UDP, length 625
17:57:05.670640 IP 216.219.95.164.47291 > 46.31.27.36.58950: UDP, length 81
17:57:05.749232 IP 46.31.27.36.58950 > 216.219.95.164.47291: UDP, length 241
17:57:05.756431 IP 216.219.95.164.47291 > 46.31.27.36.58950: UDP, length 65
17:57:05.756479 IP 216.219.95.164.47291 > 46.31.27.36.58950: UDP, length 65
17:57:05.756525 IP 216.219.95.164.47291 > 46.31.27.36.58950: UDP, length 65
17:57:05.842142 IP 46.31.27.36.58950 > 216.219.95.164.47291: UDP, length 65
17:57:05.842583 IP 46.31.27.36.58950 > 216.219.95.164.47291: UDP, length 1329
17:57:05.842584 IP 46.31.27.36.58950 > 216.219.95.164.47291: UDP, length 561
17:57:05.994997 IP 216.219.95.164.47291 > 46.31.27.36.58950: UDP, length 65
17:57:05.995061 IP 216.219.95.164.47291 > 46.31.27.36.58950: UDP, length 65
17:57:05.996269 IP 216.219.95.164.47291 > 46.31.27.36.58950: UDP, length 65
17:57:06.061398 IP 46.31.27.36.58950 > 216.219.95.164.47291: UDP, length 81
17:57:06.064024 IP 216.219.95.164.47291 > 46.31.27.36.58950: UDP, length 81
17:57:06.235868 IP 46.31.27.36.58950 > 216.219.95.164.47291: UDP, length 65
17:57:06.237212 IP 46.31.27.36.58950 > 216.219.95.164.47291: UDP, length 529
17:57:06.252224 IP 216.219.95.164.47291 > 46.31.27.36.58950: UDP, length 65
17:57:06.939567 IP 46.31.27.36.58950 > 216.219.95.164.47291: UDP, length 81
17:57:06.943330 IP 216.219.95.164.47291 > 46.31.27.36.58950: UDP, length 81
17:57:07.114439 IP 46.31.27.36.58950 > 216.219.95.164.47291: UDP, length 65
17:57:07.115115 IP 46.31.27.36.58950 > 216.219.95.164.47291: UDP, length 1329
17:57:07.115365 IP 46.31.27.36.58950 > 216.219.95.164.47291: UDP, length 529
17:57:07.118524 IP 216.219.95.164.47291 > 46.31.27.36.58950: UDP, length 65
17:57:07.118646 IP 216.219.95.164.47291 > 46.31.27.36.58950: UDP, length 65
17:57:07.118714 IP 216.219.95.164.47291 > 46.31.27.36.58950: UDP, length 65
17:57:07.184520 IP 46.31.27.36.58950 > 216.219.95.164.47291: UDP, length 81
17:57:07.240130 IP 216.219.95.164.47291 > 46.31.27.36.58950: UDP, length 81
17:57:07.289845 IP 46.31.27.36.58950 > 216.219.95.164.47291: UDP, length 81
17:57:07.292607 IP 216.219.95.164.47291 > 46.31.27.36.58950: UDP, length 81
17:57:07.298675 IP 46.31.27.36.58950 > 216.219.95.164.47291: UDP, length 113
17:57:07.303714 IP 216.219.95.164.47291 > 46.31.27.36.58950: UDP, length 209
17:57:07.410511 IP 46.31.27.36.58950 > 216.219.95.164.47291: UDP, length 65
17:57:07.411294 IP 46.31.27.36.58950 > 216.219.95.164.47291: UDP, length 1329
17:57:07.411554 IP 46.31.27.36.58950 > 216.219.95.164.47291: UDP, length 545
17:57:07.437564 IP 46.31.27.36.58950 > 216.219.95.164.47291: UDP, length 193
17:57:07.463313 IP 46.31.27.36.58950 > 216.219.95.164.47291: UDP, length 65
17:57:07.463677 IP 46.31.27.36.58950 > 216.219.95.164.47291: UDP, length 1329
17:57:07.463800 IP 46.31.27.36.58950 > 216.219.95.164.47291: UDP, length 529
17:57:07.468775 IP 216.219.95.164.47291 > 46.31.27.36.58950: UDP, length 65
17:57:07.468893 IP 216.219.95.164.47291 > 46.31.27.36.58950: UDP, length 65
17:57:07.468983 IP 216.219.95.164.47291 > 46.31.27.36.58950: UDP, length 65
17:57:07.470180 IP 216.219.95.164.47291 > 46.31.27.36.58950: UDP, length 65
17:57:07.470218 IP 216.219.95.164.47291 > 46.31.27.36.58950: UDP, length 65
17:57:07.470272 IP 216.219.95.164.47291 > 46.31.27.36.58950: UDP, length 65
17:57:07.475063 IP 46.31.27.36.58950 > 216.219.95.164.47291: UDP, length 81
17:57:07.478269 IP 216.219.95.164.47291 > 46.31.27.36.58950: UDP, length 81
17:57:07.648990 IP 46.31.27.36.58950 > 216.219.95.164.47291: UDP, length 65
17:57:07.650447 IP 46.31.27.36.58950 > 216.219.95.164.47291: UDP, length 289
17:57:07.656300 IP 216.219.95.164.47291 > 46.31.27.36.58950: UDP, length 65
17:57:07.656607 IP 216.219.95.164.47291 > 46.31.27.36.58950: UDP, length 65
17:57:07.662587 IP 46.31.27.36.58950 > 216.219.95.164.47291: UDP, length 81
17:57:07.719852 IP 216.219.95.164.47291 > 46.31.27.36.58950: UDP, length 81
17:57:07.890757 IP 46.31.27.36.58950 > 216.219.95.164.47291: UDP, length 65
17:57:07.891009 IP 46.31.27.36.58950 > 216.219.95.164.47291: UDP, length 1329
17:57:07.891313 IP 46.31.27.36.58950 > 216.219.95.164.47291: UDP, length 545
17:57:07.946728 IP 216.219.95.164.47291 > 46.31.27.36.58950: UDP, length 65
17:57:07.947984 IP 216.219.95.164.47291 > 46.31.27.36.58950: UDP, length 65
17:57:07.948062 IP 216.219.95.164.47291 > 46.31.27.36.58950: UDP, length 65
17:57:07.978126 IP 46.31.27.36.58950 > 216.219.95.164.47291: UDP, length 81
17:57:08.051349 IP 46.31.27.36.58950 > 216.219.95.164.47291: UDP, length 241
17:57:08.134400 IP 216.219.95.164.47291 > 46.31.27.36.58950: UDP, length 81
17:57:08.237770 IP 46.31.27.36.58950 > 216.219.95.164.47291: UDP, length 81
17:57:08.284296 IP 46.31.27.36.58950 > 216.219.95.164.47291: UDP, length 241
17:57:08.305893 IP 46.31.27.36.58950 > 216.219.95.164.47291: UDP, length 65
17:57:08.306262 IP 46.31.27.36.58950 > 216.219.95.164.47291: UDP, length 1329
17:57:08.306291 IP 46.31.27.36.58950 > 216.219.95.164.47291: UDP, length 593
17:57:08.352661 IP 46.31.27.36.58950 > 216.219.95.164.47291: UDP, length 81
17:57:08.352663 IP 46.31.27.36.58950 > 216.219.95.164.47291: UDP, length 97
17:57:08.352663 IP 46.31.27.36.58950 > 216.219.95.164.47291: UDP, length 97
17:57:08.388111 IP 216.219.95.164.47291 > 46.31.27.36.58950: UDP, length 449
17:57:08.399998 IP 216.219.95.164.47291 > 46.31.27.36.58950: UDP, length 449
17:57:08.403608 IP 216.219.95.164.47291 > 46.31.27.36.58950: UDP, length 81
17:57:08.404881 IP 216.219.95.164.47291 > 46.31.27.36.58950: UDP, length 81
17:57:08.461301 IP 216.219.95.164.47291 > 46.31.27.36.58950: UDP, length 65
17:57:08.462683 IP 216.219.95.164.47291 > 46.31.27.36.58950: UDP, length 65
17:57:08.465185 IP 216.219.95.164.47291 > 46.31.27.36.58950: UDP, length 65
17:57:08.574999 IP 46.31.27.36.58950 > 216.219.95.164.47291: UDP, length 65
17:57:08.575590 IP 46.31.27.36.58950 > 216.219.95.164.47291: UDP, length 241
17:57:08.575591 IP 46.31.27.36.58950 > 216.219.95.164.47291: UDP, length 65
17:57:08.576457 IP 46.31.27.36.58950 > 216.219.95.164.47291: UDP, length 1329
17:57:08.576567 IP 46.31.27.36.58950 > 216.219.95.164.47291: UDP, length 529
17:57:08.624775 IP 216.219.95.164.47291 > 46.31.27.36.58950: UDP, length 65
17:57:08.629847 IP 216.219.95.164.47291 > 46.31.27.36.58950: UDP, length 65
17:57:08.633221 IP 46.31.27.36.58950 > 216.219.95.164.47291: UDP, length 81
17:57:08.738757 IP 216.219.95.164.47291 > 46.31.27.36.58950: UDP, length 65
17:57:08.739929 IP 216.219.95.164.47291 > 46.31.27.36.58950: UDP, length 65
17:57:08.739994 IP 216.219.95.164.47291 > 46.31.27.36.58950: UDP, length 65
17:57:08.788792 IP 216.219.95.164.47291 > 46.31.27.36.58950: UDP, length 81
17:57:08.912781 IP 46.31.27.36.58950 > 216.219.95.164.47291: UDP, length 81
17:57:08.959397 IP 46.31.27.36.58950 > 216.219.95.164.47291: UDP, length 65
17:57:08.959699 IP 46.31.27.36.58950 > 216.219.95.164.47291: UDP, length 1329
17:57:08.959700 IP 46.31.27.36.58950 > 216.219.95.164.47291: UDP, length 593
17:57:09.076688 IP 216.219.95.164.47291 > 46.31.27.36.58950: UDP, length 81
17:57:09.114206 IP 216.219.95.164.47291 > 46.31.27.36.58950: UDP, length 65
17:57:09.115981 IP 216.219.95.164.47291 > 46.31.27.36.58950: UDP, length 65
17:57:09.116132 IP 216.219.95.164.47291 > 46.31.27.36.58950: UDP, length 65
17:57:09.248401 IP 46.31.27.36.58950 > 216.219.95.164.47291: UDP, length 65
17:57:09.248742 IP 46.31.27.36.58950 > 216.219.95.164.47291: UDP, length 1329
17:57:09.248763 IP 46.31.27.36.58950 > 216.219.95.164.47291: UDP, length 625
17:57:09.411065 IP 216.219.95.164.47291 > 46.31.27.36.58950: UDP, length 65
17:57:09.411195 IP 216.219.95.164.47291 > 46.31.27.36.58950: UDP, length 65
17:57:09.411432 IP 216.219.95.164.47291 > 46.31.27.36.58950: UDP, length 65
17:57:09.875260 IP 46.31.27.36.58950 > 216.219.95.164.47291: UDP, length 81
17:57:09.883037 IP 216.219.95.164.47291 > 46.31.27.36.58950: UDP, length 113
17:57:09.983975 IP 46.31.27.36.58950 > 216.219.95.164.47291: UDP, length 33
17:57:10.054549 IP 46.31.27.36.58950 > 216.219.95.164.47291: UDP, length 81
17:57:10.054695 IP 46.31.27.36.58950 > 216.219.95.164.47291: UDP, length 81
17:57:10.058102 IP 216.219.95.164.47291 > 46.31.27.36.58950: UDP, length 81
17:57:10.058180 IP 216.219.95.164.47291 > 46.31.27.36.58950: UDP, length 81
17:57:10.145137 IP 46.31.27.36.58950 > 216.219.95.164.47291: UDP, length 81
17:57:10.229038 IP 46.31.27.36.58950 > 216.219.95.164.47291: UDP, length 65
17:57:10.229147 IP 46.31.27.36.58950 > 216.219.95.164.47291: UDP, length 65
17:57:10.229556 IP 46.31.27.36.58950 > 216.219.95.164.47291: UDP, length 1329
17:57:10.229709 IP 46.31.27.36.58950 > 216.219.95.164.47291: UDP, length 593
17:57:10.230016 IP 46.31.27.36.58950 > 216.219.95.164.47291: UDP, length 1329
17:57:10.230182 IP 46.31.27.36.58950 > 216.219.95.164.47291: UDP, length 625
17:57:10.240001 IP 216.219.95.164.47291 > 46.31.27.36.58950: UDP, length 65
17:57:10.242635 IP 216.219.95.164.47291 > 46.31.27.36.58950: UDP, length 65
17:57:10.242738 IP 216.219.95.164.47291 > 46.31.27.36.58950: UDP, length 65
17:57:10.244826 IP 216.219.95.164.47291 > 46.31.27.36.58950: UDP, length 65
