dropped privs to tcpdump
tcpdump: verbose output suppressed, use -v[v]... for full protocol decode
listening on eth0, link-type EN10MB (Ethernet), snapshot length 262144 bytes
20:02:49.294663 IP 46.31.27.36.4933 > 216.219.95.164.47291: UDP, length 97
20:02:49.294665 IP 46.31.27.36.4933 > 216.219.95.164.47291: UDP, length 129
20:02:49.294666 IP 46.31.27.36.4933 > 216.219.95.164.47291: UDP, length 81
20:02:49.294666 IP 46.31.27.36.4933 > 216.219.95.164.47291: UDP, length 129
20:02:49.294873 IP 46.31.27.36.4933 > 216.219.95.164.47291: UDP, length 129
20:02:49.294874 IP 46.31.27.36.4933 > 216.219.95.164.47291: UDP, length 97
20:02:49.294874 IP 46.31.27.36.4933 > 216.219.95.164.47291: UDP, length 81
20:02:49.294875 IP 46.31.27.36.4933 > 216.219.95.164.47291: UDP, length 129
20:02:49.295057 IP 46.31.27.36.4933 > 216.219.95.164.47291: UDP, length 129
20:02:49.295058 IP 46.31.27.36.4933 > 216.219.95.164.47291: UDP, length 129
20:02:49.295058 IP 46.31.27.36.4933 > 216.219.95.164.47291: UDP, length 113
20:02:49.295059 IP 46.31.27.36.4933 > 216.219.95.164.47291: UDP, length 81
20:02:49.295059 IP 46.31.27.36.4933 > 216.219.95.164.47291: UDP, length 97
20:02:49.295151 IP 46.31.27.36.4933 > 216.219.95.164.47291: UDP, length 81
20:02:49.295349 IP 46.31.27.36.4933 > 216.219.95.164.47291: UDP, length 97
20:02:49.295350 IP 46.31.27.36.4933 > 216.219.95.164.47291: UDP, length 113
20:02:49.295356 IP 46.31.27.36.4933 > 216.219.95.164.47291: UDP, length 113
20:02:49.295405 IP 46.31.27.36.4933 > 216.219.95.164.47291: UDP, length 129
20:02:49.295405 IP 46.31.27.36.4933 > 216.219.95.164.47291: UDP, length 129
20:02:49.295599 IP 46.31.27.36.4933 > 216.219.95.164.47291: UDP, length 129
20:02:49.295600 IP 46.31.27.36.4933 > 216.219.95.164.47291: UDP, length 113
20:02:49.295601 IP 46.31.27.36.4933 > 216.219.95.164.47291: UDP, length 81
20:02:49.295601 IP 46.31.27.36.4933 > 216.219.95.164.47291: UDP, length 97
20:02:49.295759 IP 46.31.27.36.4933 > 216.219.95.164.47291: UDP, length 113
20:02:49.295760 IP 46.31.27.36.4933 > 216.219.95.164.47291: UDP, length 113
20:02:49.295792 IP 46.31.27.36.4933 > 216.219.95.164.47291: UDP, length 97
20:02:49.295793 IP 46.31.27.36.4933 > 216.219.95.164.47291: UDP, length 81
20:02:49.295794 IP 46.31.27.36.4933 > 216.219.95.164.47291: UDP, length 97
20:02:49.295795 IP 46.31.27.36.4933 > 216.219.95.164.47291: UDP, length 81
20:02:49.295911 IP 46.31.27.36.4933 > 216.219.95.164.47291: UDP, length 97
20:02:49.295911 IP 46.31.27.36.4933 > 216.219.95.164.47291: UDP, length 97
20:02:49.295978 IP 46.31.27.36.4933 > 216.219.95.164.47291: UDP, length 97
20:02:49.296081 IP 46.31.27.36.4933 > 216.219.95.164.47291: UDP, length 113
20:02:49.296089 IP 46.31.27.36.4933 > 216.219.95.164.47291: UDP, length 113
20:02:49.296295 IP 46.31.27.36.4933 > 216.219.95.164.47291: UDP, length 113
20:02:49.296374 IP 46.31.27.36.4933 > 216.219.95.164.47291: UDP, length 97
20:02:49.296384 IP 46.31.27.36.4933 > 216.219.95.164.47291: UDP, length 97
20:02:49.296385 IP 46.31.27.36.4933 > 216.219.95.164.47291: UDP, length 81
20:02:49.296622 IP 46.31.27.36.4933 > 216.219.95.164.47291: UDP, length 97
20:02:49.296623 IP 46.31.27.36.4933 > 216.219.95.164.47291: UDP, length 97
20:02:49.296724 IP 46.31.27.36.4933 > 216.219.95.164.47291: UDP, length 97
20:02:49.297129 IP 46.31.27.36.4933 > 216.219.95.164.47291: UDP, length 113
20:02:49.297130 IP 46.31.27.36.4933 > 216.219.95.164.47291: UDP, length 113
20:02:49.297275 IP 46.31.27.36.4933 > 216.219.95.164.47291: UDP, length 81
20:02:49.297288 IP 46.31.27.36.4933 > 216.219.95.164.47291: UDP, length 81
20:02:49.298264 IP 46.31.27.36.4933 > 216.219.95.164.47291: UDP, length 97
20:02:49.360115 IP 46.31.27.36.4933 > 216.219.95.164.47291: UDP, length 81
20:02:49.374598 IP 216.219.95.164.47291 > 46.31.27.36.4933: UDP, length 161
20:02:49.391782 IP 216.219.95.164.47291 > 46.31.27.36.4933: UDP, length 97
20:02:49.405268 IP 216.219.95.164.47291 > 46.31.27.36.4933: UDP, length 161
20:02:49.409937 IP 216.219.95.164.47291 > 46.31.27.36.4933: UDP, length 97
20:02:49.417048 IP 216.219.95.164.47291 > 46.31.27.36.4933: UDP, length 209
20:02:49.421695 IP 216.219.95.164.47291 > 46.31.27.36.4933: UDP, length 129
20:02:49.425268 IP 216.219.95.164.47291 > 46.31.27.36.4933: UDP, length 161
20:02:49.431280 IP 216.219.95.164.47291 > 46.31.27.36.4933: UDP, length 97
20:02:49.436315 IP 216.219.95.164.47291 > 46.31.27.36.4933: UDP, length 161
20:02:49.472521 IP 216.219.95.164.47291 > 46.31.27.36.4933: UDP, length 401
20:02:49.475291 IP 216.219.95.164.47291 > 46.31.27.36.4933: UDP, length 385
20:02:49.483566 IP 216.219.95.164.47291 > 46.31.27.36.4933: UDP, length 209
20:02:49.487417 IP 216.219.95.164.47291 > 46.31.27.36.4933: UDP, length 129
20:02:49.491035 IP 216.219.95.164.47291 > 46.31.27.36.4933: UDP, length 161
20:02:49.495716 IP 216.219.95.164.47291 > 46.31.27.36.4933: UDP, length 385
20:02:49.510040 IP 216.219.95.164.47291 > 46.31.27.36.4933: UDP, length 401
20:02:49.515790 IP 216.219.95.164.47291 > 46.31.27.36.4933: UDP, length 305
20:02:49.519343 IP 216.219.95.164.47291 > 46.31.27.36.4933: UDP, length 129
20:02:49.522872 IP 216.219.95.164.47291 > 46.31.27.36.4933: UDP, length 161
20:02:49.526454 IP 216.219.95.164.47291 > 46.31.27.36.4933: UDP, length 97
20:02:49.530087 IP 216.219.95.164.47291 > 46.31.27.36.4933: UDP, length 161
20:02:49.533584 IP 216.219.95.164.47291 > 46.31.27.36.4933: UDP, length 273
20:02:49.538255 IP 216.219.95.164.47291 > 46.31.27.36.4933: UDP, length 225
20:02:49.542129 IP 216.219.95.164.47291 > 46.31.27.36.4933: UDP, length 401
20:02:49.545726 IP 216.219.95.164.47291 > 46.31.27.36.4933: UDP, length 385
20:02:49.548098 IP 216.219.95.164.47291 > 46.31.27.36.4933: UDP, length 209
20:02:49.549174 IP 46.31.27.36.4933 > 216.219.95.164.47291: UDP, length 97
20:02:49.549738 IP 46.31.27.36.4933 > 216.219.95.164.47291: UDP, length 97
20:02:49.551971 IP 216.219.95.164.47291 > 46.31.27.36.4933: UDP, length 273
20:02:49.560244 IP 46.31.27.36.4933 > 216.219.95.164.47291: UDP, length 97
20:02:49.562781 IP 46.31.27.36.4933 > 216.219.95.164.47291: UDP, length 81
20:02:49.563123 IP 46.31.27.36.4933 > 216.219.95.164.47291: UDP, length 81
20:02:49.602747 IP 46.31.27.36.4933 > 216.219.95.164.47291: UDP, length 81
20:02:49.607126 IP 46.31.27.36.4933 > 216.219.95.164.47291: UDP, length 81
20:02:49.621998 IP 46.31.27.36.4933 > 216.219.95.164.47291: UDP, length 81
20:02:50.169417 IP 216.219.95.164.47291 > 46.31.27.36.4933: UDP, length 225
20:02:50.169672 IP 216.219.95.164.47291 > 46.31.27.36.4933: UDP, length 129
20:02:50.169852 IP 216.219.95.164.47291 > 46.31.27.36.4933: UDP, length 161
20:02:50.170008 IP 216.219.95.164.47291 > 46.31.27.36.4933: UDP, length 225
20:02:50.170090 IP 216.219.95.164.47291 > 46.31.27.36.4933: UDP, length 257
20:02:50.170170 IP 216.219.95.164.47291 > 46.31.27.36.4933: UDP, length 385
20:02:50.170225 IP 216.219.95.164.47291 > 46.31.27.36.4933: UDP, length 401
20:02:50.170296 IP 216.219.95.164.47291 > 46.31.27.36.4933: UDP, length 97
20:02:50.170349 IP 216.219.95.164.47291 > 46.31.27.36.4933: UDP, length 97
20:02:50.170414 IP 216.219.95.164.47291 > 46.31.27.36.4933: UDP, length 161
20:02:50.170498 IP 216.219.95.164.47291 > 46.31.27.36.4933: UDP, length 97
20:02:50.170561 IP 216.219.95.164.47291 > 46.31.27.36.4933: UDP, length 225
20:02:50.170611 IP 216.219.95.164.47291 > 46.31.27.36.4933: UDP, length 257
20:02:50.170682 IP 216.219.95.164.47291 > 46.31.27.36.4933: UDP, length 241
20:02:50.248288 IP 46.31.27.36.4933 > 216.219.95.164.47291: UDP, length 81
20:02:50.254799 IP 216.219.95.164.47291 > 46.31.27.36.4933: UDP, length 97
20:02:50.360688 IP 46.31.27.36.4933 > 216.219.95.164.47291: UDP, length 81
20:02:50.360833 IP 46.31.27.36.4933 > 216.219.95.164.47291: UDP, length 81
20:02:50.609079 IP 46.31.27.36.4933 > 216.219.95.164.47291: UDP, length 81
20:02:50.609163 IP 46.31.27.36.4933 > 216.219.95.164.47291: UDP, length 81
20:02:50.623999 IP 46.31.27.36.4933 > 216.219.95.164.47291: UDP, length 81
20:02:50.624681 IP 46.31.27.36.4933 > 216.219.95.164.47291: UDP, length 81
20:02:50.628379 IP 46.31.27.36.4933 > 216.219.95.164.47291: UDP, length 81
20:02:50.793607 IP 46.31.27.36.4933 > 216.219.95.164.47291: UDP, length 193
20:02:50.824969 IP 46.31.27.36.4933 > 216.219.95.164.47291: UDP, length 81
20:02:50.825534 IP 46.31.27.36.4933 > 216.219.95.164.47291: UDP, length 81
20:02:51.372513 IP 46.31.27.36.4933 > 216.219.95.164.47291: UDP, length 81
20:02:51.372629 IP 46.31.27.36.4933 > 216.219.95.164.47291: UDP, length 81
20:02:51.634858 IP 46.31.27.36.4933 > 216.219.95.164.47291: UDP, length 81
20:02:51.635028 IP 46.31.27.36.4933 > 216.219.95.164.47291: UDP, length 81
20:02:52.617346 IP 46.31.27.36.4933 > 216.219.95.164.47291: UDP, length 81
20:02:52.618238 IP 46.31.27.36.4933 > 216.219.95.164.47291: UDP, length 81
20:02:52.632291 IP 46.31.27.36.4933 > 216.219.95.164.47291: UDP, length 81
20:02:53.332770 IP 46.31.27.36.4933 > 216.219.95.164.47291: UDP, length 81
20:02:53.332970 IP 46.31.27.36.4933 > 216.219.95.164.47291: UDP, length 81
20:02:53.366325 IP 46.31.27.36.4933 > 216.219.95.164.47291: UDP, length 81
20:02:53.374035 IP 216.219.95.164.47291 > 46.31.27.36.4933: UDP, length 193
20:02:53.379128 IP 46.31.27.36.4933 > 216.219.95.164.47291: UDP, length 81
20:02:53.379210 IP 46.31.27.36.4933 > 216.219.95.164.47291: UDP, length 81
20:02:53.562144 IP 46.31.27.36.4933 > 216.219.95.164.47291: UDP, length 81
20:02:53.645272 IP 46.31.27.36.4933 > 216.219.95.164.47291: UDP, length 81
20:02:53.645422 IP 46.31.27.36.4933 > 216.219.95.164.47291: UDP, length 81
20:02:53.799779 IP 46.31.27.36.4933 > 216.219.95.164.47291: UDP, length 193
20:02:54.561363 IP 46.31.27.36.4933 > 216.219.95.164.47291: UDP, length 81
20:02:54.984033 IP 46.31.27.36.4933 > 216.219.95.164.47291: UDP, length 81
20:02:54.984174 IP 46.31.27.36.4933 > 216.219.95.164.47291: UDP, length 97
20:02:54.998755 IP 216.219.95.164.47291 > 46.31.27.36.4933: UDP, length 257
20:02:55.988381 IP 46.31.27.36.4933 > 216.219.95.164.47291: UDP, length 81
20:02:56.299735 IP 46.31.27.36.4933 > 216.219.95.164.47291: UDP, length 81
20:02:56.307056 IP 216.219.95.164.47291 > 46.31.27.36.4933: UDP, length 97
20:02:56.493823 IP 46.31.27.36.4933 > 216.219.95.164.47291: UDP, length 81
20:02:56.572008 IP 46.31.27.36.4933 > 216.219.95.164.47291: UDP, length 81
20:02:56.618132 IP 46.31.27.36.4933 > 216.219.95.164.47291: UDP, length 81
20:02:56.633830 IP 46.31.27.36.4933 > 216.219.95.164.47291: UDP, length 81
20:02:56.810812 IP 46.31.27.36.4933 > 216.219.95.164.47291: UDP, length 193
20:02:57.380063 IP 46.31.27.36.4933 > 216.219.95.164.47291: UDP, length 81
20:02:57.380898 IP 46.31.27.36.4933 > 216.219.95.164.47291: UDP, length 81
20:02:57.506073 IP 46.31.27.36.4933 > 216.219.95.164.47291: UDP, length 81
20:02:57.660407 IP 46.31.27.36.4933 > 216.219.95.164.47291: UDP, length 81
20:02:57.660517 IP 46.31.27.36.4933 > 216.219.95.164.47291: UDP, length 81
20:02:58.003919 IP 46.31.27.36.4933 > 216.219.95.164.47291: UDP, length 81
20:02:59.294822 IP 46.31.27.36.4933 > 216.219.95.164.47291: UDP, length 33
20:02:59.512107 IP 46.31.27.36.4933 > 216.219.95.164.47291: UDP, length 81
20:02:59.825488 IP 46.31.27.36.4933 > 216.219.95.164.47291: UDP, length 193
20:02:59.841968 IP 46.31.27.36.4933 > 216.219.95.164.47291: UDP, length 81
20:02:59.897200 IP 46.31.27.36.4933 > 216.219.95.164.47291: UDP, length 81
20:02:59.897323 IP 46.31.27.36.4933 > 216.219.95.164.47291: UDP, length 113
20:02:59.905744 IP 216.219.95.164.47291 > 46.31.27.36.4933: UDP, length 113
20:02:59.907411 IP 216.219.95.164.47291 > 46.31.27.36.4933: UDP, length 321
20:03:00.092046 IP 46.31.27.36.4933 > 216.219.95.164.47291: UDP, length 81
20:03:00.092410 IP 46.31.27.36.4933 > 216.219.95.164.47291: UDP, length 81
20:03:00.093124 IP 46.31.27.36.4933 > 216.219.95.164.47291: UDP, length 81
20:03:00.227809 IP 46.31.27.36.4933 > 216.219.95.164.47291: UDP, length 81
20:03:00.233179 IP 216.219.95.164.47291 > 46.31.27.36.4933: UDP, length 129
20:03:00.352476 IP 46.31.27.36.4933 > 216.219.95.164.47291: UDP, length 81
20:03:00.353093 IP 46.31.27.36.4933 > 216.219.95.164.47291: UDP, length 81
20:03:00.419823 IP 46.31.27.36.4933 > 216.219.95.164.47291: UDP, length 81
20:03:00.584720 IP 46.31.27.36.4933 > 216.219.95.164.47291: UDP, length 81
20:03:00.588560 IP 46.31.27.36.4933 > 216.219.95.164.47291: UDP, length 81
20:03:00.588673 IP 46.31.27.36.4933 > 216.219.95.164.47291: UDP, length 97
20:03:00.593664 IP 216.219.95.164.47291 > 46.31.27.36.4933: UDP, length 129
20:03:00.595230 IP 216.219.95.164.47291 > 46.31.27.36.4933: UDP, length 465
20:03:00.780616 IP 46.31.27.36.4933 > 216.219.95.164.47291: UDP, length 81
20:03:00.781590 IP 46.31.27.36.4933 > 216.219.95.164.47291: UDP, length 81
20:03:00.848792 IP 46.31.27.36.4933 > 216.219.95.164.47291: UDP, length 81
20:03:00.900896 IP 46.31.27.36.4933 > 216.219.95.164.47291: UDP, length 97
20:03:00.904513 IP 216.219.95.164.47291 > 46.31.27.36.4933: UDP, length 129
20:03:01.037252 IP 46.31.27.36.4933 > 216.219.95.164.47291: UDP, length 81
20:03:01.037339 IP 46.31.27.36.4933 > 216.219.95.164.47291: UDP, length 81
20:03:01.094056 IP 46.31.27.36.4933 > 216.219.95.164.47291: UDP, length 1297
20:03:01.095039 IP 46.31.27.36.4933 > 216.219.95.164.47291: UDP, length 1297
20:03:01.095047 IP 46.31.27.36.4933 > 216.219.95.164.47291: UDP, length 129
20:03:01.097628 IP 46.31.27.36.4933 > 216.219.95.164.47291: UDP, length 81
20:03:01.099415 IP 46.31.27.36.4933 > 216.219.95.164.47291: UDP, length 81
20:03:01.099426 IP 46.31.27.36.4933 > 216.219.95.164.47291: UDP, length 81
20:03:01.163196 IP 46.31.27.36.4933 > 216.219.95.164.47291: UDP, length 1297
20:03:01.163541 IP 46.31.27.36.4933 > 216.219.95.164.47291: UDP, length 1297
20:03:01.163551 IP 46.31.27.36.4933 > 216.219.95.164.47291: UDP, length 1297
20:03:01.163552 IP 46.31.27.36.4933 > 216.219.95.164.47291: UDP, length 1297
20:03:01.303248 IP 46.31.27.36.4933 > 216.219.95.164.47291: UDP, length 1297
20:03:01.364018 IP 46.31.27.36.4933 > 216.219.95.164.47291: UDP, length 81
20:03:01.364197 IP 46.31.27.36.4933 > 216.219.95.164.47291: UDP, length 81
20:03:01.426181 IP 46.31.27.36.4933 > 216.219.95.164.47291: UDP, length 81
20:03:01.584499 IP 46.31.27.36.4933 > 216.219.95.164.47291: UDP, length 1297
20:03:01.784969 IP 46.31.27.36.4933 > 216.219.95.164.47291: UDP, length 81
20:03:01.784972 IP 46.31.27.36.4933 > 216.219.95.164.47291: UDP, length 81
20:03:02.017726 IP 46.31.27.36.4933 > 216.219.95.164.47291: UDP, length 81
20:03:02.048327 IP 46.31.27.36.4933 > 216.219.95.164.47291: UDP, length 81
20:03:02.048616 IP 46.31.27.36.4933 > 216.219.95.164.47291: UDP, length 81
20:03:02.129915 IP 46.31.27.36.4933 > 216.219.95.164.47291: UDP, length 1297
20:03:02.830181 IP 46.31.27.36.4933 > 216.219.95.164.47291: UDP, length 193
20:03:02.858995 IP 46.31.27.36.4933 > 216.219.95.164.47291: UDP, length 81
20:03:03.107572 IP 46.31.27.36.4933 > 216.219.95.164.47291: UDP, length 81
20:03:03.110018 IP 46.31.27.36.4933 > 216.219.95.164.47291: UDP, length 81
20:03:03.110019 IP 46.31.27.36.4933 > 216.219.95.164.47291: UDP, length 81
20:03:03.199962 IP 46.31.27.36.4933 > 216.219.95.164.47291: UDP, length 1297
20:03:03.370583 IP 46.31.27.36.4933 > 216.219.95.164.47291: UDP, length 81
20:03:03.370732 IP 46.31.27.36.4933 > 216.219.95.164.47291: UDP, length 81
20:03:03.432373 IP 46.31.27.36.4933 > 216.219.95.164.47291: UDP, length 81
20:03:03.525603 IP 46.31.27.36.4933 > 216.219.95.164.47291: UDP, length 81
20:03:03.794497 IP 46.31.27.36.4933 > 216.219.95.164.47291: UDP, length 81
20:03:03.797608 IP 46.31.27.36.4933 > 216.219.95.164.47291: UDP, length 81
20:03:04.055622 IP 46.31.27.36.4933 > 216.219.95.164.47291: UDP, length 81
20:03:04.060428 IP 46.31.27.36.4933 > 216.219.95.164.47291: UDP, length 81
20:03:04.060430 IP 46.31.27.36.4933 > 216.219.95.164.47291: UDP, length 81
20:03:04.084073 IP 46.31.27.36.4933 > 216.219.95.164.47291: UDP, length 81
20:03:04.632268 IP 46.31.27.36.4933 > 216.219.95.164.47291: UDP, length 81
20:03:04.646741 IP 46.31.27.36.4933 > 216.219.95.164.47291: UDP, length 81
20:03:05.020335 IP 46.31.27.36.4933 > 216.219.95.164.47291: UDP, length 81
20:03:05.097485 IP 46.31.27.36.4933 > 216.219.95.164.47291: UDP, length 1297
20:03:05.317614 IP 46.31.27.36.4933 > 216.219.95.164.47291: UDP, length 81
20:03:05.347680 IP 46.31.27.36.4933 > 216.219.95.164.47291: UDP, length 81
20:03:05.393571 IP 46.31.27.36.4933 > 216.219.95.164.47291: UDP, length 81
20:03:05.393648 IP 46.31.27.36.4933 > 216.219.95.164.47291: UDP, length 81
20:03:05.674791 IP 46.31.27.36.4933 > 216.219.95.164.47291: UDP, length 81
20:03:05.675717 IP 46.31.27.36.4933 > 216.219.95.164.47291: UDP, length 81
20:03:06.031990 IP 46.31.27.36.4933 > 216.219.95.164.47291: UDP, length 81
20:03:06.931479 IP 46.31.27.36.4933 > 216.219.95.164.47291: UDP, length 81
20:03:07.196923 IP 46.31.27.36.4933 > 216.219.95.164.47291: UDP, length 81
20:03:07.197056 IP 46.31.27.36.4933 > 216.219.95.164.47291: UDP, length 81
20:03:07.197057 IP 46.31.27.36.4933 > 216.219.95.164.47291: UDP, length 81
20:03:07.412529 IP 46.31.27.36.4933 > 216.219.95.164.47291: UDP, length 81
20:03:07.412531 IP 46.31.27.36.4933 > 216.219.95.164.47291: UDP, length 81
20:03:07.504704 IP 46.31.27.36.4933 > 216.219.95.164.47291: UDP, length 81
20:03:07.801719 IP 46.31.27.36.4933 > 216.219.95.164.47291: UDP, length 81
20:03:07.802102 IP 46.31.27.36.4933 > 216.219.95.164.47291: UDP, length 81
20:03:07.816831 IP 46.31.27.36.4933 > 216.219.95.164.47291: UDP, length 81
20:03:07.965719 IP 46.31.27.36.4933 > 216.219.95.164.47291: UDP, length 81
20:03:08.034184 IP 46.31.27.36.4933 > 216.219.95.164.47291: UDP, length 81
20:03:08.170540 IP 46.31.27.36.4933 > 216.219.95.164.47291: UDP, length 81
20:03:08.170542 IP 46.31.27.36.4933 > 216.219.95.164.47291: UDP, length 81
20:03:08.377771 IP 46.31.27.36.4933 > 216.219.95.164.47291: UDP, length 113
20:03:08.386801 IP 216.219.95.164.47291 > 46.31.27.36.4933: UDP, length 209
20:03:08.584323 IP 46.31.27.36.4933 > 216.219.95.164.47291: UDP, length 81
20:03:08.594632 IP 46.31.27.36.4933 > 216.219.95.164.47291: UDP, length 81
20:03:09.399242 IP 46.31.27.36.4933 > 216.219.95.164.47291: UDP, length 33
20:03:09.604103 IP 46.31.27.36.4933 > 216.219.95.164.47291: UDP, length 81
20:03:10.027398 IP 46.31.27.36.4933 > 216.219.95.164.47291: UDP, length 81
20:03:10.218560 IP 46.31.27.36.4933 > 216.219.95.164.47291: UDP, length 81
20:03:10.628292 IP 46.31.27.36.4933 > 216.219.95.164.47291: UDP, length 97
20:03:10.628295 IP 46.31.27.36.4933 > 216.219.95.164.47291: UDP, length 97
20:03:10.635887 IP 46.31.27.36.4933 > 216.219.95.164.47291: UDP, length 81
20:03:10.678227 IP 216.219.95.164.47291 > 46.31.27.36.4933: UDP, length 257
20:03:10.678327 IP 216.219.95.164.47291 > 46.31.27.36.4933: UDP, length 209
20:03:10.865301 IP 46.31.27.36.4933 > 216.219.95.164.47291: UDP, length 81
20:03:10.865448 IP 46.31.27.36.4933 > 216.219.95.164.47291: UDP, length 81
20:03:11.120227 IP 46.31.27.36.4933 > 216.219.95.164.47291: UDP, length 81
20:03:11.120228 IP 46.31.27.36.4933 > 216.219.95.164.47291: UDP, length 81
20:03:11.211421 IP 46.31.27.36.4933 > 216.219.95.164.47291: UDP, length 81
20:03:11.307369 IP 46.31.27.36.4933 > 216.219.95.164.47291: UDP, length 97
20:03:11.311668 IP 216.219.95.164.47291 > 46.31.27.36.4933: UDP, length 129
20:03:11.399875 IP 46.31.27.36.4933 > 216.219.95.164.47291: UDP, length 81
20:03:11.498326 IP 46.31.27.36.4933 > 216.219.95.164.47291: UDP, length 81
20:03:11.539044 IP 46.31.27.36.4933 > 216.219.95.164.47291: UDP, length 81
20:03:11.601903 IP 46.31.27.36.4933 > 216.219.95.164.47291: UDP, length 81
20:03:11.647821 IP 46.31.27.36.4933 > 216.219.95.164.47291: UDP, length 81
20:03:11.757418 IP 46.31.27.36.4933 > 216.219.95.164.47291: UDP, length 81
20:03:11.866461 IP 46.31.27.36.4933 > 216.219.95.164.47291: UDP, length 81
20:03:11.866703 IP 46.31.27.36.4933 > 216.219.95.164.47291: UDP, length 81
20:03:12.038483 IP 46.31.27.36.4933 > 216.219.95.164.47291: UDP, length 81
20:03:12.132729 IP 46.31.27.36.4933 > 216.219.95.164.47291: UDP, length 81
20:03:12.132731 IP 46.31.27.36.4933 > 216.219.95.164.47291: UDP, length 81
20:03:12.411833 IP 46.31.27.36.4933 > 216.219.95.164.47291: UDP, length 81
20:03:12.505799 IP 46.31.27.36.4933 > 216.219.95.164.47291: UDP, length 81
20:03:12.771476 IP 46.31.27.36.4933 > 216.219.95.164.47291: UDP, length 81
20:03:13.212656 IP 46.31.27.36.4933 > 216.219.95.164.47291: UDP, length 81
20:03:13.220562 IP 46.31.27.36.4933 > 216.219.95.164.47291: UDP, length 81
20:03:13.220992 IP 46.31.27.36.4933 > 216.219.95.164.47291: UDP, length 81
20:03:13.225788 IP 216.219.95.164.47291 > 46.31.27.36.4933: UDP, length 145
20:03:13.411820 IP 46.31.27.36.4933 > 216.219.95.164.47291: UDP, length 81
20:03:13.476756 IP 46.31.27.36.4933 > 216.219.95.164.47291: UDP, length 81
20:03:13.591689 IP 46.31.27.36.4933 > 216.219.95.164.47291: UDP, length 81
20:03:13.591820 IP 46.31.27.36.4933 > 216.219.95.164.47291: UDP, length 113
20:03:13.610712 IP 216.219.95.164.47291 > 46.31.27.36.4933: UDP, length 385
20:03:13.648784 IP 46.31.27.36.4933 > 216.219.95.164.47291: UDP, length 81
20:03:13.664908 IP 46.31.27.36.4933 > 216.219.95.164.47291: UDP, length 81
20:03:13.868307 IP 46.31.27.36.4933 > 216.219.95.164.47291: UDP, length 81
20:03:13.868470 IP 46.31.27.36.4933 > 216.219.95.164.47291: UDP, length 81
20:03:14.134028 IP 46.31.27.36.4933 > 216.219.95.164.47291: UDP, length 81
20:03:14.134254 IP 46.31.27.36.4933 > 216.219.95.164.47291: UDP, length 81
20:03:14.226315 IP 46.31.27.36.4933 > 216.219.95.164.47291: UDP, length 81
20:03:14.412746 IP 46.31.27.36.4933 > 216.219.95.164.47291: UDP, length 81
20:03:14.427401 IP 46.31.27.36.4933 > 216.219.95.164.47291: UDP, length 81
20:03:14.490333 IP 46.31.27.36.4933 > 216.219.95.164.47291: UDP, length 81
20:03:14.506642 IP 46.31.27.36.4933 > 216.219.95.164.47291: UDP, length 81
20:03:14.599554 IP 46.31.27.36.4933 > 216.219.95.164.47291: UDP, length 81
20:03:14.600180 IP 46.31.27.36.4933 > 216.219.95.164.47291: UDP, length 81
20:03:14.676615 IP 46.31.27.36.4933 > 216.219.95.164.47291: UDP, length 81
20:03:14.786007 IP 46.31.27.36.4933 > 216.219.95.164.47291: UDP, length 81
20:03:15.126482 IP 46.31.27.36.4933 > 216.219.95.164.47291: UDP, length 81
20:03:15.390860 IP 46.31.27.36.4933 > 216.219.95.164.47291: UDP, length 81
20:03:15.391251 IP 46.31.27.36.4933 > 216.219.95.164.47291: UDP, length 81
20:03:15.453277 IP 46.31.27.36.4933 > 216.219.95.164.47291: UDP, length 81
20:03:15.608677 IP 46.31.27.36.4933 > 216.219.95.164.47291: UDP, length 81
20:03:15.608826 IP 46.31.27.36.4933 > 216.219.95.164.47291: UDP, length 81
20:03:15.812033 IP 46.31.27.36.4933 > 216.219.95.164.47291: UDP, length 81
20:03:15.812034 IP 46.31.27.36.4933 > 216.219.95.164.47291: UDP, length 81
20:03:16.075585 IP 46.31.27.36.4933 > 216.219.95.164.47291: UDP, length 81
20:03:16.075985 IP 46.31.27.36.4933 > 216.219.95.164.47291: UDP, length 81
20:03:16.231740 IP 46.31.27.36.4933 > 216.219.95.164.47291: UDP, length 81
20:03:16.434611 IP 46.31.27.36.4933 > 216.219.95.164.47291: UDP, length 81
20:03:16.496099 IP 46.31.27.36.4933 > 216.219.95.164.47291: UDP, length 81
20:03:16.604983 IP 46.31.27.36.4933 > 216.219.95.164.47291: UDP, length 81
20:03:16.683046 IP 46.31.27.36.4933 > 216.219.95.164.47291: UDP, length 81
20:03:17.137573 IP 46.31.27.36.4933 > 216.219.95.164.47291: UDP, length 81
20:03:17.214068 IP 46.31.27.36.4933 > 216.219.95.164.47291: UDP, length 81
20:03:17.619256 IP 46.31.27.36.4933 > 216.219.95.164.47291: UDP, length 81
20:03:17.650771 IP 46.31.27.36.4933 > 216.219.95.164.47291: UDP, length 81
20:03:17.882740 IP 46.31.27.36.4933 > 216.219.95.164.47291: UDP, length 81
20:03:17.883029 IP 46.31.27.36.4933 > 216.219.95.164.47291: UDP, length 81
20:03:18.148142 IP 46.31.27.36.4933 > 216.219.95.164.47291: UDP, length 81
20:03:18.148144 IP 46.31.27.36.4933 > 216.219.95.164.47291: UDP, length 81
20:03:18.148145 IP 46.31.27.36.4933 > 216.219.95.164.47291: UDP, length 81
20:03:18.414463 IP 46.31.27.36.4933 > 216.219.95.164.47291: UDP, length 81
20:03:18.517163 IP 46.31.27.36.4933 > 216.219.95.164.47291: UDP, length 81
20:03:18.763380 IP 46.31.27.36.4933 > 216.219.95.164.47291: UDP, length 81
20:03:18.792445 IP 46.31.27.36.4933 > 216.219.95.164.47291: UDP, length 81
20:03:19.319662 IP 46.31.27.36.4933 > 216.219.95.164.47291: UDP, length 33
20:03:19.772660 IP 46.31.27.36.4933 > 216.219.95.164.47291: UDP, length 81
20:03:20.054034 IP 46.31.27.36.4933 > 216.219.95.164.47291: UDP, length 81
20:03:20.162758 IP 46.31.27.36.4933 > 216.219.95.164.47291: UDP, length 81
20:03:20.241934 IP 46.31.27.36.4933 > 216.219.95.164.47291: UDP, length 81
20:03:20.444211 IP 46.31.27.36.4933 > 216.219.95.164.47291: UDP, length 81
20:03:20.507004 IP 46.31.27.36.4933 > 216.219.95.164.47291: UDP, length 81
20:03:20.608647 IP 46.31.27.36.4933 > 216.219.95.164.47291: UDP, length 81
20:03:20.615335 IP 46.31.27.36.4933 > 216.219.95.164.47291: UDP, length 81
20:03:20.693038 IP 46.31.27.36.4933 > 216.219.95.164.47291: UDP, length 81
20:03:21.128015 IP 46.31.27.36.4933 > 216.219.95.164.47291: UDP, length 81
20:03:21.128300 IP 46.31.27.36.4933 > 216.219.95.164.47291: UDP, length 81
20:03:21.128549 IP 46.31.27.36.4933 > 216.219.95.164.47291: UDP, length 81
20:03:21.393546 IP 46.31.27.36.4933 > 216.219.95.164.47291: UDP, length 81
20:03:21.393623 IP 46.31.27.36.4933 > 216.219.95.164.47291: UDP, length 81
20:03:21.470659 IP 46.31.27.36.4933 > 216.219.95.164.47291: UDP, length 81
20:03:21.612039 IP 46.31.27.36.4933 > 216.219.95.164.47291: UDP, length 81
20:03:21.626771 IP 46.31.27.36.4933 > 216.219.95.164.47291: UDP, length 81
20:03:21.782203 IP 46.31.27.36.4933 > 216.219.95.164.47291: UDP, length 81
20:03:22.125155 IP 46.31.27.36.4933 > 216.219.95.164.47291: UDP, length 81
20:03:22.140175 IP 46.31.27.36.4933 > 216.219.95.164.47291: UDP, length 81
20:03:22.140512 IP 46.31.27.36.4933 > 216.219.95.164.47291: UDP, length 81
20:03:22.140697 IP 46.31.27.36.4933 > 216.219.95.164.47291: UDP, length 81
20:03:22.404623 IP 46.31.27.36.4933 > 216.219.95.164.47291: UDP, length 81
20:03:22.405279 IP 46.31.27.36.4933 > 216.219.95.164.47291: UDP, length 81
20:03:22.483492 IP 46.31.27.36.4933 > 216.219.95.164.47291: UDP, length 81
20:03:23.139023 IP 46.31.27.36.4933 > 216.219.95.164.47291: UDP, length 81
20:03:23.622259 IP 46.31.27.36.4933 > 216.219.95.164.47291: UDP, length 81
20:03:23.622402 IP 46.31.27.36.4933 > 216.219.95.164.47291: UDP, length 81
20:03:24.150345 IP 46.31.27.36.4933 > 216.219.95.164.47291: UDP, length 81
20:03:24.151087 IP 46.31.27.36.4933 > 216.219.95.164.47291: UDP, length 81
20:03:24.151088 IP 46.31.27.36.4933 > 216.219.95.164.47291: UDP, length 81
20:03:24.166337 IP 46.31.27.36.4933 > 216.219.95.164.47291: UDP, length 81
20:03:24.416355 IP 46.31.27.36.4933 > 216.219.95.164.47291: UDP, length 81
20:03:24.416597 IP 46.31.27.36.4933 > 216.219.95.164.47291: UDP, length 81
20:03:24.493304 IP 46.31.27.36.4933 > 216.219.95.164.47291: UDP, length 81
20:03:25.145685 IP 46.31.27.36.4933 > 216.219.95.164.47291: UDP, length 81
20:03:25.223082 IP 46.31.27.36.4933 > 216.219.95.164.47291: UDP, length 81
20:03:25.656634 IP 46.31.27.36.4933 > 216.219.95.164.47291: UDP, length 81
20:03:25.797632 IP 46.31.27.36.4933 > 216.219.95.164.47291: UDP, length 81
20:03:25.851499 IP 46.31.27.36.4933 > 216.219.95.164.47291: UDP, length 81
20:03:25.862010 IP 46.31.27.36.4933 > 216.219.95.164.47291: UDP, length 97
20:03:25.862012 IP 46.31.27.36.4933 > 216.219.95.164.47291: UDP, length 97
20:03:25.874504 IP 216.219.95.164.47291 > 46.31.27.36.4933: UDP, length 273
20:03:25.877114 IP 216.219.95.164.47291 > 46.31.27.36.4933: UDP, length 225
20:03:25.889597 IP 46.31.27.36.4933 > 216.219.95.164.47291: UDP, length 81
20:03:25.889729 IP 46.31.27.36.4933 > 216.219.95.164.47291: UDP, length 81
20:03:26.154529 IP 46.31.27.36.4933 > 216.219.95.164.47291: UDP, length 81
20:03:26.154678 IP 46.31.27.36.4933 > 216.219.95.164.47291: UDP, length 81
20:03:26.525356 IP 46.31.27.36.4933 > 216.219.95.164.47291: UDP, length 81
20:03:26.807332 IP 46.31.27.36.4933 > 216.219.95.164.47291: UDP, length 81
20:03:26.854156 IP 46.31.27.36.4933 > 216.219.95.164.47291: UDP, length 81
20:03:27.632021 IP 46.31.27.36.4933 > 216.219.95.164.47291: UDP, length 81
20:03:28.155579 IP 46.31.27.36.4933 > 216.219.95.164.47291: UDP, length 81
20:03:28.162186 IP 46.31.27.36.4933 > 216.219.95.164.47291: UDP, length 81
20:03:28.162460 IP 46.31.27.36.4933 > 216.219.95.164.47291: UDP, length 81
20:03:28.162461 IP 46.31.27.36.4933 > 216.219.95.164.47291: UDP, length 81
20:03:28.181387 IP 46.31.27.36.4933 > 216.219.95.164.47291: UDP, length 81
20:03:28.255351 IP 46.31.27.36.4933 > 216.219.95.164.47291: UDP, length 81
20:03:28.255637 IP 46.31.27.36.4933 > 216.219.95.164.47291: UDP, length 97
20:03:28.255638 IP 46.31.27.36.4933 > 216.219.95.164.47291: UDP, length 97
20:03:28.262237 IP 216.219.95.164.47291 > 46.31.27.36.4933: UDP, length 289
20:03:28.264059 IP 216.219.95.164.47291 > 46.31.27.36.4933: UDP, length 241
20:03:28.360512 IP 46.31.27.36.4933 > 216.219.95.164.47291: UDP, length 113
20:03:28.367317 IP 216.219.95.164.47291 > 46.31.27.36.4933: UDP, length 209
20:03:28.427770 IP 46.31.27.36.4933 > 216.219.95.164.47291: UDP, length 81
20:03:28.428447 IP 46.31.27.36.4933 > 216.219.95.164.47291: UDP, length 81
20:03:28.448688 IP 46.31.27.36.4933 > 216.219.95.164.47291: UDP, length 81
20:03:28.451726 IP 46.31.27.36.4933 > 216.219.95.164.47291: UDP, length 81
20:03:28.459206 IP 46.31.27.36.4933 > 216.219.95.164.47291: UDP, length 81
20:03:28.505928 IP 46.31.27.36.4933 > 216.219.95.164.47291: UDP, length 81
20:03:28.521023 IP 46.31.27.36.4933 > 216.219.95.164.47291: UDP, length 81
20:03:28.553776 IP 46.31.27.36.4933 > 216.219.95.164.47291: UDP, length 81
20:03:28.630430 IP 46.31.27.36.4933 > 216.219.95.164.47291: UDP, length 81
20:03:28.708597 IP 46.31.27.36.4933 > 216.219.95.164.47291: UDP, length 81
20:03:28.864126 IP 46.31.27.36.4933 > 216.219.95.164.47291: UDP, length 81
20:03:29.159327 IP 46.31.27.36.4933 > 216.219.95.164.47291: UDP, length 81
20:03:29.198133 IP 46.31.27.36.4933 > 216.219.95.164.47291: UDP, length 113
20:03:29.244178 IP 216.219.95.164.47291 > 46.31.27.36.4933: UDP, length 417
20:03:29.329356 IP 46.31.27.36.4933 > 216.219.95.164.47291: UDP, length 33
20:03:29.406394 IP 46.31.27.36.4933 > 216.219.95.164.47291: UDP, length 81
20:03:29.430753 IP 46.31.27.36.4933 > 216.219.95.164.47291: UDP, length 81
20:03:29.437509 IP 46.31.27.36.4933 > 216.219.95.164.47291: UDP, length 81
20:03:29.453183 IP 46.31.27.36.4933 > 216.219.95.164.47291: UDP, length 81
20:03:29.454029 IP 46.31.27.36.4933 > 216.219.95.164.47291: UDP, length 81
20:03:29.561725 IP 46.31.27.36.4933 > 216.219.95.164.47291: UDP, length 81
20:03:29.639175 IP 46.31.27.36.4933 > 216.219.95.164.47291: UDP, length 81
20:03:29.687670 IP 46.31.27.36.4933 > 216.219.95.164.47291: UDP, length 81
20:03:29.905106 IP 46.31.27.36.4933 > 216.219.95.164.47291: UDP, length 97
20:03:29.909074 IP 216.219.95.164.47291 > 46.31.27.36.4933: UDP, length 113
20:03:30.094435 IP 46.31.27.36.4933 > 216.219.95.164.47291: UDP, length 81
20:03:30.167587 IP 46.31.27.36.4933 > 216.219.95.164.47291: UDP, length 81
20:03:30.431676 IP 46.31.27.36.4933 > 216.219.95.164.47291: UDP, length 81
20:03:30.695259 IP 46.31.27.36.4933 > 216.219.95.164.47291: UDP, length 81
20:03:31.101005 IP 46.31.27.36.4933 > 216.219.95.164.47291: UDP, length 81
20:03:31.177750 IP 46.31.27.36.4933 > 216.219.95.164.47291: UDP, length 81
20:03:31.456362 IP 46.31.27.36.4933 > 216.219.95.164.47291: UDP, length 81
20:03:31.456632 IP 46.31.27.36.4933 > 216.219.95.164.47291: UDP, length 81
20:03:31.564787 IP 46.31.27.36.4933 > 216.219.95.164.47291: UDP, length 81
20:03:31.891646 IP 46.31.27.36.4933 > 216.219.95.164.47291: UDP, length 81
20:03:31.892172 IP 46.31.27.36.4933 > 216.219.95.164.47291: UDP, length 81
20:03:31.906849 IP 46.31.27.36.4933 > 216.219.95.164.47291: UDP, length 81
20:03:31.953727 IP 46.31.27.36.4933 > 216.219.95.164.47291: UDP, length 81
20:03:32.156490 IP 46.31.27.36.4933 > 216.219.95.164.47291: UDP, length 81
20:03:32.156492 IP 46.31.27.36.4933 > 216.219.95.164.47291: UDP, length 81
20:03:32.173641 IP 46.31.27.36.4933 > 216.219.95.164.47291: UDP, length 81
20:03:32.435287 IP 46.31.27.36.4933 > 216.219.95.164.47291: UDP, length 81
20:03:32.528134 IP 46.31.27.36.4933 > 216.219.95.164.47291: UDP, length 81
20:03:32.697881 IP 46.31.27.36.4933 > 216.219.95.164.47291: UDP, length 81
20:03:32.868852 IP 46.31.27.36.4933 > 216.219.95.164.47291: UDP, length 81
20:03:32.900350 IP 46.31.27.36.4933 > 216.219.95.164.47291: UDP, length 81
20:03:32.900354 IP 46.31.27.36.4933 > 216.219.95.164.47291: UDP, length 81
20:03:33.104021 IP 46.31.27.36.4933 > 216.219.95.164.47291: UDP, length 81
20:03:33.165310 IP 46.31.27.36.4933 > 216.219.95.164.47291: UDP, length 81
20:03:33.165881 IP 46.31.27.36.4933 > 216.219.95.164.47291: UDP, length 81
20:03:33.180932 IP 46.31.27.36.4933 > 216.219.95.164.47291: UDP, length 81
20:03:33.230547 IP 46.31.27.36.4933 > 216.219.95.164.47291: UDP, length 81
20:03:33.540454 IP 46.31.27.36.4933 > 216.219.95.164.47291: UDP, length 81
20:03:34.240811 IP 46.31.27.36.4933 > 216.219.95.164.47291: UDP, length 81
20:03:34.474706 IP 46.31.27.36.4933 > 216.219.95.164.47291: UDP, length 81
20:03:34.723264 IP 46.31.27.36.4933 > 216.219.95.164.47291: UDP, length 81
20:03:34.908983 IP 46.31.27.36.4933 > 216.219.95.164.47291: UDP, length 81
20:03:34.909172 IP 46.31.27.36.4933 > 216.219.95.164.47291: UDP, length 81
20:03:35.176486 IP 46.31.27.36.4933 > 216.219.95.164.47291: UDP, length 81
20:03:35.176747 IP 46.31.27.36.4933 > 216.219.95.164.47291: UDP, length 81
20:03:35.458585 IP 46.31.27.36.4933 > 216.219.95.164.47291: UDP, length 81
20:03:35.458802 IP 46.31.27.36.4933 > 216.219.95.164.47291: UDP, length 81
20:03:35.488678 IP 46.31.27.36.4933 > 216.219.95.164.47291: UDP, length 81
20:03:35.552462 IP 46.31.27.36.4933 > 216.219.95.164.47291: UDP, length 81
20:03:35.567806 IP 46.31.27.36.4933 > 216.219.95.164.47291: UDP, length 81
20:03:35.644965 IP 46.31.27.36.4933 > 216.219.95.164.47291: UDP, length 81
20:03:35.691017 IP 46.31.27.36.4933 > 216.219.95.164.47291: UDP, length 97
20:03:35.694647 IP 216.219.95.164.47291 > 46.31.27.36.4933: UDP, length 113
20:03:35.723270 IP 46.31.27.36.4933 > 216.219.95.164.47291: UDP, length 81
20:03:35.882722 IP 46.31.27.36.4933 > 216.219.95.164.47291: UDP, length 81
20:03:35.967958 IP 46.31.27.36.4933 > 216.219.95.164.47291: UDP, length 81
20:03:36.177526 IP 46.31.27.36.4933 > 216.219.95.164.47291: UDP, length 81
20:03:36.177527 IP 46.31.27.36.4933 > 216.219.95.164.47291: UDP, length 81
20:03:36.177758 IP 46.31.27.36.4933 > 216.219.95.164.47291: UDP, length 81
20:03:36.254679 IP 46.31.27.36.4933 > 216.219.95.164.47291: UDP, length 81
20:03:36.428689 IP 46.31.27.36.4933 > 216.219.95.164.47291: UDP, length 81
20:03:36.428875 IP 46.31.27.36.4933 > 216.219.95.164.47291: UDP, length 81
20:03:36.444064 IP 46.31.27.36.4933 > 216.219.95.164.47291: UDP, length 81
20:03:36.522128 IP 46.31.27.36.4933 > 216.219.95.164.47291: UDP, length 81
20:03:36.709977 IP 46.31.27.36.4933 > 216.219.95.164.47291: UDP, length 81
20:03:36.842157 IP 46.31.27.36.4933 > 216.219.95.164.47291: UDP, length 81
20:03:36.882525 IP 46.31.27.36.4933 > 216.219.95.164.47291: UDP, length 81
20:03:37.116331 IP 46.31.27.36.4933 > 216.219.95.164.47291: UDP, length 81
20:03:37.163152 IP 46.31.27.36.4933 > 216.219.95.164.47291: UDP, length 81
20:03:37.194528 IP 46.31.27.36.4933 > 216.219.95.164.47291: UDP, length 81
20:03:37.490537 IP 46.31.27.36.4933 > 216.219.95.164.47291: UDP, length 81
20:03:37.738523 IP 46.31.27.36.4933 > 216.219.95.164.47291: UDP, length 81
20:03:37.848381 IP 46.31.27.36.4933 > 216.219.95.164.47291: UDP, length 81
20:03:38.321238 IP 46.31.27.36.4933 > 216.219.95.164.47291: UDP, length 81
20:03:38.321375 IP 46.31.27.36.4933 > 216.219.95.164.47291: UDP, length 97
20:03:38.322413 IP 46.31.27.36.4933 > 216.219.95.164.47291: UDP, length 97
20:03:38.327387 IP 216.219.95.164.47291 > 46.31.27.36.4933: UDP, length 465
20:03:38.332344 IP 216.219.95.164.47291 > 46.31.27.36.4933: UDP, length 449
20:03:38.898319 IP 46.31.27.36.4933 > 216.219.95.164.47291: UDP, length 81
20:03:38.925385 IP 46.31.27.36.4933 > 216.219.95.164.47291: UDP, length 81
20:03:38.925387 IP 46.31.27.36.4933 > 216.219.95.164.47291: UDP, length 81
20:03:39.182942 IP 46.31.27.36.4933 > 216.219.95.164.47291: UDP, length 81
20:03:39.183324 IP 46.31.27.36.4933 > 216.219.95.164.47291: UDP, length 81
20:03:39.323568 IP 46.31.27.36.4933 > 216.219.95.164.47291: UDP, length 81
20:03:39.339466 IP 46.31.27.36.4933 > 216.219.95.164.47291: UDP, length 33
20:03:39.558039 IP 46.31.27.36.4933 > 216.219.95.164.47291: UDP, length 81
20:03:39.853863 IP 46.31.27.36.4933 > 216.219.95.164.47291: UDP, length 81
20:03:40.260613 IP 46.31.27.36.4933 > 216.219.95.164.47291: UDP, length 81
20:03:40.712998 IP 46.31.27.36.4933 > 216.219.95.164.47291: UDP, length 81
20:03:40.883693 IP 46.31.27.36.4933 > 216.219.95.164.47291: UDP, length 81
20:03:41.336738 IP 46.31.27.36.4933 > 216.219.95.164.47291: UDP, length 81
20:03:41.493187 IP 46.31.27.36.4933 > 216.219.95.164.47291: UDP, length 81
20:03:41.742861 IP 46.31.27.36.4933 > 216.219.95.164.47291: UDP, length 81
20:03:41.962708 IP 46.31.27.36.4933 > 216.219.95.164.47291: UDP, length 81
20:03:42.183290 IP 46.31.27.36.4933 > 216.219.95.164.47291: UDP, length 81
20:03:42.193009 IP 46.31.27.36.4933 > 216.219.95.164.47291: UDP, length 97
20:03:42.196732 IP 216.219.95.164.47291 > 46.31.27.36.4933: UDP, length 113
20:03:42.383464 IP 46.31.27.36.4933 > 216.219.95.164.47291: UDP, length 81
20:03:42.449803 IP 46.31.27.36.4933 > 216.219.95.164.47291: UDP, length 81
20:03:42.542206 IP 46.31.27.36.4933 > 216.219.95.164.47291: UDP, length 81
20:03:42.635969 IP 46.31.27.36.4933 > 216.219.95.164.47291: UDP, length 81
20:03:42.899727 IP 46.31.27.36.4933 > 216.219.95.164.47291: UDP, length 81
20:03:42.978053 IP 46.31.27.36.4933 > 216.219.95.164.47291: UDP, length 81
20:03:43.164646 IP 46.31.27.36.4933 > 216.219.95.164.47291: UDP, length 81
20:03:43.196087 IP 46.31.27.36.4933 > 216.219.95.164.47291: UDP, length 81
20:03:43.233257 IP 46.31.27.36.4933 > 216.219.95.164.47291: UDP, length 81
20:03:43.233337 IP 46.31.27.36.4933 > 216.219.95.164.47291: UDP, length 81
20:03:43.400253 IP 46.31.27.36.4933 > 216.219.95.164.47291: UDP, length 81
20:03:43.459105 IP 46.31.27.36.4933 > 216.219.95.164.47291: UDP, length 81
20:03:43.460166 IP 46.31.27.36.4933 > 216.219.95.164.47291: UDP, length 81
20:03:43.460168 IP 46.31.27.36.4933 > 216.219.95.164.47291: UDP, length 81
20:03:43.490901 IP 46.31.27.36.4933 > 216.219.95.164.47291: UDP, length 81
20:03:43.552729 IP 46.31.27.36.4933 > 216.219.95.164.47291: UDP, length 81
20:03:43.567105 IP 46.31.27.36.4933 > 216.219.95.164.47291: UDP, length 81
20:03:43.644447 IP 46.31.27.36.4933 > 216.219.95.164.47291: UDP, length 81
20:03:43.864423 IP 46.31.27.36.4933 > 216.219.95.164.47291: UDP, length 81
20:03:44.176525 IP 46.31.27.36.4933 > 216.219.95.164.47291: UDP, length 81
20:03:44.235757 IP 46.31.27.36.4933 > 216.219.95.164.47291: UDP, length 81
20:03:44.235761 IP 46.31.27.36.4933 > 216.219.95.164.47291: UDP, length 81
20:03:44.241100 IP 46.31.27.36.4933 > 216.219.95.164.47291: UDP, length 1297
20:03:44.241104 IP 46.31.27.36.4933 > 216.219.95.164.47291: UDP, length 1297
20:03:44.241105 IP 46.31.27.36.4933 > 216.219.95.164.47291: UDP, length 129
20:03:44.241106 IP 46.31.27.36.4933 > 216.219.95.164.47291: UDP, length 81
20:03:44.452616 IP 46.31.27.36.4933 > 216.219.95.164.47291: UDP, length 81
20:03:44.499784 IP 46.31.27.36.4933 > 216.219.95.164.47291: UDP, length 81
20:03:44.499786 IP 46.31.27.36.4933 > 216.219.95.164.47291: UDP, length 81
20:03:44.546572 IP 46.31.27.36.4933 > 216.219.95.164.47291: UDP, length 1297
20:03:44.546799 IP 46.31.27.36.4933 > 216.219.95.164.47291: UDP, length 1297
20:03:44.717999 IP 46.31.27.36.4933 > 216.219.95.164.47291: UDP, length 81
20:03:44.983727 IP 46.31.27.36.4933 > 216.219.95.164.47291: UDP, length 81
20:03:45.124630 IP 46.31.27.36.4933 > 216.219.95.164.47291: UDP, length 81
20:03:45.155132 IP 46.31.27.36.4933 > 216.219.95.164.47291: UDP, length 1297
20:03:45.202817 IP 46.31.27.36.4933 > 216.219.95.164.47291: UDP, length 81
20:03:45.203100 IP 46.31.27.36.4933 > 216.219.95.164.47291: UDP, length 81
20:03:45.247825 IP 46.31.27.36.4933 > 216.219.95.164.47291: UDP, length 81
20:03:45.339567 IP 46.31.27.36.4933 > 216.219.95.164.47291: UDP, length 81
20:03:45.403186 IP 46.31.27.36.4933 > 216.219.95.164.47291: UDP, length 81
20:03:45.465434 IP 46.31.27.36.4933 > 216.219.95.164.47291: UDP, length 81
20:03:45.511440 IP 46.31.27.36.4933 > 216.219.95.164.47291: UDP, length 81
20:03:45.557875 IP 46.31.27.36.4933 > 216.219.95.164.47291: UDP, length 81
20:03:45.651362 IP 46.31.27.36.4933 > 216.219.95.164.47291: UDP, length 81
20:03:45.698653 IP 46.31.27.36.4933 > 216.219.95.164.47291: UDP, length 81
20:03:46.178120 IP 46.31.27.36.4933 > 216.219.95.164.47291: UDP, length 81
20:03:46.239507 IP 46.31.27.36.4933 > 216.219.95.164.47291: UDP, length 81
20:03:46.239672 IP 46.31.27.36.4933 > 216.219.95.164.47291: UDP, length 81
20:03:46.365279 IP 46.31.27.36.4933 > 216.219.95.164.47291: UDP, length 1297
20:03:46.503872 IP 46.31.27.36.4933 > 216.219.95.164.47291: UDP, length 81
20:03:46.923160 IP 46.31.27.36.4933 > 216.219.95.164.47291: UDP, length 81
20:03:46.923272 IP 46.31.27.36.4933 > 216.219.95.164.47291: UDP, length 81
20:03:47.186550 IP 46.31.27.36.4933 > 216.219.95.164.47291: UDP, length 81
20:03:47.186713 IP 46.31.27.36.4933 > 216.219.95.164.47291: UDP, length 81
20:03:47.249426 IP 46.31.27.36.4933 > 216.219.95.164.47291: UDP, length 81
20:03:47.513839 IP 46.31.27.36.4933 > 216.219.95.164.47291: UDP, length 81
20:03:47.560703 IP 46.31.27.36.4933 > 216.219.95.164.47291: UDP, length 81
20:03:48.218145 IP 46.31.27.36.4933 > 216.219.95.164.47291: UDP, length 81
20:03:48.244699 IP 46.31.27.36.4933 > 216.219.95.164.47291: UDP, length 1297
20:03:48.275434 IP 46.31.27.36.4933 > 216.219.95.164.47291: UDP, length 81
20:03:48.361752 IP 46.31.27.36.4933 > 216.219.95.164.47291: UDP, length 113
20:03:48.371848 IP 216.219.95.164.47291 > 46.31.27.36.4933: UDP, length 209
20:03:48.558532 IP 46.31.27.36.4933 > 216.219.95.164.47291: UDP, length 81
20:03:48.990121 IP 46.31.27.36.4933 > 216.219.95.164.47291: UDP, length 81
20:03:49.208239 IP 46.31.27.36.4933 > 216.219.95.164.47291: UDP, length 81
20:03:49.223680 IP 46.31.27.36.4933 > 216.219.95.164.47291: UDP, length 81
20:03:49.348424 IP 46.31.27.36.4933 > 216.219.95.164.47291: UDP, length 33
20:03:49.410691 IP 46.31.27.36.4933 > 216.219.95.164.47291: UDP, length 81
20:03:49.473921 IP 46.31.27.36.4933 > 216.219.95.164.47291: UDP, length 81
20:03:49.473923 IP 46.31.27.36.4933 > 216.219.95.164.47291: UDP, length 81
20:03:49.473925 IP 46.31.27.36.4933 > 216.219.95.164.47291: UDP, length 81
20:03:49.505096 IP 46.31.27.36.4933 > 216.219.95.164.47291: UDP, length 81
20:03:49.567880 IP 46.31.27.36.4933 > 216.219.95.164.47291: UDP, length 81
20:03:49.568021 IP 46.31.27.36.4933 > 216.219.95.164.47291: UDP, length 81
20:03:49.661814 IP 46.31.27.36.4933 > 216.219.95.164.47291: UDP, length 81
20:03:49.754130 IP 46.31.27.36.4933 > 216.219.95.164.47291: UDP, length 81
20:03:50.191156 IP 46.31.27.36.4933 > 216.219.95.164.47291: UDP, length 81
20:03:50.255059 IP 46.31.27.36.4933 > 216.219.95.164.47291: UDP, length 81
20:03:50.255158 IP 46.31.27.36.4933 > 216.219.95.164.47291: UDP, length 81
20:03:50.472873 IP 46.31.27.36.4933 > 216.219.95.164.47291: UDP, length 81
20:03:50.472875 IP 46.31.27.36.4933 > 216.219.95.164.47291: UDP, length 81
20:03:50.518529 IP 46.31.27.36.4933 > 216.219.95.164.47291: UDP, length 81
20:03:50.613770 IP 46.31.27.36.4933 > 216.219.95.164.47291: UDP, length 97
20:03:50.660689 IP 46.31.27.36.4933 > 216.219.95.164.47291: UDP, length 81
20:03:50.706006 IP 46.31.27.36.4933 > 216.219.95.164.47291: UDP, length 81
20:03:50.908697 IP 46.31.27.36.4933 > 216.219.95.164.47291: UDP, length 81
20:03:51.202474 IP 216.219.95.164.47291 > 46.31.27.36.4933: UDP, length 161
20:03:51.202906 IP 216.219.95.164.47291 > 46.31.27.36.4933: UDP, length 97
20:03:51.233899 IP 46.31.27.36.4933 > 216.219.95.164.47291: UDP, length 81
20:03:51.264766 IP 46.31.27.36.4933 > 216.219.95.164.47291: UDP, length 81
20:03:51.389318 IP 46.31.27.36.4933 > 216.219.95.164.47291: UDP, length 81
20:03:51.390228 IP 46.31.27.36.4933 > 216.219.95.164.47291: UDP, length 81
20:03:51.394225 IP 216.219.95.164.47291 > 46.31.27.36.4933: UDP, length 193
20:03:51.514077 IP 46.31.27.36.4933 > 216.219.95.164.47291: UDP, length 81
20:03:51.577319 IP 46.31.27.36.4933 > 216.219.95.164.47291: UDP, length 81
20:03:51.580848 IP 46.31.27.36.4933 > 216.219.95.164.47291: UDP, length 81
20:03:51.875272 IP 46.31.27.36.4933 > 216.219.95.164.47291: UDP, length 81
20:03:52.400352 IP 46.31.27.36.4933 > 216.219.95.164.47291: UDP, length 81
20:03:52.477350 IP 46.31.27.36.4933 > 216.219.95.164.47291: UDP, length 81
20:03:52.477352 IP 46.31.27.36.4933 > 216.219.95.164.47291: UDP, length 81
20:03:52.586131 IP 46.31.27.36.4933 > 216.219.95.164.47291: UDP, length 81
20:03:53.346561 IP 46.31.27.36.4933 > 216.219.95.164.47291: UDP, length 81
20:03:53.612444 IP 46.31.27.36.4933 > 216.219.95.164.47291: UDP, length 785
20:03:53.613677 IP 46.31.27.36.4933 > 216.219.95.164.47291: UDP, length 97
20:03:53.877663 IP 46.31.27.36.4933 > 216.219.95.164.47291: UDP, length 97
20:03:54.143211 IP 46.31.27.36.4933 > 216.219.95.164.47291: UDP, length 97
20:03:54.404895 IP 46.31.27.36.4933 > 216.219.95.164.47291: UDP, length 81
20:03:54.407624 IP 46.31.27.36.4933 > 216.219.95.164.47291: UDP, length 833
20:03:54.409285 IP 46.31.27.36.4933 > 216.219.95.164.47291: UDP, length 785
20:03:54.592800 IP 46.31.27.36.4933 > 216.219.95.164.47291: UDP, length 81
20:03:55.241117 IP 46.31.27.36.4933 > 216.219.95.164.47291: UDP, length 81
20:03:55.507525 IP 46.31.27.36.4933 > 216.219.95.164.47291: UDP, length 81
20:03:55.584832 IP 46.31.27.36.4933 > 216.219.95.164.47291: UDP, length 81
20:03:55.758637 IP 46.31.27.36.4933 > 216.219.95.164.47291: UDP, length 81
20:03:55.986194 IP 46.31.27.36.4933 > 216.219.95.164.47291: UDP, length 81
20:03:56.012926 IP 46.31.27.36.4933 > 216.219.95.164.47291: UDP, length 81
20:03:56.486394 IP 46.31.27.36.4933 > 216.219.95.164.47291: UDP, length 81
20:03:56.486829 IP 46.31.27.36.4933 > 216.219.95.164.47291: UDP, length 81
20:03:56.507291 IP 46.31.27.36.4933 > 216.219.95.164.47291: UDP, length 81
20:03:56.518119 IP 46.31.27.36.4933 > 216.219.95.164.47291: UDP, length 81
20:03:56.768010 IP 46.31.27.36.4933 > 216.219.95.164.47291: UDP, length 81
20:03:56.809053 IP 46.31.27.36.4933 > 216.219.95.164.47291: UDP, length 81
20:03:57.002660 IP 46.31.27.36.4933 > 216.219.95.164.47291: UDP, length 81
20:03:57.065288 IP 46.31.27.36.4933 > 216.219.95.164.47291: UDP, length 81
20:03:57.208521 IP 46.31.27.36.4933 > 216.219.95.164.47291: UDP, length 81
20:03:57.220569 IP 46.31.27.36.4933 > 216.219.95.164.47291: UDP, length 81
20:03:57.256437 IP 46.31.27.36.4933 > 216.219.95.164.47291: UDP, length 81
20:03:57.266257 IP 46.31.27.36.4933 > 216.219.95.164.47291: UDP, length 81
20:03:57.420181 IP 46.31.27.36.4933 > 216.219.95.164.47291: UDP, length 81
20:03:57.466402 IP 46.31.27.36.4933 > 216.219.95.164.47291: UDP, length 81
20:03:57.483055 IP 46.31.27.36.4933 > 216.219.95.164.47291: UDP, length 81
20:03:57.512923 IP 46.31.27.36.4933 > 216.219.95.164.47291: UDP, length 81
20:03:57.573862 IP 46.31.27.36.4933 > 216.219.95.164.47291: UDP, length 81
20:03:57.668477 IP 46.31.27.36.4933 > 216.219.95.164.47291: UDP, length 81
20:03:57.810688 IP 46.31.27.36.4933 > 216.219.95.164.47291: UDP, length 81
20:03:58.075781 IP 46.31.27.36.4933 > 216.219.95.164.47291: UDP, length 81
20:03:58.201351 IP 46.31.27.36.4933 > 216.219.95.164.47291: UDP, length 81
20:03:58.216612 IP 46.31.27.36.4933 > 216.219.95.164.47291: UDP, length 81
20:03:58.262974 IP 46.31.27.36.4933 > 216.219.95.164.47291: UDP, length 81
20:03:58.262978 IP 46.31.27.36.4933 > 216.219.95.164.47291: UDP, length 81
20:03:58.417871 IP 46.31.27.36.4933 > 216.219.95.164.47291: UDP, length 81
20:03:58.478510 IP 46.31.27.36.4933 > 216.219.95.164.47291: UDP, length 81
20:03:58.527103 IP 46.31.27.36.4933 > 216.219.95.164.47291: UDP, length 81
20:03:58.527105 IP 46.31.27.36.4933 > 216.219.95.164.47291: UDP, length 81
20:03:58.605106 IP 46.31.27.36.4933 > 216.219.95.164.47291: UDP, length 81
20:03:58.776428 IP 46.31.27.36.4933 > 216.219.95.164.47291: UDP, length 81
20:03:59.270979 IP 46.31.27.36.4933 > 216.219.95.164.47291: UDP, length 81
20:03:59.349033 IP 46.31.27.36.4933 > 216.219.95.164.47291: UDP, length 33
20:03:59.519528 IP 46.31.27.36.4933 > 216.219.95.164.47291: UDP, length 81
20:03:59.519604 IP 46.31.27.36.4933 > 216.219.95.164.47291: UDP, length 81
20:03:59.754887 IP 46.31.27.36.4933 > 216.219.95.164.47291: UDP, length 81
20:03:59.770090 IP 46.31.27.36.4933 > 216.219.95.164.47291: UDP, length 81
20:03:59.817181 IP 46.31.27.36.4933 > 216.219.95.164.47291: UDP, length 81
20:04:00.081820 IP 46.31.27.36.4933 > 216.219.95.164.47291: UDP, length 81
20:04:00.221890 IP 46.31.27.36.4933 > 216.219.95.164.47291: UDP, length 81
20:04:00.485121 IP 46.31.27.36.4933 > 216.219.95.164.47291: UDP, length 81
20:04:01.643123 IP 46.31.27.36.4933 > 216.219.95.164.47291: UDP, length 81
20:04:01.643266 IP 46.31.27.36.4933 > 216.219.95.164.47291: UDP, length 97
20:04:01.643267 IP 46.31.27.36.4933 > 216.219.95.164.47291: UDP, length 97
20:04:01.667903 IP 216.219.95.164.47291 > 46.31.27.36.4933: UDP, length 273
20:04:01.668891 IP 216.219.95.164.47291 > 46.31.27.36.4933: UDP, length 225
20:04:01.675400 IP 46.31.27.36.4933 > 216.219.95.164.47291: UDP, length 81
20:04:01.933501 IP 46.31.27.36.4933 > 216.219.95.164.47291: UDP, length 81
20:04:02.539976 IP 46.31.27.36.4933 > 216.219.95.164.47291: UDP, length 81
20:04:02.647201 IP 46.31.27.36.4933 > 216.219.95.164.47291: UDP, length 81
20:04:02.678314 IP 46.31.27.36.4933 > 216.219.95.164.47291: UDP, length 81
20:04:02.784468 IP 46.31.27.36.4933 > 216.219.95.164.47291: UDP, length 81
20:04:02.939675 IP 46.31.27.36.4933 > 216.219.95.164.47291: UDP, length 81
20:04:03.017303 IP 46.31.27.36.4933 > 216.219.95.164.47291: UDP, length 81
20:04:03.234519 IP 46.31.27.36.4933 > 216.219.95.164.47291: UDP, length 81
20:04:03.248582 IP 46.31.27.36.4933 > 216.219.95.164.47291: UDP, length 81
20:04:03.483747 IP 46.31.27.36.4933 > 216.219.95.164.47291: UDP, length 81
20:04:03.529330 IP 46.31.27.36.4933 > 216.219.95.164.47291: UDP, length 81
20:04:03.592866 IP 46.31.27.36.4933 > 216.219.95.164.47291: UDP, length 81
20:04:03.592869 IP 46.31.27.36.4933 > 216.219.95.164.47291: UDP, length 81
20:04:03.788283 IP 46.31.27.36.4933 > 216.219.95.164.47291: UDP, length 97
20:04:03.788342 IP 46.31.27.36.4933 > 216.219.95.164.47291: UDP, length 97
20:04:03.824727 IP 46.31.27.36.4933 > 216.219.95.164.47291: UDP, length 81
20:04:04.027712 IP 46.31.27.36.4933 > 216.219.95.164.47291: UDP, length 81
20:04:04.088415 IP 46.31.27.36.4933 > 216.219.95.164.47291: UDP, length 81
20:04:04.207746 IP 216.219.95.164.47291 > 46.31.27.36.4933: UDP, length 241
20:04:04.207918 IP 216.219.95.164.47291 > 46.31.27.36.4933: UDP, length 241
20:04:04.228348 IP 46.31.27.36.4933 > 216.219.95.164.47291: UDP, length 81
20:04:04.244658 IP 46.31.27.36.4933 > 216.219.95.164.47291: UDP, length 81
20:04:04.276720 IP 46.31.27.36.4933 > 216.219.95.164.47291: UDP, length 81
20:04:04.276722 IP 46.31.27.36.4933 > 216.219.95.164.47291: UDP, length 81
20:04:04.394592 IP 46.31.27.36.4933 > 216.219.95.164.47291: UDP, length 81
20:04:04.394737 IP 46.31.27.36.4933 > 216.219.95.164.47291: UDP, length 81
20:04:04.394773 IP 46.31.27.36.4933 > 216.219.95.164.47291: UDP, length 81
20:04:04.493284 IP 46.31.27.36.4933 > 216.219.95.164.47291: UDP, length 81
20:04:04.493721 IP 46.31.27.36.4933 > 216.219.95.164.47291: UDP, length 81
20:04:04.539227 IP 46.31.27.36.4933 > 216.219.95.164.47291: UDP, length 81
20:04:04.600238 IP 46.31.27.36.4933 > 216.219.95.164.47291: UDP, length 81
20:04:04.662476 IP 46.31.27.36.4933 > 216.219.95.164.47291: UDP, length 81
20:04:04.693320 IP 46.31.27.36.4933 > 216.219.95.164.47291: UDP, length 81

691 packets captured
691 packets received by filter
0 packets dropped by kernel
