dropped privs to tcpdump
tcpdump: verbose output suppressed, use -v[v]... for full protocol decode
listening on eth0, link-type EN10MB (Ethernet), snapshot length 262144 bytes
17:14:27.944838 IP 46.31.27.36.22772 > 216.219.95.164.47291: UDP, length 97
17:14:27.945935 IP 46.31.27.36.22772 > 216.219.95.164.47291: UDP, length 129
17:14:27.945967 IP 46.31.27.36.22772 > 216.219.95.164.47291: UDP, length 129
17:14:27.946190 IP 46.31.27.36.22772 > 216.219.95.164.47291: UDP, length 129
17:14:27.946210 IP 46.31.27.36.22772 > 216.219.95.164.47291: UDP, length 81
17:14:27.946217 IP 46.31.27.36.22772 > 216.219.95.164.47291: UDP, length 113
17:14:27.946229 IP 46.31.27.36.22772 > 216.219.95.164.47291: UDP, length 129
17:14:27.946243 IP 46.31.27.36.22772 > 216.219.95.164.47291: UDP, length 129
17:14:27.946464 IP 46.31.27.36.22772 > 216.219.95.164.47291: UDP, length 129
17:14:27.946663 IP 46.31.27.36.22772 > 216.219.95.164.47291: UDP, length 81
17:14:27.946676 IP 46.31.27.36.22772 > 216.219.95.164.47291: UDP, length 113
17:14:27.946713 IP 46.31.27.36.22772 > 216.219.95.164.47291: UDP, length 129
17:14:27.946735 IP 46.31.27.36.22772 > 216.219.95.164.47291: UDP, length 129
17:14:27.946756 IP 46.31.27.36.22772 > 216.219.95.164.47291: UDP, length 129
17:14:27.946856 IP 46.31.27.36.22772 > 216.219.95.164.47291: UDP, length 81
17:14:27.946876 IP 46.31.27.36.22772 > 216.219.95.164.47291: UDP, length 81
17:14:27.946911 IP 46.31.27.36.22772 > 216.219.95.164.47291: UDP, length 113
17:14:27.946919 IP 46.31.27.36.22772 > 216.219.95.164.47291: UDP, length 129
17:14:27.946927 IP 46.31.27.36.22772 > 216.219.95.164.47291: UDP, length 129
17:14:27.946941 IP 46.31.27.36.22772 > 216.219.95.164.47291: UDP, length 129
17:14:27.946977 IP 46.31.27.36.22772 > 216.219.95.164.47291: UDP, length 81
17:14:27.946978 IP 46.31.27.36.22772 > 216.219.95.164.47291: UDP, length 81
17:14:27.946993 IP 46.31.27.36.22772 > 216.219.95.164.47291: UDP, length 97
17:14:27.947016 IP 46.31.27.36.22772 > 216.219.95.164.47291: UDP, length 81
17:14:27.947030 IP 46.31.27.36.22772 > 216.219.95.164.47291: UDP, length 97
17:14:27.947200 IP 46.31.27.36.22772 > 216.219.95.164.47291: UDP, length 113
17:14:27.947217 IP 46.31.27.36.22772 > 216.219.95.164.47291: UDP, length 97
17:14:27.947241 IP 46.31.27.36.22772 > 216.219.95.164.47291: UDP, length 81
17:14:27.947256 IP 46.31.27.36.22772 > 216.219.95.164.47291: UDP, length 97
17:14:27.947273 IP 46.31.27.36.22772 > 216.219.95.164.47291: UDP, length 81
17:14:27.947289 IP 46.31.27.36.22772 > 216.219.95.164.47291: UDP, length 97
17:14:27.973429 IP 46.31.27.36.22772 > 216.219.95.164.47291: UDP, length 113
17:14:28.036573 IP 216.219.95.164.47291 > 46.31.27.36.22772: UDP, length 305
17:14:28.057204 IP 216.219.95.164.47291 > 46.31.27.36.22772: UDP, length 97
17:14:28.061863 IP 216.219.95.164.47291 > 46.31.27.36.22772: UDP, length 209
17:14:28.066416 IP 216.219.95.164.47291 > 46.31.27.36.22772: UDP, length 97
17:14:28.068994 IP 216.219.95.164.47291 > 46.31.27.36.22772: UDP, length 209
17:14:28.072475 IP 216.219.95.164.47291 > 46.31.27.36.22772: UDP, length 129
17:14:28.076184 IP 216.219.95.164.47291 > 46.31.27.36.22772: UDP, length 97
17:14:28.078530 IP 216.219.95.164.47291 > 46.31.27.36.22772: UDP, length 209
17:14:28.082568 IP 216.219.95.164.47291 > 46.31.27.36.22772: UDP, length 129
17:14:28.084994 IP 216.219.95.164.47291 > 46.31.27.36.22772: UDP, length 129
17:14:28.087688 IP 216.219.95.164.47291 > 46.31.27.36.22772: UDP, length 305
17:14:28.090232 IP 216.219.95.164.47291 > 46.31.27.36.22772: UDP, length 97
17:14:28.093025 IP 216.219.95.164.47291 > 46.31.27.36.22772: UDP, length 161
17:14:28.095975 IP 216.219.95.164.47291 > 46.31.27.36.22772: UDP, length 209
17:14:28.097545 IP 216.219.95.164.47291 > 46.31.27.36.22772: UDP, length 161
17:14:28.100094 IP 216.219.95.164.47291 > 46.31.27.36.22772: UDP, length 129
17:14:28.102406 IP 216.219.95.164.47291 > 46.31.27.36.22772: UDP, length 161
17:14:28.104216 IP 216.219.95.164.47291 > 46.31.27.36.22772: UDP, length 97
17:14:28.107224 IP 216.219.95.164.47291 > 46.31.27.36.22772: UDP, length 161
17:14:28.109587 IP 216.219.95.164.47291 > 46.31.27.36.22772: UDP, length 209
17:14:28.219225 IP 46.31.27.36.22772 > 216.219.95.164.47291: UDP, length 97
17:14:28.223173 IP 216.219.95.164.47291 > 46.31.27.36.22772: UDP, length 241
17:14:28.233002 IP 46.31.27.36.22772 > 216.219.95.164.47291: UDP, length 81
17:14:28.244880 IP 46.31.27.36.22772 > 216.219.95.164.47291: UDP, length 81
17:14:28.265039 IP 46.31.27.36.22772 > 216.219.95.164.47291: UDP, length 81
17:14:28.270719 IP 216.219.95.164.47291 > 46.31.27.36.22772: UDP, length 81
17:14:28.280969 IP 216.219.95.164.47291 > 46.31.27.36.22772: UDP, length 81
17:14:28.290048 IP 216.219.95.164.47291 > 46.31.27.36.22772: UDP, length 81
17:14:28.395739 IP 46.31.27.36.22772 > 216.219.95.164.47291: UDP, length 81
17:14:28.441859 IP 46.31.27.36.22772 > 216.219.95.164.47291: UDP, length 65
17:14:28.442800 IP 46.31.27.36.22772 > 216.219.95.164.47291: UDP, length 289
17:14:28.446371 IP 216.219.95.164.47291 > 46.31.27.36.22772: UDP, length 65
17:14:28.449809 IP 216.219.95.164.47291 > 46.31.27.36.22772: UDP, length 65
17:14:28.451218 IP 46.31.27.36.22772 > 216.219.95.164.47291: UDP, length 65
17:14:28.452330 IP 46.31.27.36.22772 > 216.219.95.164.47291: UDP, length 1329
17:14:28.452384 IP 46.31.27.36.22772 > 216.219.95.164.47291: UDP, length 577
17:14:28.458759 IP 216.219.95.164.47291 > 46.31.27.36.22772: UDP, length 65
17:14:28.459996 IP 216.219.95.164.47291 > 46.31.27.36.22772: UDP, length 65
17:14:28.460324 IP 46.31.27.36.22772 > 216.219.95.164.47291: UDP, length 65
17:14:28.461234 IP 46.31.27.36.22772 > 216.219.95.164.47291: UDP, length 241
17:14:28.462021 IP 216.219.95.164.47291 > 46.31.27.36.22772: UDP, length 65
17:14:28.471557 IP 216.219.95.164.47291 > 46.31.27.36.22772: UDP, length 81
17:14:28.630336 IP 46.31.27.36.22772 > 216.219.95.164.47291: UDP, length 81
17:14:28.638468 IP 216.219.95.164.47291 > 46.31.27.36.22772: UDP, length 81
17:14:28.642133 IP 46.31.27.36.22772 > 216.219.95.164.47291: UDP, length 65
17:14:28.642169 IP 46.31.27.36.22772 > 216.219.95.164.47291: UDP, length 225
17:14:28.721926 IP 216.219.95.164.47291 > 46.31.27.36.22772: UDP, length 65
17:14:28.725183 IP 216.219.95.164.47291 > 46.31.27.36.22772: UDP, length 65
17:14:28.809240 IP 46.31.27.36.22772 > 216.219.95.164.47291: UDP, length 65
17:14:28.810022 IP 46.31.27.36.22772 > 216.219.95.164.47291: UDP, length 1329
17:14:28.810023 IP 46.31.27.36.22772 > 216.219.95.164.47291: UDP, length 513
17:14:28.816869 IP 216.219.95.164.47291 > 46.31.27.36.22772: UDP, length 65
17:14:28.817213 IP 216.219.95.164.47291 > 46.31.27.36.22772: UDP, length 65
17:14:28.818412 IP 216.219.95.164.47291 > 46.31.27.36.22772: UDP, length 65
17:14:28.956689 IP 46.31.27.36.22772 > 216.219.95.164.47291: UDP, length 241
17:14:29.194326 IP 46.31.27.36.22772 > 216.219.95.164.47291: UDP, length 81
17:14:29.197762 IP 216.219.95.164.47291 > 46.31.27.36.22772: UDP, length 129
17:14:29.368894 IP 46.31.27.36.22772 > 216.219.95.164.47291: UDP, length 81
17:14:29.370535 IP 46.31.27.36.22772 > 216.219.95.164.47291: UDP, length 81
17:14:29.372932 IP 216.219.95.164.47291 > 46.31.27.36.22772: UDP, length 257
17:14:29.395779 IP 46.31.27.36.22772 > 216.219.95.164.47291: UDP, length 193
17:14:29.425861 IP 216.219.95.164.47291 > 46.31.27.36.22772: UDP, length 81
17:14:29.547295 IP 46.31.27.36.22772 > 216.219.95.164.47291: UDP, length 81
17:14:29.550440 IP 216.219.95.164.47291 > 46.31.27.36.22772: UDP, length 81
17:14:29.596543 IP 46.31.27.36.22772 > 216.219.95.164.47291: UDP, length 65
17:14:29.597327 IP 46.31.27.36.22772 > 216.219.95.164.47291: UDP, length 1329
17:14:29.597793 IP 46.31.27.36.22772 > 216.219.95.164.47291: UDP, length 689
17:14:29.613465 IP 46.31.27.36.22772 > 216.219.95.164.47291: UDP, length 241
17:14:29.650802 IP 216.219.95.164.47291 > 46.31.27.36.22772: UDP, length 65
17:14:29.652030 IP 216.219.95.164.47291 > 46.31.27.36.22772: UDP, length 65
17:14:29.652094 IP 216.219.95.164.47291 > 46.31.27.36.22772: UDP, length 65
17:14:29.720930 IP 46.31.27.36.22772 > 216.219.95.164.47291: UDP, length 65
17:14:29.721024 IP 46.31.27.36.22772 > 216.219.95.164.47291: UDP, length 161
17:14:29.725382 IP 216.219.95.164.47291 > 46.31.27.36.22772: UDP, length 65
17:14:29.725446 IP 216.219.95.164.47291 > 46.31.27.36.22772: UDP, length 65
17:14:29.846604 IP 46.31.27.36.22772 > 216.219.95.164.47291: UDP, length 81
17:14:29.901203 IP 216.219.95.164.47291 > 46.31.27.36.22772: UDP, length 81
17:14:30.071970 IP 46.31.27.36.22772 > 216.219.95.164.47291: UDP, length 65
17:14:30.072719 IP 46.31.27.36.22772 > 216.219.95.164.47291: UDP, length 1329
17:14:30.072720 IP 46.31.27.36.22772 > 216.219.95.164.47291: UDP, length 593
17:14:30.126345 IP 216.219.95.164.47291 > 46.31.27.36.22772: UDP, length 65
17:14:30.126411 IP 216.219.95.164.47291 > 46.31.27.36.22772: UDP, length 65
17:14:30.130002 IP 216.219.95.164.47291 > 46.31.27.36.22772: UDP, length 65
17:14:30.793080 IP 46.31.27.36.22772 > 216.219.95.164.47291: UDP, length 241
17:14:31.024650 IP 46.31.27.36.22772 > 216.219.95.164.47291: UDP, length 81
17:14:31.034677 IP 216.219.95.164.47291 > 46.31.27.36.22772: UDP, length 81
17:14:31.205939 IP 46.31.27.36.22772 > 216.219.95.164.47291: UDP, length 65
17:14:31.207054 IP 46.31.27.36.22772 > 216.219.95.164.47291: UDP, length 241
17:14:31.626228 IP 46.31.27.36.22772 > 216.219.95.164.47291: UDP, length 81
17:14:31.628726 IP 216.219.95.164.47291 > 46.31.27.36.22772: UDP, length 81
17:14:31.680481 IP 46.31.27.36.22772 > 216.219.95.164.47291: UDP, length 241
17:14:31.799287 IP 46.31.27.36.22772 > 216.219.95.164.47291: UDP, length 65
17:14:31.800728 IP 46.31.27.36.22772 > 216.219.95.164.47291: UDP, length 289
17:14:31.806546 IP 216.219.95.164.47291 > 46.31.27.36.22772: UDP, length 65
17:14:31.806629 IP 216.219.95.164.47291 > 46.31.27.36.22772: UDP, length 65
17:14:32.181753 IP 46.31.27.36.22772 > 216.219.95.164.47291: UDP, length 81
17:14:32.235973 IP 216.219.95.164.47291 > 46.31.27.36.22772: UDP, length 81
17:14:32.295833 IP 46.31.27.36.22772 > 216.219.95.164.47291: UDP, length 241
17:14:32.395591 IP 46.31.27.36.22772 > 216.219.95.164.47291: UDP, length 193
17:14:32.407363 IP 46.31.27.36.22772 > 216.219.95.164.47291: UDP, length 65
17:14:32.408962 IP 46.31.27.36.22772 > 216.219.95.164.47291: UDP, length 1329
17:14:32.408973 IP 46.31.27.36.22772 > 216.219.95.164.47291: UDP, length 513
17:14:32.461456 IP 216.219.95.164.47291 > 46.31.27.36.22772: UDP, length 65
17:14:32.462874 IP 216.219.95.164.47291 > 46.31.27.36.22772: UDP, length 65
17:14:32.462968 IP 216.219.95.164.47291 > 46.31.27.36.22772: UDP, length 65
17:14:32.646350 IP 46.31.27.36.22772 > 216.219.95.164.47291: UDP, length 81
17:14:32.700277 IP 216.219.95.164.47291 > 46.31.27.36.22772: UDP, length 81
17:14:32.870671 IP 46.31.27.36.22772 > 216.219.95.164.47291: UDP, length 65
17:14:32.871846 IP 46.31.27.36.22772 > 216.219.95.164.47291: UDP, length 1329
17:14:32.871847 IP 46.31.27.36.22772 > 216.219.95.164.47291: UDP, length 609
17:14:32.924678 IP 216.219.95.164.47291 > 46.31.27.36.22772: UDP, length 65
17:14:32.928097 IP 216.219.95.164.47291 > 46.31.27.36.22772: UDP, length 65
17:14:32.930484 IP 216.219.95.164.47291 > 46.31.27.36.22772: UDP, length 65
17:14:33.156770 IP 46.31.27.36.22772 > 216.219.95.164.47291: UDP, length 241
17:14:33.390087 IP 46.31.27.36.22772 > 216.219.95.164.47291: UDP, length 241
17:14:34.115848 IP 46.31.27.36.22772 > 216.219.95.164.47291: UDP, length 81
17:14:34.119469 IP 216.219.95.164.47291 > 46.31.27.36.22772: UDP, length 97
17:14:34.292333 IP 46.31.27.36.22772 > 216.219.95.164.47291: UDP, length 81
17:14:34.326082 IP 216.219.95.164.47291 > 46.31.27.36.22772: UDP, length 81
17:14:34.498897 IP 46.31.27.36.22772 > 216.219.95.164.47291: UDP, length 65
17:14:34.500767 IP 46.31.27.36.22772 > 216.219.95.164.47291: UDP, length 1329
17:14:34.500788 IP 46.31.27.36.22772 > 216.219.95.164.47291: UDP, length 561
17:14:34.503293 IP 216.219.95.164.47291 > 46.31.27.36.22772: UDP, length 65
17:14:34.504676 IP 216.219.95.164.47291 > 46.31.27.36.22772: UDP, length 65
17:14:34.504730 IP 216.219.95.164.47291 > 46.31.27.36.22772: UDP, length 65
17:14:34.675575 IP 46.31.27.36.22772 > 216.219.95.164.47291: UDP, length 81
17:14:34.678777 IP 216.219.95.164.47291 > 46.31.27.36.22772: UDP, length 81
17:14:34.851415 IP 46.31.27.36.22772 > 216.219.95.164.47291: UDP, length 65
17:14:34.851505 IP 46.31.27.36.22772 > 216.219.95.164.47291: UDP, length 1329
17:14:34.851507 IP 46.31.27.36.22772 > 216.219.95.164.47291: UDP, length 529
17:14:34.855661 IP 216.219.95.164.47291 > 46.31.27.36.22772: UDP, length 65
17:14:34.855758 IP 216.219.95.164.47291 > 46.31.27.36.22772: UDP, length 65
17:14:34.855810 IP 216.219.95.164.47291 > 46.31.27.36.22772: UDP, length 65
17:14:35.001527 IP 46.31.27.36.22772 > 216.219.95.164.47291: UDP, length 81
17:14:35.005398 IP 216.219.95.164.47291 > 46.31.27.36.22772: UDP, length 81
17:14:35.176824 IP 46.31.27.36.22772 > 216.219.95.164.47291: UDP, length 65
17:14:35.176972 IP 46.31.27.36.22772 > 216.219.95.164.47291: UDP, length 289
17:14:35.179451 IP 216.219.95.164.47291 > 46.31.27.36.22772: UDP, length 65
17:14:35.182007 IP 216.219.95.164.47291 > 46.31.27.36.22772: UDP, length 65
17:14:35.417335 IP 46.31.27.36.22772 > 216.219.95.164.47291: UDP, length 193
17:14:35.521256 IP 46.31.27.36.22772 > 216.219.95.164.47291: UDP, length 241
17:14:35.566612 IP 46.31.27.36.22772 > 216.219.95.164.47291: UDP, length 241
17:14:35.891889 IP 46.31.27.36.22772 > 216.219.95.164.47291: UDP, length 81
17:14:35.892633 IP 46.31.27.36.22772 > 216.219.95.164.47291: UDP, length 97
17:14:35.899757 IP 216.219.95.164.47291 > 46.31.27.36.22772: UDP, length 113
17:14:35.901730 IP 216.219.95.164.47291 > 46.31.27.36.22772: UDP, length 129
17:14:36.071461 IP 46.31.27.36.22772 > 216.219.95.164.47291: UDP, length 1297
17:14:36.071463 IP 46.31.27.36.22772 > 216.219.95.164.47291: UDP, length 1297
17:14:36.072419 IP 46.31.27.36.22772 > 216.219.95.164.47291: UDP, length 1297
17:14:36.072808 IP 46.31.27.36.22772 > 216.219.95.164.47291: UDP, length 1297
17:14:36.072810 IP 46.31.27.36.22772 > 216.219.95.164.47291: UDP, length 1297
17:14:36.073749 IP 46.31.27.36.22772 > 216.219.95.164.47291: UDP, length 129
17:14:36.077676 IP 216.219.95.164.47291 > 46.31.27.36.22772: UDP, length 1249
17:14:36.077731 IP 216.219.95.164.47291 > 46.31.27.36.22772: UDP, length 97
17:14:36.077770 IP 216.219.95.164.47291 > 46.31.27.36.22772: UDP, length 97
17:14:36.077803 IP 216.219.95.164.47291 > 46.31.27.36.22772: UDP, length 1297
17:14:36.077842 IP 216.219.95.164.47291 > 46.31.27.36.22772: UDP, length 1249
17:14:36.077883 IP 216.219.95.164.47291 > 46.31.27.36.22772: UDP, length 1249
17:14:36.077925 IP 216.219.95.164.47291 > 46.31.27.36.22772: UDP, length 1297
17:14:36.077985 IP 216.219.95.164.47291 > 46.31.27.36.22772: UDP, length 1249
17:14:36.078024 IP 216.219.95.164.47291 > 46.31.27.36.22772: UDP, length 1073
17:14:36.078075 IP 216.219.95.164.47291 > 46.31.27.36.22772: UDP, length 1297
17:14:36.085800 IP 216.219.95.164.47291 > 46.31.27.36.22772: UDP, length 1297
17:14:36.085851 IP 216.219.95.164.47291 > 46.31.27.36.22772: UDP, length 1297
17:14:36.085883 IP 216.219.95.164.47291 > 46.31.27.36.22772: UDP, length 833
17:14:36.138891 IP 216.219.95.164.47291 > 46.31.27.36.22772: UDP, length 1297
17:14:36.141701 IP 46.31.27.36.22772 > 216.219.95.164.47291: UDP, length 1297
17:14:36.141919 IP 46.31.27.36.22772 > 216.219.95.164.47291: UDP, length 1297
17:14:36.146473 IP 216.219.95.164.47291 > 46.31.27.36.22772: UDP, length 1297
17:14:36.146543 IP 216.219.95.164.47291 > 46.31.27.36.22772: UDP, length 1297
17:14:36.174881 IP 46.31.27.36.22772 > 216.219.95.164.47291: UDP, length 81
17:14:36.209830 IP 216.219.95.164.47291 > 46.31.27.36.22772: UDP, length 1297
17:14:36.229848 IP 216.219.95.164.47291 > 46.31.27.36.22772: UDP, length 81
17:14:36.249740 IP 46.31.27.36.22772 > 216.219.95.164.47291: UDP, length 1297
17:14:36.249741 IP 46.31.27.36.22772 > 216.219.95.164.47291: UDP, length 113
17:14:36.250258 IP 46.31.27.36.22772 > 216.219.95.164.47291: UDP, length 145
17:14:36.250475 IP 46.31.27.36.22772 > 216.219.95.164.47291: UDP, length 145
17:14:36.251016 IP 46.31.27.36.22772 > 216.219.95.164.47291: UDP, length 817
17:14:36.251097 IP 46.31.27.36.22772 > 216.219.95.164.47291: UDP, length 1297
17:14:36.255455 IP 216.219.95.164.47291 > 46.31.27.36.22772: UDP, length 481
17:14:36.255499 IP 216.219.95.164.47291 > 46.31.27.36.22772: UDP, length 97
17:14:36.255527 IP 216.219.95.164.47291 > 46.31.27.36.22772: UDP, length 81
17:14:36.255554 IP 216.219.95.164.47291 > 46.31.27.36.22772: UDP, length 81
17:14:36.255580 IP 216.219.95.164.47291 > 46.31.27.36.22772: UDP, length 113
17:14:36.255609 IP 216.219.95.164.47291 > 46.31.27.36.22772: UDP, length 81
17:14:36.257257 IP 46.31.27.36.22772 > 216.219.95.164.47291: UDP, length 97
17:14:36.257992 IP 46.31.27.36.22772 > 216.219.95.164.47291: UDP, length 225
17:14:36.258119 IP 46.31.27.36.22772 > 216.219.95.164.47291: UDP, length 977
17:14:36.261210 IP 216.219.95.164.47291 > 46.31.27.36.22772: UDP, length 1009
17:14:36.261250 IP 216.219.95.164.47291 > 46.31.27.36.22772: UDP, length 177
17:14:36.262605 IP 216.219.95.164.47291 > 46.31.27.36.22772: UDP, length 81
17:14:36.380867 IP 46.31.27.36.22772 > 216.219.95.164.47291: UDP, length 225
17:14:36.384367 IP 216.219.95.164.47291 > 46.31.27.36.22772: UDP, length 81
17:14:36.400687 IP 46.31.27.36.22772 > 216.219.95.164.47291: UDP, length 65
17:14:36.401081 IP 46.31.27.36.22772 > 216.219.95.164.47291: UDP, length 1329
17:14:36.401098 IP 46.31.27.36.22772 > 216.219.95.164.47291: UDP, length 545
17:14:36.426832 IP 46.31.27.36.22772 > 216.219.95.164.47291: UDP, length 97
17:14:36.426968 IP 46.31.27.36.22772 > 216.219.95.164.47291: UDP, length 97
17:14:36.426969 IP 46.31.27.36.22772 > 216.219.95.164.47291: UDP, length 97
17:14:36.430281 IP 216.219.95.164.47291 > 46.31.27.36.22772: UDP, length 81
17:14:36.432000 IP 46.31.27.36.22772 > 216.219.95.164.47291: UDP, length 81
17:14:36.432000 IP 46.31.27.36.22772 > 216.219.95.164.47291: UDP, length 81
17:14:36.432428 IP 46.31.27.36.22772 > 216.219.95.164.47291: UDP, length 81
17:14:36.455919 IP 216.219.95.164.47291 > 46.31.27.36.22772: UDP, length 65
17:14:36.455994 IP 216.219.95.164.47291 > 46.31.27.36.22772: UDP, length 65
17:14:36.456026 IP 216.219.95.164.47291 > 46.31.27.36.22772: UDP, length 65
17:14:36.502614 IP 216.219.95.164.47291 > 46.31.27.36.22772: UDP, length 257
17:14:36.502658 IP 216.219.95.164.47291 > 46.31.27.36.22772: UDP, length 81
17:14:36.639469 IP 46.31.27.36.22772 > 216.219.95.164.47291: UDP, length 97
17:14:36.639470 IP 46.31.27.36.22772 > 216.219.95.164.47291: UDP, length 81
17:14:36.673346 IP 46.31.27.36.22772 > 216.219.95.164.47291: UDP, length 97
17:14:36.699730 IP 216.219.95.164.47291 > 46.31.27.36.22772: UDP, length 81
17:14:36.705119 IP 216.219.95.164.47291 > 46.31.27.36.22772: UDP, length 81
17:14:36.770155 IP 46.31.27.36.22772 > 216.219.95.164.47291: UDP, length 81
17:14:36.770207 IP 46.31.27.36.22772 > 216.219.95.164.47291: UDP, length 97
17:14:36.777417 IP 216.219.95.164.47291 > 46.31.27.36.22772: UDP, length 129
17:14:36.783107 IP 216.219.95.164.47291 > 46.31.27.36.22772: UDP, length 465
17:14:36.870485 IP 46.31.27.36.22772 > 216.219.95.164.47291: UDP, length 65
17:14:36.871550 IP 46.31.27.36.22772 > 216.219.95.164.47291: UDP, length 1329
17:14:36.871795 IP 46.31.27.36.22772 > 216.219.95.164.47291: UDP, length 513
17:14:36.873913 IP 216.219.95.164.47291 > 46.31.27.36.22772: UDP, length 1249
17:14:36.873970 IP 216.219.95.164.47291 > 46.31.27.36.22772: UDP, length 1249
17:14:36.874012 IP 216.219.95.164.47291 > 46.31.27.36.22772: UDP, length 1249
17:14:36.874037 IP 216.219.95.164.47291 > 46.31.27.36.22772: UDP, length 1249
17:14:36.874076 IP 216.219.95.164.47291 > 46.31.27.36.22772: UDP, length 1249
17:14:36.879100 IP 216.219.95.164.47291 > 46.31.27.36.22772: UDP, length 1249
17:14:36.879140 IP 216.219.95.164.47291 > 46.31.27.36.22772: UDP, length 673
17:14:36.879167 IP 216.219.95.164.47291 > 46.31.27.36.22772: UDP, length 81
17:14:36.925318 IP 216.219.95.164.47291 > 46.31.27.36.22772: UDP, length 65
17:14:36.925356 IP 216.219.95.164.47291 > 46.31.27.36.22772: UDP, length 65
17:14:36.930127 IP 216.219.95.164.47291 > 46.31.27.36.22772: UDP, length 65
17:14:36.948479 IP 46.31.27.36.22772 > 216.219.95.164.47291: UDP, length 81
17:14:36.953681 IP 46.31.27.36.22772 > 216.219.95.164.47291: UDP, length 81
17:14:36.965645 IP 216.219.95.164.47291 > 46.31.27.36.22772: UDP, length 81
17:14:37.000233 IP 216.219.95.164.47291 > 46.31.27.36.22772: UDP, length 81
17:14:37.044976 IP 46.31.27.36.22772 > 216.219.95.164.47291: UDP, length 97
17:14:37.044977 IP 46.31.27.36.22772 > 216.219.95.164.47291: UDP, length 97
17:14:37.050123 IP 46.31.27.36.22772 > 216.219.95.164.47291: UDP, length 97
17:14:37.050124 IP 46.31.27.36.22772 > 216.219.95.164.47291: UDP, length 97
17:14:37.069573 IP 46.31.27.36.22772 > 216.219.95.164.47291: UDP, length 97
17:14:37.070417 IP 46.31.27.36.22772 > 216.219.95.164.47291: UDP, length 737
17:14:37.070418 IP 46.31.27.36.22772 > 216.219.95.164.47291: UDP, length 625
17:14:37.070980 IP 46.31.27.36.22772 > 216.219.95.164.47291: UDP, length 81
17:14:37.073261 IP 46.31.27.36.22772 > 216.219.95.164.47291: UDP, length 721
17:14:37.074642 IP 216.219.95.164.47291 > 46.31.27.36.22772: UDP, length 113
17:14:37.074677 IP 216.219.95.164.47291 > 46.31.27.36.22772: UDP, length 81
17:14:37.076822 IP 46.31.27.36.22772 > 216.219.95.164.47291: UDP, length 769
17:14:37.076904 IP 46.31.27.36.22772 > 216.219.95.164.47291: UDP, length 721
17:14:37.077251 IP 216.219.95.164.47291 > 46.31.27.36.22772: UDP, length 81
17:14:37.077290 IP 216.219.95.164.47291 > 46.31.27.36.22772: UDP, length 81
17:14:37.085395 IP 216.219.95.164.47291 > 46.31.27.36.22772: UDP, length 81
17:14:37.085441 IP 216.219.95.164.47291 > 46.31.27.36.22772: UDP, length 561
17:14:37.085719 IP 46.31.27.36.22772 > 216.219.95.164.47291: UDP, length 97
17:14:37.088492 IP 216.219.95.164.47291 > 46.31.27.36.22772: UDP, length 81
17:14:37.088525 IP 216.219.95.164.47291 > 46.31.27.36.22772: UDP, length 81
17:14:37.088564 IP 216.219.95.164.47291 > 46.31.27.36.22772: UDP, length 1249
17:14:37.088593 IP 216.219.95.164.47291 > 46.31.27.36.22772: UDP, length 1249
17:14:37.088622 IP 216.219.95.164.47291 > 46.31.27.36.22772: UDP, length 1249
17:14:37.088651 IP 216.219.95.164.47291 > 46.31.27.36.22772: UDP, length 1249
17:14:37.088675 IP 216.219.95.164.47291 > 46.31.27.36.22772: UDP, length 177
17:14:37.094461 IP 216.219.95.164.47291 > 46.31.27.36.22772: UDP, length 113
17:14:37.095686 IP 216.219.95.164.47291 > 46.31.27.36.22772: UDP, length 1249
17:14:37.095727 IP 216.219.95.164.47291 > 46.31.27.36.22772: UDP, length 1249
17:14:37.095771 IP 216.219.95.164.47291 > 46.31.27.36.22772: UDP, length 1249
17:14:37.095800 IP 216.219.95.164.47291 > 46.31.27.36.22772: UDP, length 865
17:14:37.095828 IP 216.219.95.164.47291 > 46.31.27.36.22772: UDP, length 1249
17:14:37.095857 IP 216.219.95.164.47291 > 46.31.27.36.22772: UDP, length 1025
17:14:37.135905 IP 46.31.27.36.22772 > 216.219.95.164.47291: UDP, length 65
17:14:37.136352 IP 46.31.27.36.22772 > 216.219.95.164.47291: UDP, length 1329
17:14:37.136353 IP 46.31.27.36.22772 > 216.219.95.164.47291: UDP, length 529
17:14:37.153635 IP 216.219.95.164.47291 > 46.31.27.36.22772: UDP, length 65
17:14:37.153676 IP 216.219.95.164.47291 > 46.31.27.36.22772: UDP, length 65
17:14:37.153700 IP 216.219.95.164.47291 > 46.31.27.36.22772: UDP, length 65
17:14:37.170833 IP 46.31.27.36.22772 > 216.219.95.164.47291: UDP, length 65
17:14:37.171048 IP 46.31.27.36.22772 > 216.219.95.164.47291: UDP, length 1329
17:14:37.171049 IP 46.31.27.36.22772 > 216.219.95.164.47291: UDP, length 529
17:14:37.220829 IP 216.219.95.164.47291 > 46.31.27.36.22772: UDP, length 65
17:14:37.220866 IP 216.219.95.164.47291 > 46.31.27.36.22772: UDP, length 65
17:14:37.220892 IP 216.219.95.164.47291 > 46.31.27.36.22772: UDP, length 65
17:14:37.245472 IP 46.31.27.36.22772 > 216.219.95.164.47291: UDP, length 65
17:14:37.246271 IP 46.31.27.36.22772 > 216.219.95.164.47291: UDP, length 1329
17:14:37.246329 IP 46.31.27.36.22772 > 216.219.95.164.47291: UDP, length 593
17:14:37.246502 IP 46.31.27.36.22772 > 216.219.95.164.47291: UDP, length 1297
17:14:37.246601 IP 46.31.27.36.22772 > 216.219.95.164.47291: UDP, length 1297
17:14:37.247331 IP 46.31.27.36.22772 > 216.219.95.164.47291: UDP, length 129
17:14:37.249914 IP 216.219.95.164.47291 > 46.31.27.36.22772: UDP, length 65
17:14:37.254976 IP 216.219.95.164.47291 > 46.31.27.36.22772: UDP, length 65
17:14:37.255054 IP 216.219.95.164.47291 > 46.31.27.36.22772: UDP, length 65
17:14:37.256252 IP 216.219.95.164.47291 > 46.31.27.36.22772: UDP, length 97
17:14:37.256292 IP 216.219.95.164.47291 > 46.31.27.36.22772: UDP, length 1297
17:14:37.256322 IP 216.219.95.164.47291 > 46.31.27.36.22772: UDP, length 1297
17:14:37.256351 IP 216.219.95.164.47291 > 46.31.27.36.22772: UDP, length 1297
17:14:37.258881 IP 46.31.27.36.22772 > 216.219.95.164.47291: UDP, length 97
17:14:37.258882 IP 46.31.27.36.22772 > 216.219.95.164.47291: UDP, length 97
17:14:37.259146 IP 46.31.27.36.22772 > 216.219.95.164.47291: UDP, length 97
17:14:37.260388 IP 216.219.95.164.47291 > 46.31.27.36.22772: UDP, length 1297
17:14:37.260422 IP 216.219.95.164.47291 > 46.31.27.36.22772: UDP, length 161
17:14:37.265239 IP 46.31.27.36.22772 > 216.219.95.164.47291: UDP, length 1297
17:14:37.265341 IP 46.31.27.36.22772 > 216.219.95.164.47291: UDP, length 1297
17:14:37.266323 IP 46.31.27.36.22772 > 216.219.95.164.47291: UDP, length 97
17:14:37.266341 IP 216.219.95.164.47291 > 46.31.27.36.22772: UDP, length 337
17:14:37.266537 IP 46.31.27.36.22772 > 216.219.95.164.47291: UDP, length 97
17:14:37.266787 IP 46.31.27.36.22772 > 216.219.95.164.47291: UDP, length 97
17:14:37.267079 IP 216.219.95.164.47291 > 46.31.27.36.22772: UDP, length 337
17:14:37.267260 IP 216.219.95.164.47291 > 46.31.27.36.22772: UDP, length 449
17:14:37.269008 IP 46.31.27.36.22772 > 216.219.95.164.47291: UDP, length 129
17:14:37.269273 IP 46.31.27.36.22772 > 216.219.95.164.47291: UDP, length 513
17:14:37.273499 IP 216.219.95.164.47291 > 46.31.27.36.22772: UDP, length 97
17:14:37.273573 IP 216.219.95.164.47291 > 46.31.27.36.22772: UDP, length 1297
17:14:37.273622 IP 216.219.95.164.47291 > 46.31.27.36.22772: UDP, length 1297
17:14:37.275054 IP 216.219.95.164.47291 > 46.31.27.36.22772: UDP, length 1297
17:14:37.275094 IP 216.219.95.164.47291 > 46.31.27.36.22772: UDP, length 1297
17:14:37.275163 IP 216.219.95.164.47291 > 46.31.27.36.22772: UDP, length 113
17:14:37.322471 IP 216.219.95.164.47291 > 46.31.27.36.22772: UDP, length 1297
17:14:37.323699 IP 46.31.27.36.22772 > 216.219.95.164.47291: UDP, length 1297
17:14:37.323915 IP 46.31.27.36.22772 > 216.219.95.164.47291: UDP, length 1297
17:14:37.323996 IP 46.31.27.36.22772 > 216.219.95.164.47291: UDP, length 1297
17:14:37.324521 IP 46.31.27.36.22772 > 216.219.95.164.47291: UDP, length 1297
17:14:37.324522 IP 46.31.27.36.22772 > 216.219.95.164.47291: UDP, length 81
17:14:37.329073 IP 216.219.95.164.47291 > 46.31.27.36.22772: UDP, length 1297
17:14:37.329115 IP 216.219.95.164.47291 > 46.31.27.36.22772: UDP, length 1297
17:14:37.329150 IP 216.219.95.164.47291 > 46.31.27.36.22772: UDP, length 1297
17:14:37.329191 IP 216.219.95.164.47291 > 46.31.27.36.22772: UDP, length 1297
17:14:37.331625 IP 216.219.95.164.47291 > 46.31.27.36.22772: UDP, length 1297
17:14:37.338575 IP 46.31.27.36.22772 > 216.219.95.164.47291: UDP, length 1297
17:14:37.338934 IP 46.31.27.36.22772 > 216.219.95.164.47291: UDP, length 1297
17:14:37.339026 IP 46.31.27.36.22772 > 216.219.95.164.47291: UDP, length 1297
17:14:37.345355 IP 216.219.95.164.47291 > 46.31.27.36.22772: UDP, length 1297
17:14:37.345400 IP 216.219.95.164.47291 > 46.31.27.36.22772: UDP, length 81
17:14:37.351606 IP 216.219.95.164.47291 > 46.31.27.36.22772: UDP, length 1297
17:14:37.351650 IP 216.219.95.164.47291 > 46.31.27.36.22772: UDP, length 1297
17:14:37.391893 IP 46.31.27.36.22772 > 216.219.95.164.47291: UDP, length 81
17:14:37.400604 IP 216.219.95.164.47291 > 46.31.27.36.22772: UDP, length 1297
17:14:37.401866 IP 216.219.95.164.47291 > 46.31.27.36.22772: UDP, length 1297
17:14:37.420434 IP 46.31.27.36.22772 > 216.219.95.164.47291: UDP, length 81
17:14:37.428737 IP 216.219.95.164.47291 > 46.31.27.36.22772: UDP, length 81
17:14:37.429410 IP 46.31.27.36.22772 > 216.219.95.164.47291: UDP, length 1297
17:14:37.431463 IP 46.31.27.36.22772 > 216.219.95.164.47291: UDP, length 225
17:14:37.431907 IP 46.31.27.36.22772 > 216.219.95.164.47291: UDP, length 1057
17:14:37.436763 IP 216.219.95.164.47291 > 46.31.27.36.22772: UDP, length 81
17:14:37.436862 IP 216.219.95.164.47291 > 46.31.27.36.22772: UDP, length 1009
17:14:37.437791 IP 46.31.27.36.22772 > 216.219.95.164.47291: UDP, length 97
17:14:37.442245 IP 216.219.95.164.47291 > 46.31.27.36.22772: UDP, length 81
17:14:37.444124 IP 216.219.95.164.47291 > 46.31.27.36.22772: UDP, length 177
17:14:37.445360 IP 46.31.27.36.22772 > 216.219.95.164.47291: UDP, length 1297
17:14:37.445565 IP 46.31.27.36.22772 > 216.219.95.164.47291: UDP, length 577
17:14:37.445611 IP 46.31.27.36.22772 > 216.219.95.164.47291: UDP, length 145
17:14:37.453173 IP 216.219.95.164.47291 > 46.31.27.36.22772: UDP, length 593
17:14:37.456126 IP 216.219.95.164.47291 > 46.31.27.36.22772: UDP, length 1009
17:14:37.456195 IP 216.219.95.164.47291 > 46.31.27.36.22772: UDP, length 177
17:14:37.462305 IP 46.31.27.36.22772 > 216.219.95.164.47291: UDP, length 97
17:14:37.466001 IP 46.31.27.36.22772 > 216.219.95.164.47291: UDP, length 97
17:14:37.468745 IP 46.31.27.36.22772 > 216.219.95.164.47291: UDP, length 97
17:14:37.469624 IP 216.219.95.164.47291 > 46.31.27.36.22772: UDP, length 113
17:14:37.470010 IP 46.31.27.36.22772 > 216.219.95.164.47291: UDP, length 97
17:14:37.470126 IP 46.31.27.36.22772 > 216.219.95.164.47291: UDP, length 97
17:14:37.475472 IP 216.219.95.164.47291 > 46.31.27.36.22772: UDP, length 81
17:14:37.477319 IP 46.31.27.36.22772 > 216.219.95.164.47291: UDP, length 81
17:14:37.480440 IP 216.219.95.164.47291 > 46.31.27.36.22772: UDP, length 209
17:14:37.484458 IP 216.219.95.164.47291 > 46.31.27.36.22772: UDP, length 209
17:14:37.485640 IP 216.219.95.164.47291 > 46.31.27.36.22772: UDP, length 1297
17:14:37.490064 IP 216.219.95.164.47291 > 46.31.27.36.22772: UDP, length 209
17:14:37.496199 IP 216.219.95.164.47291 > 46.31.27.36.22772: UDP, length 1297
17:14:37.496242 IP 216.219.95.164.47291 > 46.31.27.36.22772: UDP, length 1297
17:14:37.501843 IP 216.219.95.164.47291 > 46.31.27.36.22772: UDP, length 1297
17:14:37.506292 IP 216.219.95.164.47291 > 46.31.27.36.22772: UDP, length 1297
17:14:37.513135 IP 216.219.95.164.47291 > 46.31.27.36.22772: UDP, length 1297
17:14:37.515884 IP 46.31.27.36.22772 > 216.219.95.164.47291: UDP, length 65
17:14:37.516281 IP 46.31.27.36.22772 > 216.219.95.164.47291: UDP, length 1329
17:14:37.516298 IP 46.31.27.36.22772 > 216.219.95.164.47291: UDP, length 529
17:14:37.516538 IP 216.219.95.164.47291 > 46.31.27.36.22772: UDP, length 1297
17:14:37.523185 IP 216.219.95.164.47291 > 46.31.27.36.22772: UDP, length 1297
17:14:37.528206 IP 216.219.95.164.47291 > 46.31.27.36.22772: UDP, length 1297
17:14:37.533208 IP 216.219.95.164.47291 > 46.31.27.36.22772: UDP, length 1297
17:14:37.538480 IP 216.219.95.164.47291 > 46.31.27.36.22772: UDP, length 65
17:14:37.538521 IP 216.219.95.164.47291 > 46.31.27.36.22772: UDP, length 1297
17:14:37.539685 IP 216.219.95.164.47291 > 46.31.27.36.22772: UDP, length 65
17:14:37.539725 IP 216.219.95.164.47291 > 46.31.27.36.22772: UDP, length 1297
17:14:37.539750 IP 216.219.95.164.47291 > 46.31.27.36.22772: UDP, length 65
17:14:37.544229 IP 216.219.95.164.47291 > 46.31.27.36.22772: UDP, length 1297
17:14:37.553103 IP 216.219.95.164.47291 > 46.31.27.36.22772: UDP, length 1297
17:14:37.554274 IP 216.219.95.164.47291 > 46.31.27.36.22772: UDP, length 1297
17:14:37.558655 IP 216.219.95.164.47291 > 46.31.27.36.22772: UDP, length 1297
17:14:37.563063 IP 216.219.95.164.47291 > 46.31.27.36.22772: UDP, length 1297
17:14:37.568569 IP 216.219.95.164.47291 > 46.31.27.36.22772: UDP, length 1297
17:14:37.571477 IP 46.31.27.36.22772 > 216.219.95.164.47291: UDP, length 209
17:14:37.572701 IP 46.31.27.36.22772 > 216.219.95.164.47291: UDP, length 625
17:14:37.573587 IP 216.219.95.164.47291 > 46.31.27.36.22772: UDP, length 1297
17:14:37.573632 IP 216.219.95.164.47291 > 46.31.27.36.22772: UDP, length 81
17:14:37.574774 IP 216.219.95.164.47291 > 46.31.27.36.22772: UDP, length 81
17:14:37.578088 IP 216.219.95.164.47291 > 46.31.27.36.22772: UDP, length 1297
17:14:37.582500 IP 216.219.95.164.47291 > 46.31.27.36.22772: UDP, length 1297
17:14:37.586970 IP 216.219.95.164.47291 > 46.31.27.36.22772: UDP, length 1297
17:14:37.591592 IP 216.219.95.164.47291 > 46.31.27.36.22772: UDP, length 1297
17:14:37.599212 IP 216.219.95.164.47291 > 46.31.27.36.22772: UDP, length 1297
17:14:37.599512 IP 46.31.27.36.22772 > 216.219.95.164.47291: UDP, length 65
17:14:37.599937 IP 46.31.27.36.22772 > 216.219.95.164.47291: UDP, length 1329
17:14:37.599955 IP 46.31.27.36.22772 > 216.219.95.164.47291: UDP, length 625
17:14:37.601686 IP 216.219.95.164.47291 > 46.31.27.36.22772: UDP, length 65
17:14:37.601720 IP 216.219.95.164.47291 > 46.31.27.36.22772: UDP, length 65
17:14:37.601763 IP 216.219.95.164.47291 > 46.31.27.36.22772: UDP, length 1297
17:14:37.602039 IP 216.219.95.164.47291 > 46.31.27.36.22772: UDP, length 65
17:14:37.606458 IP 216.219.95.164.47291 > 46.31.27.36.22772: UDP, length 1297
17:14:37.606623 IP 46.31.27.36.22772 > 216.219.95.164.47291: UDP, length 65
17:14:37.607038 IP 46.31.27.36.22772 > 216.219.95.164.47291: UDP, length 81
17:14:37.607685 IP 46.31.27.36.22772 > 216.219.95.164.47291: UDP, length 1329
17:14:37.607699 IP 46.31.27.36.22772 > 216.219.95.164.47291: UDP, length 529
17:14:37.612137 IP 216.219.95.164.47291 > 46.31.27.36.22772: UDP, length 1297
17:14:37.613862 IP 46.31.27.36.22772 > 216.219.95.164.47291: UDP, length 81
17:14:37.616219 IP 216.219.95.164.47291 > 46.31.27.36.22772: UDP, length 1297
17:14:37.621751 IP 216.219.95.164.47291 > 46.31.27.36.22772: UDP, length 1297
17:14:37.623451 IP 46.31.27.36.22772 > 216.219.95.164.47291: UDP, length 97
17:14:37.625476 IP 216.219.95.164.47291 > 46.31.27.36.22772: UDP, length 81
17:14:37.625547 IP 216.219.95.164.47291 > 46.31.27.36.22772: UDP, length 1297
17:14:37.626411 IP 46.31.27.36.22772 > 216.219.95.164.47291: UDP, length 81
17:14:37.626623 IP 46.31.27.36.22772 > 216.219.95.164.47291: UDP, length 81
17:14:37.630261 IP 216.219.95.164.47291 > 46.31.27.36.22772: UDP, length 1297
17:14:37.635887 IP 216.219.95.164.47291 > 46.31.27.36.22772: UDP, length 1297
17:14:37.640182 IP 46.31.27.36.22772 > 216.219.95.164.47291: UDP, length 81
17:14:37.641109 IP 216.219.95.164.47291 > 46.31.27.36.22772: UDP, length 1297
17:14:37.645211 IP 46.31.27.36.22772 > 216.219.95.164.47291: UDP, length 81
17:14:37.646078 IP 216.219.95.164.47291 > 46.31.27.36.22772: UDP, length 1297
17:14:37.647888 IP 216.219.95.164.47291 > 46.31.27.36.22772: UDP, length 65
17:14:37.647964 IP 216.219.95.164.47291 > 46.31.27.36.22772: UDP, length 65
17:14:37.648010 IP 216.219.95.164.47291 > 46.31.27.36.22772: UDP, length 65
17:14:37.650275 IP 216.219.95.164.47291 > 46.31.27.36.22772: UDP, length 1297
17:14:37.651282 IP 46.31.27.36.22772 > 216.219.95.164.47291: UDP, length 1297
17:14:37.651283 IP 46.31.27.36.22772 > 216.219.95.164.47291: UDP, length 1297
17:14:37.652166 IP 46.31.27.36.22772 > 216.219.95.164.47291: UDP, length 129
17:14:37.652623 IP 46.31.27.36.22772 > 216.219.95.164.47291: UDP, length 561
17:14:37.652978 IP 46.31.27.36.22772 > 216.219.95.164.47291: UDP, length 561
17:14:37.653077 IP 46.31.27.36.22772 > 216.219.95.164.47291: UDP, length 561
17:14:37.654549 IP 46.31.27.36.22772 > 216.219.95.164.47291: UDP, length 561
17:14:37.655011 IP 46.31.27.36.22772 > 216.219.95.164.47291: UDP, length 561
17:14:37.655255 IP 46.31.27.36.22772 > 216.219.95.164.47291: UDP, length 561
17:14:37.655954 IP 46.31.27.36.22772 > 216.219.95.164.47291: UDP, length 97
17:14:37.658745 IP 216.219.95.164.47291 > 46.31.27.36.22772: UDP, length 1329
17:14:37.658831 IP 216.219.95.164.47291 > 46.31.27.36.22772: UDP, length 1329
17:14:37.658884 IP 216.219.95.164.47291 > 46.31.27.36.22772: UDP, length 641
17:14:37.658925 IP 216.219.95.164.47291 > 46.31.27.36.22772: UDP, length 1297
17:14:37.658990 IP 216.219.95.164.47291 > 46.31.27.36.22772: UDP, length 81
17:14:37.659038 IP 216.219.95.164.47291 > 46.31.27.36.22772: UDP, length 1329
17:14:37.659084 IP 216.219.95.164.47291 > 46.31.27.36.22772: UDP, length 1329
17:14:37.659130 IP 216.219.95.164.47291 > 46.31.27.36.22772: UDP, length 1329
17:14:37.660439 IP 46.31.27.36.22772 > 216.219.95.164.47291: UDP, length 561
17:14:37.660561 IP 46.31.27.36.22772 > 216.219.95.164.47291: UDP, length 561
17:14:37.660561 IP 46.31.27.36.22772 > 216.219.95.164.47291: UDP, length 561
17:14:37.661345 IP 216.219.95.164.47291 > 46.31.27.36.22772: UDP, length 1329
17:14:37.661400 IP 216.219.95.164.47291 > 46.31.27.36.22772: UDP, length 1329
17:14:37.661480 IP 216.219.95.164.47291 > 46.31.27.36.22772: UDP, length 1329
17:14:37.661541 IP 216.219.95.164.47291 > 46.31.27.36.22772: UDP, length 1329
17:14:37.661600 IP 216.219.95.164.47291 > 46.31.27.36.22772: UDP, length 1329
17:14:37.661660 IP 216.219.95.164.47291 > 46.31.27.36.22772: UDP, length 1329
17:14:37.661721 IP 216.219.95.164.47291 > 46.31.27.36.22772: UDP, length 1329
17:14:37.661780 IP 216.219.95.164.47291 > 46.31.27.36.22772: UDP, length 1329
17:14:37.661838 IP 216.219.95.164.47291 > 46.31.27.36.22772: UDP, length 1329
17:14:37.661899 IP 216.219.95.164.47291 > 46.31.27.36.22772: UDP, length 1297
17:14:37.665297 IP 216.219.95.164.47291 > 46.31.27.36.22772: UDP, length 81
17:14:37.666251 IP 46.31.27.36.22772 > 216.219.95.164.47291: UDP, length 81
17:14:37.666604 IP 216.219.95.164.47291 > 46.31.27.36.22772: UDP, length 1329
17:14:37.666672 IP 216.219.95.164.47291 > 46.31.27.36.22772: UDP, length 1329
17:14:37.666748 IP 216.219.95.164.47291 > 46.31.27.36.22772: UDP, length 1329
17:14:37.666812 IP 216.219.95.164.47291 > 46.31.27.36.22772: UDP, length 1329
17:14:37.668036 IP 216.219.95.164.47291 > 46.31.27.36.22772: UDP, length 1297
17:14:37.670527 IP 216.219.95.164.47291 > 46.31.27.36.22772: UDP, length 1329
17:14:37.670585 IP 216.219.95.164.47291 > 46.31.27.36.22772: UDP, length 1329
17:14:37.670620 IP 216.219.95.164.47291 > 46.31.27.36.22772: UDP, length 81
17:14:37.673738 IP 216.219.95.164.47291 > 46.31.27.36.22772: UDP, length 1329
17:14:37.673797 IP 216.219.95.164.47291 > 46.31.27.36.22772: UDP, length 1329
17:14:37.674111 IP 216.219.95.164.47291 > 46.31.27.36.22772: UDP, length 1297
17:14:37.674160 IP 216.219.95.164.47291 > 46.31.27.36.22772: UDP, length 1329
17:14:37.674200 IP 216.219.95.164.47291 > 46.31.27.36.22772: UDP, length 1329
17:14:37.675557 IP 216.219.95.164.47291 > 46.31.27.36.22772: UDP, length 1297
17:14:37.676600 IP 46.31.27.36.22772 > 216.219.95.164.47291: UDP, length 81
17:14:37.676988 IP 216.219.95.164.47291 > 46.31.27.36.22772: UDP, length 1329
17:14:37.678180 IP 216.219.95.164.47291 > 46.31.27.36.22772: UDP, length 1329
17:14:37.679555 IP 216.219.95.164.47291 > 46.31.27.36.22772: UDP, length 1329
17:14:37.682030 IP 216.219.95.164.47291 > 46.31.27.36.22772: UDP, length 1329
17:14:37.682081 IP 216.219.95.164.47291 > 46.31.27.36.22772: UDP, length 1297
17:14:37.686460 IP 46.31.27.36.22772 > 216.219.95.164.47291: UDP, length 81
17:14:37.688223 IP 216.219.95.164.47291 > 46.31.27.36.22772: UDP, length 1297
17:14:37.688300 IP 216.219.95.164.47291 > 46.31.27.36.22772: UDP, length 1297
17:14:37.692857 IP 216.219.95.164.47291 > 46.31.27.36.22772: UDP, length 1297
17:14:37.698592 IP 46.31.27.36.22772 > 216.219.95.164.47291: UDP, length 81
17:14:37.699773 IP 216.219.95.164.47291 > 46.31.27.36.22772: UDP, length 1297
